2742ea1d4a739db15fb9f500fc8a3ac25a774e4f	127191418	1	近4K购入的稀有原创作品！史无前例！妹子从长相、身材、玩法、睡死程度秒杀之前一切作品！长靴黑丝1米7几的超级大长腿极品身材妹子被下药后完全死猪状态
43d812e711fe913001855b6a3a67c05c4b5082a9	41247173	1	老婆妹妹来投宿，性感内衣看得我心砰然动心晚上受不了等老婆睡着强行把小姨子猛干，老婆就在旁边 偷情真刺激
4de08fcb3e473a214d7e7329a40eddc9b950a7f4	1653361236	1	开朗活拨的小少妇露脸身材还不错，很有情趣爱说爱笑奶子很正，大黑牛玩弄骚逼呻吟，劲歌热舞奶子乱颤
a27969c1df61a193351e2bdeace832e855b2643b	1486774985	5	The Best Of Alyssia Kent
a27ea5d5d84e2ddf055f63725d3406b3e3f142f9	54829243	6	Coast To Coast AM 10-13-2014 - Timetrak Predictions - Secret Space War - JFK Assassination
af62ad96a74e1df29f6c5c4dedcec1365cc5b185	841220096	23	SDMT-213
b2d257d8e227c0a246d10a5722c61b8d4dfe2955	7560922653	12	2006 - Organ Works - Gerd Zacher (SACD-R)
ef1eaf20fa08426e8f556b9adeba034bb8cf03d4	50465199	1	真正灌醉小少妇 各种调戏 爽时还会呻吟做出反应 奶子粉嫩 非常刺激
f998508fd33cbfff215c6435dd2142f3ffbe716d	24968607	1	《酒店偷情偷拍》大哥约年轻美少妇吃完外卖撸串上床啪啪
