00f122d7cdd4fc42c343e712a204dd854099a222	137953020	1	表妹说我们家蚊子真多,把她身上咬的全是红疙瘩,我问她胸前两个包是不是也是蚊子咬的
00a38d1d1e50cfadeafe21457fac4330f8f165c3	22751604	1	国产TS系列伪娘余喵喵和咕噜一起给直男主人舔脚 两只小母狗乖巧的趴着被双飞后入
01bb4de865fd5253003e462651a8a261280dd720	676203244	1	富二代约操学院派苗条美少女青春水手制服诱惑沙发上爆操说好痛好粗好粗快点啊啊大声淫叫呻吟动人对白淫荡
01e989e68d09bb797dac2568cf3894ea7394c428	61308441	1	系列哥第二部抓嫖女警之应招女郎被拍裸照主动送操高清完整版
019559169fdfeae49c8b80d30741d026ecb15cc8	1770907030	4	Greys.Anatomy.S17E15.1080p.WEB.H264-PLZPROPER[rarbg]
014b52c53cc400aa55b9df233a47bdc7819788e0	148720949	1	国内某大学真实偷拍系列6 零距离接触清纯学生MM
03f8ca99be40b65023a640164707886109516c91	32752067	1	提前返校就是为了操到我的极品蜂腰美臀小女友 特别骚 特别喜欢我的大J8使劲操她的小浪穴 逼紧水多特别舒服
04529297a6a8811aaaea37db41724aea5707b89d	835039577	3	The.Retreat.2021.720p.WEBRip.800MB.x264-GalaxyRG[TGx]
0561efe7862dc16332dfef68074f36e5eccdfc63	232927204	2	约啪大连开发区山河秀景小区良家小少妇，附近的狼友看认识吗
054c3b4c18b9874f55cac4cbe0864971137d7169	1084004465	1	女神级气质无毛大学美女酒店援交时被变态男一直猛操嘴巴,实在受不了了美女自己坐在鸡鸡上干.国语!
05ad542db5b03786fadcd92db9b91516495187d3	916067569	1	暴力迷操00后纹身少毛小太妹骚货,翻眼打打脸扯耳还是嫩妹玩的爽
072f587aa0439fd2e2d0a260fd4376bcb2ad284b	36245102	1	重金约战马来三线女影星,38E美胸,170CM大长腿
07d5b4728440e6c5c7336b26fc0d58afb6454fa6	45949857	1	高颜值喷水女王大黑牛玩嗨 约炮新男主操逼啪啪 无套骑乘狂喷高潮 玩太嗨玩过敏了 高清源码录制
09b7e8f61863730daa1874392794d0df2c11a1c2	35383907	1	城中村嫖妓这次妞还不错排骨哥太猴急一个不留神就射了
091ce93dc4ea32f452e65930b3e90715e580afe6	33355632	1	泰国探花 泰国小姐姐玩扑克输了脱衣服舔鸡巴变被要求用筷子夹舔还在那开心的笑个没玩！
0ad68683a20815172e0a78b84886098005c284f1	724063877	2	Halloween (1978) 1080p.BluRay.x264.Full 744MB
0b1fa72adf850fc42b0e4d95163c3144e643da5c	25117833	1	饥渴少妇露脸约炮附近小哥黑丝情趣睡衣装，扒下裤子就给口交大鸡巴让大哥给舔逼抓奶子，激烈抽插貌似内射
0b76c87dfe82afcbaf0444bbfdad0e837c47e567	107493248	29	2021-05-21有聲小說1
0b1fb8136e65bc81f6a0f88a8527b59c838b79b4	198911025	1	高颜值双妖TS小语X秀妈,淫荡的呻吟声跟真女没啥不停，只是多了个鸡鸡被艹得变小晃来晃去，贼激情！
0b234455c65d1ca8baff8cbef5de0067acd9c8d0	28577660	1	韩裔大学妹自拍流出可爱脸蛋灵动大眼少女认真给男友口交服务大屌操美逼
0c7340fe092981abdc7e1738376dc393529ed442	36111821	1	颜值不错美女主播初夏 大秀 穿着情趣内衣激情自慰 十分淫荡
0c64b301da4163abfe94064c114b03df8c4f2cf9	1777848473	4	Sam.and.Elvis.2018.1080p.WEBRip.x264-RARBG
0d1e528d82219eeec0464efbe8830375fc830360	27166934	1	小女孩被老汗后入狂插，不过瘾还得用大黄瓜插B才能满足
0d6fbaff51d26cb21bb8ab1b12a4567c7cb4d298	5885802744	9	Emerson Lake & Palmer - Live at Montreux 1997 (2015) [DVD9 NTSC]
0da445a2729fe6a0cc1b38a7e5e773c6d30eeca4	58573596	1	和极品女友真实做爱精彩汇编 第一视角，全特写
0d6bf9da70a6afacb51ef882ab152a2734b2fbad	53886666	100	2021.05.13_Stunning18.com_Veta_Girl-in-Fur-Shrug
0e17363778f9f65f0e30ba6d3ce6b99b0f5d2836	37495974	1	高颜值越韩混血美女自拍福利视频第三部浴室浴缸全裸自摸
0e5ddfd91fce160df5a7693c3a4315147102bf60	423795669	6	36
0e0e2eb1d18e6536f19f6c002b273e2a3c24206b	27925626	1	高清双镜头多视角与兄弟一起爆插高端外围女
0e99e249b3ef36adb4b02197748d9a77df7ace7d	463676736	1	SexMex.21.05.20.Pecosa.Double.Payment.To.The.Collectors.XXX.720p.MP4-XXX
0fc48f2b4983f6218db38dcd97e4e352fdb6f477	36250683	1	兄弟背上贴满膏药操逼还这么猛
0f260c4937bb68c4e2d62ed4162a0293eff47cdc	34723732	1	极品萝莉靓妹『大二学妹』勾引美团送药小哥全裸激情啪啪 无套肆意抽插浪穴 跪舔裹射口爆 爽翻天啊 高清源码录制
10524dde757d22902138516eeba8d543414ac170	21547380	1	【全国探花】老哥约了个高颜值粉衣妹子TP啪啪，还不怎么会口交大力猛操
118f2526cfe63830ecbf1c29beb05db3e2a3564c	35180201	1	疫情期间小骚货『灰灰』表兄妹在家乱伦 无套啪啪 尽情欢愉
11349226c19868be59a4e8b256a9b5d235ef68a3	35582126	1	颜值不错蓝发妹子道具自慰秀 情趣装开裆肉丝按摩器震动头部插入呻吟娇喘 很是诱惑喜欢不要错过
1292ecbcb354835c30db612011802e11bdfe611d	47139676	1	高颜值网红美女瞳孔最新作品-小鲜肉男友操完后睡到半夜又要干,美女说：你再动,我用BB咬你JJ了!从不愿意到高潮
13a55ba3324536604e407b1b1d0d11fd9011ba8d	26407196	1	【王富贵探花兼职专场】小伙约操白嫩小少妇，大胸温柔体贴，沙发上口交啪啪后入劲爆刺激
143ab123a72f7d69f8794720d6c6759aa5a2a51d	2247803665	9	Terra Alia [FitGirl Repack]
14f79e23ba15401f4fdeecdb0eba9983c006ce30	8239463	1	鸭总侦探太子代班约了个黑色长裙性感少妇啪啪，口交69姿势舔逼上位骑乘后入抽插猛操
14da8db431b1b038045969a321e2f5a14cf6f859	33137725	1	橙橙小萝莉深夜户外露出啪啪，带项圈马路边爬行给主人口交后入爆菊，全裸跳蛋赛比捆绑
143058e5edb4c88caeeec2fbc8b0dff0784d5bb0	22786223	1	91约炮大神M先生郑州酒店约炮性感情趣内衣女网友后入双镜头拍摄
14574a6af7f2d44e6bd927bff17f654144b241f3	36822967	1	颜值很高的大奶子黑丝女神全程露脸大秀诱惑，开档黑丝大奶子翘屁股自己揉捏撩骚表情淫荡，自慰骚逼流淫水
1562e7fb704400bdd04c736e3c1997b3b9890541	337410932	1	电脑桌子前直接按倒借电脑的邻居少妇
15cbb03eab27d61c87a407d28b0e52eeb4ed84f3	103673023	1	91大嘴哥最新原创精品大片-公司超级美腿女员工，极品白嫩黑丝美腿女神被狠狠蹂躏，阴毛浓密性欲超强，上位扭动骚臀，淫叫不止爽翻天，画风唯美
170e30d2e3cc9c5af3220c9633e806be7c136d11	2486142939	1	PPBD-170
17a0107f10b3755f0603d0c04f92d6ff447675e7	45163334	1	和女友出去度假 直接大白天在海滩上操逼 真是刺激啊
1a2e01264ff52f5b5ba3964c53c4ce5e7cd7e49a	45100949	1	社会精神小伙公寓网约上门性服务的可爱漂亮虎牙妹纹身很酷开始有点装最后在客厅被各种体位狠狠干对白精彩
1cb65f577277448eb897c71219ac4db8980a3fce	88547458	1	美女主播和她的炮友在阳台上啪啪 还玩灌肠 开发菊花 很刺激
1cba992675dd035281c98cec18a4430fa7d332ce	26769498	1	厨房骚扰小骚货 厨房干到床上激情啪啪
1e18e96e76dfcfda689d49d53e40e089193bd12f	76984052	1	吃嫩草大神嫖客君爷体验大波长发妹子性服务啪啪啪干的大奶子乱抖呻吟娇嫩边干边聊天很有亲切感
1e2b0565a200f64a466eab5e38964279128566fc	29820783	1	高颜值童颜巨乳主播涵宝宝露脸视讯先抽根烟然后在开始秀这对大波够玩到虚脱清晰对白
2112fbedb56d70acf4fa5aaf7ccaa33afef3c432	74770445	1	小鸟酱
2127463398e9f7ab416be2538bc99c3177547bc1	32372416	1	高颜值双马尾萌妹子开裆肉丝道具自慰，大黑牛震动头部插入高潮出白浆淫叫不断
214422a59f1048f825be04696b97e4cb935a49c9	32118035	1	丰满骚情美少妇勾搭了个黑人 黑人就是屌大 口交啪啪 十分淫荡
228de404fa686180a99f603fed045b7ec466d0b4	1906930497	1	Fc2 PPV 1827016子供っぽい身体つきの18歳学生の無避妊ま◯こに人生初中出し お洒落さんなのに垢抜けない未熟体型がそそります
22f4bcd165e275602814723e73e58350535bf8c1	28254645	1	高颜值美乳嫩穴性感美女趁男友不在和网友情人家中偷情,饥不择食,性欲旺盛,刚干完立马口硬继续求操,真疯狂!
23d4256bcb30c0549c86764679baa61e51c819fe	180782265	2	Kanye West - Famous (Ft Rihanna & Swizz Beatz) [Official Video + Mp3]
242fba5872d8b79b4b2458e9a7eafc0b422df09e	58174737	1	模特工作室流出国模雨婷制服诱惑被歹徒捆绑假屌插逼高清无水印
25cc35c68723ab5a5ab3842352e3dc2ace0345d8	653984144	1	91鼠哥最新绝美精品大片高端网红系列第十一季-番号SG011：香港富商包养的38F巨乳小网红完整版
26a349b20a0ec52ca428f922babf356858d977ac	23796516	1	妹妹是魔鬼啊～大白天和哥哥操逼～高清录制～新鲜出炉
283dd0b45bea3e6907e374d3a04dc2c61366ee94	27598580	1	年轻男女极品姐妹团直播大秀 妹子清纯漂亮 激情啪啪
29e132ae276543d8b0ad138c1593b6fe922a2bbc	1684783822	1	晓龙女气质长相甜美红唇眼镜妹子和炮友啪啪，骑脸舔逼上位骑坐性感屁股特写抽插
2997a32294acd29d33eda14d076aaf06d16397f8	548362232	12	Torrenting.com - PublicBang 21 05 21 Blondie Fesser XXX XviD-iPT Team
2a7beae03b26ab651b68d3fee67bf3f7cabfc688	36703464	1	和白衫女友出租屋激情干一炮 衣服没脱直接骑上去操 不带套直接插浪穴 内射中出 射完玩骚逼 高清720P完整版
2cabe324f19cb3c7bdd259e053381b0963802b4b	47278758	1	系列哥情景巨作-私人定制篇：强操女上司 黑丝高跟OL职业装108P高清无水印完整版
2c9f0711548313baa941de7f8ded82f6c822da76	37360126	1	风流哥会所体验极品黑丝服务员的毒龙口爆720P无水印
2f85c494c0c771c1f44c3af4edaacfc214c13230	56094826	1	最新网红少女『恶犬』大尺度VIP版新作-新娘套装女神堕落 淫荡揉玩超粉嫩浪穴 妩媚呻吟高潮 高清720P完整版
2f9d02d5a1b5631be3fabc3578cac54bbe57a56d	2020071343	5	[ReinForce] Gotoubun no Hanayome ∬ Vol 3 (BDRip 1920x1080 x264 FLAC)
30a68a8febe86e254c2831ee13f0f23d04186e68	67898176	1	99年清纯水嫩的小美女辍学后在酒吧上班被男领班甜言蜜语哄到宾馆啪啪,鲍鱼嫩的只有少许毛毛,拍摄时很害羞!
326d990f03518193ce4217d403270fd137ae1101	25517778	1	颜值不错长相甜美萌妹子道具自慰秀 全裸跳蛋塞逼逼挺粉嫩非常诱人
326c6b7129606460e68a5e3b6b1ff53dfa0c5209	47494871	1	梅子一王二后激情啪啪大秀 口交啪啪自慰 十分淫荡
32d784d8ae70d2f725bc1387718965aa5af0808b	46323415	1	极品白嫩青春美少女Tumblr萌妹子福利姬悠宝情趣制服与浴缸嬉戏 一线天小嫩逼 娇挺美乳 高清1080P无水印原版
32a6e4c731e8371d0e464ce917636b84dd44ffd9	17539660	1	黑丝妹子酒店约炮猛男激情做爱，69，舔屁眼样样精通
33bdd5706ce00cc0ee212e837f571a19eff6a89a	23600982	1	在家约操了个高颜值极品小姐姐 身材高挑 大奶子晃的眼晕
330e25ec715cc29f78e3ea93dade5ce407dad6a0	42219920	1	90后女生-苏晴，毛还没张齐，野外被三汉子车轮干
338e3a8f9b2f0816bc6a7874a6dc6287ce2b7ec6	45689062	1	【360水滴TP】最新宾馆主题台-情侣开房做爱全程实录，身材不错细腰翘臀各种姿势插入，对白清晰
346f325aa8596281be660080fe61d8052933eb0a	20366575	1	极品网红剧情演绎玩母子乱伦 真实刺激对白超级淫荡
346f393c12f15c7842895ccf7eed3307019b5591	30926387	1	超高颜值网红美女小白兔高价房票自慰大秀美乳粉穴叫声非常诱人画面很有撸点对白淫荡4V2
346f3a949b65d7db595107dd04afef0f4dee0fb2	235024015	2	极品身材酒吧啤酒女销售约到家里一边吸着麻古一边吃屌快活似神仙
35e01f105a5333baf357200273c7119c2069909b	64449047	1	【爆乳网红女神】秀人网嫩模『美七』女神大尺度魅惑露点诱惑私拍流出 童颜巨乳超诱惑 一手难抓的爆乳 高清720P版
3789732dd83dfc7bcc396bcf54529f42e469f73f	91142616	1	阳光明媚迷情小树林，身材不错的小奶猫跟大哥户外激情，摸着奶子抠着逼水多直接上位，爆草抽插大奶子乱晃
37cc057edd1c0e8891ae4a7edb48fafe3ecb0387	39454389	1	91boss3P臀蜜淫荡小骚货 渔网黑丝前后夹击激烈抽插屁股打的通红
37be65cd49e6675f329502fc25500a41782bcaab	8518382095	6	The.Me.You.Cant.See.S01.720p.ATVP.WEB-DL.DD5.1.x264-KOGi[rartv]
38b97cd99e9af84a07957a9fae44f34b5998b9e6	1543027490	1	精选全网高清作品系列25：高三学妹之堕落吞精真TM吞精无码露脸720P完整版
3a7cc03271b67ad3ba936007136d67a1933638d0	54521833	1	蜂腰细臀的风骚轻熟女舞蹈诱惑系列8 屁股像装了小马达一样抖的让人心动
3b01168639878ebdc7a250c45f85395ae2d16002	146914259	10	【午夜寻花】，大神爱徒精彩首秀，苗条大长腿小姐姐，抠穴观音坐莲深得师傅精髓，高清源码录制
3d19342a95755d0e973c36f640a294746aadf64e	28764931	1	高颜值美女跳蛋塞逼逼震动自慰第五部 逼逼很粉嫩跳蛋塞抽插自慰高潮出白浆
3e4efaebf28e1864b7a3129e78eb5c3b64f54576	21333235	1	二狗寻花约了个身上纹身苗条身材妹子啪啪，坐在身上摸逼舔奶骑乘大力猛操
3e77af25b4bb187f4339f0859539a60b63ff5a9d	144845874	1	卡哇伊的CD小舞酱秀身材，性感美腿连鸡巴也这么性感一点不丑，自慰呻吟好有 性诱惑！！
3e97972770dadfc0958883623d1f2321ebf677f4	41891031	1	高颜值法拉女神直播大秀 激情口交啪啪 是否诱人
3f64299a7ad0a753db5cb7d2507b8831e0cd097b	40785946	1	商铺网络摄像头被黑偸拍潮牌时装店下班关门后淫骚老板娘与男人直接在地上激情69打炮射完妹子没爽够还要自慰完整版
407ff08c8760214e2e0047158a4368c14cb5a116	26032139	1	健身房认识的寂寞美骚妇老公出差视频洗澡尿尿掰穴勾引我
40c1c1f1622f3264945f59148eaec6399db0af74	232926949	2	一坊嫩妹主播小七妹妹好粉好痒自慰大秀年纪不大逼毛倒不少
41d4a0cc405d16a81d410d42afa291b6781f2a08	30374197	1	超市清纯漂亮的美女收银员下班后和男友宾馆缠绵啪啪,看样子有点害羞强忍着高潮快感捂着嘴!
41568639362e54685fdf765c51124066ddd3c7b7	326254268	1	颜值不错皮肤白皙长发新人美女主播第四部 脱光全裸道具自慰毛毛比较多 很是诱惑不要错过
4301e73eb8d0d1ed8c939ca9eb0149cb4e80e84b	12191711	26	Azusa-san no Binkan ★ Switch
4320b46a4cacf98755ac32dc469b512d900e2fb3	652951920	4	The.Real.Housewives.of.Beverly.Hills.S11E01.WEB.h264-BAE[rarbg]
432c0e0b7364ce6e866199f544dc86cfcf760cbc	26325788	1	颜值不错舌头很灵活妹子道具自慰 性感黑丝撕开裆部道具抽插
441ae83bc3c2533006a531dce6c4bed65950af90	1061211066	1	颜值不错美女主播 直播大秀 自慰插穴 喜欢别错过
44414ee4bc535fb61c7ebd21140283f0ebf7739f	28198368	1	唯美另类SM摄影大咖BelleAlice作品高颜值极品私房人体模特夕颜完美诠释附高清套图151P+视频1V
45b10dcf927920693a495096c73db043b890b97b	53086393	1	厉害啊！直接在网吧勾搭漂亮小妹妹回家啪啪干一炮 无套插浪穴 啪啪操出全是水 太紧没忍住直接内射中出
458282e0e3a20b079b3dd8aec63b0f1ea03c19f7	33023024	1	国产酒店白领大屁股情人被操的淫水直流
4683d5242a45b348611e48ae14f61e2c5f1d932d	17184824	1	国产TS系列超美的陈雯雯性感情趣内衣很是诱惑 带着狗链被后入激烈操射
4716ec13dbfd4b3e849e5183a6adb8450763a281	34679556	1	高颜值美女主播允儿直播大秀 颜值身材俱佳 激情自慰
4909fb0027954cec78e5566c819d305de40f9b2c	30697455	1	苏大人OS骚气眼镜美少妇小尺度诱惑，露奶自摸掰穴特写非常粉嫩摆弄姿势
4b6f16601053141ea9cc0f04208a22c59ffe3238	85156983	1	学生妹小骚逼出来赚外快，穿上女服装扮，女骑士操逼，很骚
4cf45b194cf2e0f278690ef878c0022167667fd3	42585584	1	橙橙小萝莉可爱萌妹子女仆装自慰诱惑，单腿黑丝屁股写爸爸干我假屌抽插，逼逼无毛按摩器玩弄
4d88e6b7ff16967845ae18ca10f2ed1cabf14e04	33026595	1	大神桑拿会所享受黑丝少妇的倒立式口交，干一半决定玩全套这少妇也很饥渴对白精彩
4ded4e43caffe63af9c58e4c3e0f4e016fc79206	65412158	1	洋米糕老外终于在越南集市遇到了一个极品 审美不错 高颜值好身材背部很屌的纹身 被老外大鸡巴无套爆操内射
4dc19d628f8aab2995ec4c495cef1b68b87e984d	31267325	1	91大神自拍尾随情节作品 跟了一路欣赏黑裙诱惑真想扑上去操，套房情趣玩弄真会搞戴着黑丝操挡不住性奋了
4ddf005563a21a12b8b5826d2cfd9d7e85af5c4e	37246455	1	骚气大奶少妇 皮肤白皙 舔奶诱惑 椅子上手指揉阴蒂 淫水泛滥 撅着屁股后入式插呻吟 娇喘 非常诱人
4d5325f2bcb40470bd8f6a97ee4641d351ba837e	113355237	1	机场露脸抄底印花A字中长裙黑底高跟气质颜值都超高的少妇
4d72de4ae723b818995a2f98b05ae21bf4859fd8	33886220	1	颜值不错御姐美女10秒受不了 收费大秀 身材太棒了 激情自慰
5049112680deacbed5082a5a496bab646093a624	48722288	1	上海小骚货被外籍男友粗大鸡巴狂插 第二弹
5098dae5f55b9e02883ad3282c1fa1d00f4fb054	808778024	1	快手极品熟女主播『海浪』日常私拍性感丝袜自慰 丰乳肥臀自慰棒插逼搞自己高潮不断都是骚话
50b3334c53b5e2db28af93753b644e390f782d5d	213614707	3	GloryHoleSecrets.21.05.15.Cum.Compilation.XXX.SD.MP4-KLEENEX
5016e401fb34084aead50f41f2eccb760a83298e	16870801	1	光头土豪肥猪洋佬再战国内鸡场丰满白肤大奶妹被捅的有点受不了了貌似比以前猛
5287ca8750a1884bb5b1013b544c516aeaf5ed2e	1974129826	4	Furious.2017.RUSSIAN.1080p.BluRay.x265-VXT
5368e02f2c89101d5dfb79de7fa1e8858046e033	136473108	1	精选台湾辣妹大量性爱流出，现在后生仔不拍下来等于没做一样
53b68a2eaf54cca2d8e07026eb3a6e945d305c6f	133586062	1	推特爆乳网红嫩妹『小蔡头喵喵喵』商场里忍不住淫性大发躲到试衣间自慰 揉胸扣穴这个胆子也太大
5347b1fbbacfee63fed88e9082ed03351d6c40ea	252046589	19	[★★★][xiaav.net]愛沢蓮 一流的美麗的身體
54bb5414a8e6bfd850d2e664ab9a7595e435d579	54337473	1	最新推特女神精品博主高颜值反差美女大尺度性爱私拍流出 极品『骚 浪 贱』精致粉穴 完美身材 群P篇 高清完整版
548e078e045a96d80621e8016f580081ef77c2c4	8884513137	6	Autodesk 3DS MAX 2021.3.2 (x64) Multilanguage [FileCR]
545894b48207d0612438e8f06c6b885826413beb	53002620	1	丝袜会所小茹邀来出租屋随便爽 花纹肉丝质感狂戳爆浆
55a8f5209d32afe9b1e675891b3976dd4dca449e	545197783	1	某美容美体医疗机构内部教学视频-卵巢、胸部、臀部保养-真人示范中文讲解，稀缺资源值得收藏
57d9b9991306bdfc6d7f83f448b49059dc2f2e70	30076131	1	黑丝长腿素人性奴终极性体验调教丰臀机炮速插粉嫩浪穴淫水肆意
5811334b5b957b3f17eebcc87f5913fbc922684a	29310373	1	最新2020极品爆乳女神『私人玩物』调教小奴仆 肛塞嫩菊 振蛋入白虎穴 高潮喷尿附29P
58a9d3af6197e15f9d3b39038a3f9bb70c2cdfc4	53463759	1	国产【迷奸精品】重磅全网首发原创作品！迷奸老板的00后秘书720P高清版
590242d7ca5ac5b00847d509270d9289da92ec02	121661318	1	疯狂抽插我的老挝骚女友 高潮超多淫水 大鸡巴堵不住 滋的到处都是
5907cfe960bd083f5cde58dd40c1e2dc7edf1d06	42850942	1	高颜值长相清纯妹子户外车震双人啪啪秀 按摩器玩逼逼口交再大力猛插
59f074d86c968c46cccb40bb0bdfaf3918818b2a	41862926	1	91大神酒店爆操背着老公出来偷情的极品少妇,情趣护士装被狠狠狂插,毛少B嫩,呻吟声让人受不了.720P高清无水印!
5954f3faa706fc4112a8411fa28d772728ec5cf0	26415457	1	Sublime Text v19.0.5874 Patched (macOSX) 2021
5a13faf33029e382986bb50d07d814d13d7c6523	61578119	1	91广东约约哥新片淘宝店主中葡混血美女MELY第二部性情高涨玩SM 1080P高清完整版
5a298a1014a683ebf052284535fc2b6798627235	9700823777	4	Black.Space.s01.HD1080p.WEBRip.Rus.BaibaKo.tv
5ab5774ea2734e840d8f06d4fef98e76f64088a4	56079775	1	逼逼粉嫩小阴唇眼镜妹子道具自慰 开裆肉丝大黑牛震动道具JJ骑乘抽插
5b58a74b2e158eec849d48604485b56c575f7bcb	19551402	1	颜值不错AI图图直播大秀 身材丰满 揉奶插穴 十分淫荡
5c6d4ec47c02d9472810132c033bc19ed4e63c80	48430207	1	星星两个嫩妹子酒店大黑牛自慰舌吻手指互插，近距离特写被摄影玩弄粉穴
5db7becf7dfa63f3d74d3ab6df9b66386e3a3a53	31365039	1	泡良达人骚飘飘异地会朋友一块酒店开房寻欢应粉丝要求约兼职妹上门服务3P轮干对白有趣
5d29664b8310f5067b616100035fdfe872743785	11156574553	29	CJOB-088
5f39e20ea074b8ed46eb58f3672d00e862831e47	40987422	1	午夜寻花第二场黑衣性感妹子，先在沙发上操骑乘抽插毛毛浓密，再到床上干呻吟娇喘
5ff413346ec6e4ee01f0188093da059a98259c87	20265812	1	酒店偷拍高挑漂亮的长裙美女连内裤都没穿和情人偷情,从后面正操的激烈时突然接到男友电话骗谁：我到家了
5f5b8d3341576ea21330f6dcd86aebbb55cafcee	56360988	1	超爽刺激乱伦〖勾引小鲜肉〗大屌弟无套爆操骚浪姐 淫叫声挑战 边打10086客服边做爱 电话那边都懵逼了
6068bb7148a28b6deb8655d89de3650e99021b31	1555461706	1	91约约哥第18期-番号JM18：艺校极品身材小仙女琳琳 被操到喊痛发脾气～1080P高清无水印完整版
602c16173b6663df649127c53447d00e7af95876	301011130	1	Karlee Grey stuffed by Logan Pierce PIR@TE
60ed47ffcfa6aa2cab536ad7398ff8e16e5da0c6	18031649	1	杂货舖夫妻打烊后店里打地舖口交啪啪
620a970c0df817522b1884dc1fbc4ff090630029	1123005656	1	牛逼小哥镜头前演绎8000块找少女破处，一男三女一起玩，棉签插逼验货，鸡巴摩擦阴蒂使劲往里插妹子都哭了
620dd5c2af56ff13005d144af8abd56a7aa3d06f	1489152387	35	SCPX024C
62a5d8942f4d5e6a4ae2129c2d0fa3520c1f67d7	231878475	2	苏苏和小表弟乱伦啪啪做椅子上骑表弟大屌深插小逼逼内射溢出怕怀孕都扣出来了
64e7c7405817c6beb87bc4fb256d98a6bf9d2027	781026018	1	超白嫩女主角简陋出租屋激情操逼 720P高清原版
64f02ce2ca2a9fd39dfbd8f8269972e68d3781d9	746036523	11	www.tskscn.com(黑洞)
65ac1ef7eb82e86fe61001532dbddb6f84bcccd6	40980671	1	重庆172CM腿长胸大人称骚老娘们的气质美女被微信网友操的淫叫不止,趁美女正高潮时射她一嘴,气的哭了,难得的极品粉嫩鲍鱼!
669a7d27c2383ca967e674f72518c87bee744b04	44432194	1	夜场妈咪 漂亮骚货复播了 医院道具自慰 和炮友口交啪啪
673c833b1f9c59f868d31f1db94009837a2acbe9	49999598	1	带你偷窥真实大学女生宿舍，【学妹直播赚学费】护理专业大一，暑假实习在校，中午偷拍室友，蚊帐自慰，真实刺激
682e063c7025f87e15d109d6b2c216263bded121	53081967	1	精选360原版无水印-妹子为了和男友聊天,洗澡不关门还问男友我的身材棒不棒
68f6890562d3e9fdd3232115a65573be7706604b	47106588	1	文静纤细素人妹
69ad2472871caaeab5e5572b4e413b37c321f31a	36608899	1	韩国某美女主播援交被偷拍，一边被后入还一边聊天，玩遍各种姿势很享受喔
6ae8a7407b724b4eff8bc1070e8f636920996047	321492244	1	北京天使DensTinon极限露出超清视频 自习室
6b162cee78ac88a0551a195f960220f8e49cb4b0	744411269	2	Howl's Moving Castle (2004) 1080p.BluRay.x264.Full 744MB
6ce97c85e521fbfc43efc91851a100770e8d7002	38961460	1	青春美少女想要爸爸抱 第一次秀比较害羞 羞涩的漏奶翘臀掰屄
6c606bea2032dcc4090665db707065717a835228	41786152	1	曾经爆红的性感漂亮空姐被老公带到酒店和好友一起3P大战,这种玩法逼逼肯定被搞肿了,全程淫叫不止,国语!
6cced3374ec61e0c23e437e3fe64343dc92a754b	20834272	1	鸭哥侦探深夜场约了个牛仔裤性感妹子，蹲着口交后入抱起来大力抽插猛操
6cc196bcedfcb59ce56c7c29dd861a2b7afc0c4e	1647978110	2	Army.of.the.Dead.2021.HDRip.XviD.AC3-EVO
6d590374fe0055a4ff3126443cdc29f1d7571410	1122655172	1	精品推荐 长得很漂亮的美女穿着制服自慰大秀 小穴很漂亮
6e0610c60d010f23816e326f4a1208f0b9bb60fd	309663545	2	Milfty.21.05.21.Miss.Raquel.An.Inspiring.Teacher.XXX.720p.HEVC.x265.PRT
6f903e6a51f399eab17d7916ebed3297ea400a75	77576589	1	【网曝门事件】香港中越混血嫩模『Ador』大尺度性爱私拍流出 无套骑乘 美臀狂扭 高清私拍92P 高清720P原版
708973f0d7fc60b13f23fed0655180e450dba020	51779277	1	推特女神『Luluhsu』极品女神名模身材与闺蜜4P啪啪 大黄瓜快速抽插惨叫 自慰露出 附54P
7027c5bef9237378dde71a92f86cd0bdc8166f60	27602174	1	酒窝美女长得非常骚，半夜十二点去按摩会所还调戏男技师
7225bd3ade168850226559b326041963560793ca	60751286	1	精彩小视频收录
7331ad0a3e9c5f8867e248eddae6162a3963361d	1208843879	1	剖腹产生过小孩的少妇酒店偷情帅哥，骚逼还来个内射
738d21ddc90218534d88153b159f50e401c997ff	28652424	1	巨乳伪娘七七高颜值3 互吃肉棒 后被直男大屌后入
758da34c144e0b0c44eb1d2dfd33863abc43d336	5610995826	29	HND-994
755ce70cffb2dc162ed64ce7f4f7a24c9b376e45	38287339	1	最新汤不热疯传极品175长腿网红SEXY-HEEL唯美魅惑性爱私拍流出 疯狂啪操 狂野虐操 高清私拍41P 高清720P版
75d4655ece6ac9411ba45f602280d70f41c957ef	968880225	1	唯美口交系列第十部-身材苗条整容脸妹子舔JJ深喉口交再后入大力抽插逼逼无毛-1080P高清
77cff62db01bc63f5c2a5b29182a83d6537b5d93	27572753	1	夜场妈咪 漂亮骚货复播了 医院道具自慰 和炮友口交啪啪
77dc861cb8cf684214e8947e9bdf06f200f130ad	24846225	1	美女高清表演器具自慰，很粉嫩的小屄哦！
781c3ada0d789f7c16c2e12c01aca8cd214ae14f	24542915	1	苏晴露脸极品少妇和服诱惑，炮击虐待骚逼菊花双插，淫语浪叫手都能插进去，把自己玩潮喷了第二弹
78ed92169fc5ce81a3302f5a61bba385d8d8d5db	54520548	1	国内大神女骚货短裙无内裸漏下体插着肛塞游街露出，看着就刺激
798647952cd5a5a12b368615e72d34903d10838e	609373331	1	ULTIMA - NEXT TO - DINO CRISIS
