001b1a6d02edf4cba8ad0e001b17be459ad84cb6	50224692	1	什么叫旁若无人行动告诉你还记得她吗？宜家新闻女主角被抓有几个月了也不知道最近怎么样了
01b87db70f94816ce43745f16214e31743cc8baa	57255911	1	足控福利—丽柜黑丝美腿大奶美女兔子丝足诱惑付费房福利视频合集
01155994d2eecb5c5c44c0db6e2427be9a5417ea	29763313	1	大学制服实习生沙发各式抽插爆操 连续撞击白嫩美臀啪啪直响 高潮淫叫“使劲操我”太骚了
020dab29797c8362cd8ec9c33cf840b87d735717	1240556302	3	Biography.Booker.T.2021.WEB.h264-BAE[TGx]
05f47c0f4793e64d2feb849fd6deba53dd80313e	2450554276	1	清纯女神经典偷情啪啪作品《西厢艳谈》字幕佳作 麦家琪妹子颜值身材都很不错纯纯气质挡不住心动要硬了
06dbe59cd73791e9f0afad93938fd998722d2e30	23440550	1	高颜值萌妹道具快速抽插微毛嫩穴好湿润滋滋响叫的好骚
0791fd0f10e1a3cc765dc8d8bb31fdcc61d227c2	2687287296	3	Mare.of.Easttown.S01.WEB-DLRip.TVShows
075df45d7f0f91a2ef0bf5cc34662d8ad37300ef	936845105	1	小宝寻花约了个颜值不错肉肉身材妹子啪啪，口交舔弄上位骑坐后入抽插大力猛操
0a7f7f3613491431cb39931c801e2bb7a594e03a	185549493	1	【裸非特别档合集】17-19少妇-御姐-轻熟女系列-第三部（七套）
0aecd137dee2e13f23f9e343c09b09bd71681ac8	25696443	1	金发小波浪小美眉失业了给男友骗去一起做zhibo！做着做着就破罐子破摔了。
0b91ed70e9f4c3680902cc1163a6502f260f4a01	3228353229	32	ATID-460.HD
0b5f7d045901b4c64f56116733682f49877b4222	664771246	5	Enfrentada a un asesino 1X4 HDTV XviD Castellano www.yadixv.com
0ba024ddb63553d2c486b921f5e2cadda30b7b9b	25981114	1	邻居的小骚货骚的不行 多姿势口活
0b7ea413fbdc7df842f87e11562868d23cb54cbb	3371306942	248	Bersuit Vergarabat (23)
0cca38115f42ff9cc0b61ee7d682560674792820	22228628	1	【91昆哥探花】酒店约良家情人来啪啪偷拍，聊天自拍谈笑风生，风情万种魅惑无限
0c8f2f20ec20fba6afd55e03857ecaeafd840faa	133783564	1	约操极品网红女主播雅兴儿 性感纹身 爆乳身材 甜蜜口技 淫荡爆操 精彩对白 完美露脸 超清1080P原版无水印
0dc802fdf5a051f92c60b244c8d1324977fc43dc	36121490	1	SWAG『Arie』和两宅男玩3P 前后夹击 入珠肉棒摩擦的快感十足 受不了喷水不断
0e2692234d089773ee3abd93bf7a7ffbbdc34092	36963422	1	高颜值白虎妹子单人跳蛋自慰 粉嫩逼逼震动高潮出水近距离特写非常诱人
0e1ee20bf7d481925b7763f97974c96d62c13db7	43934084	1	一大早就被高挑臊气女友强上,对话淫荡
0eda28be22e82f2ae272a2d3da37b7cfcdc157c0	599247620	1	ADVO-159
0f385b0bde5df74e863f406d8d29aea2ad2468de	582	1	0174bdea64af5af73ba93a679ff3f45535a185134803a9d7
100eb6879b7a736893f78d3a9f4a3eee4743def6	32656234	1	【AI高清2K修复】【力哥探花】深夜，已经微醺的女神带回酒店，调情口交啪啪，高颜值好身材一夜风流刺激
1231d3d75deb6c91f9d3f0939251d030c9a99c08	25361621	1	帅小伙5800元约操2位高挑性感大美女双飞,其中一位漂亮身材又好连干了3次,销魂淫叫,又单独给了1000元小费.国语!
123f6ec24a343cdb4a223f5d7789492879a59eaf	430933530	1	高颜值骚货少妇 和炮友在酒店啪啪大秀 骑在头上让男的吃逼逼 口交 后入内射 卫生间高潮喷水
16ff2b5e3f1d6a12243eb6ed96a6600dccc4fa7c	34757789	1	两位好基友迷倒妹子换上制服丝袜玩弄轮流爆操一顿
163029e770682e80006efd2b1a422cea9851a6d9	38380312	1	水汪汪的眼睛火辣骚逼，床上寂寞难耐掏出挺拔乳房，好想吃一口，阴毛隐藏的洞口拨开云雾见青天，跳蛋自慰 爽死呻吟！
1828c5cca6ff4ec3d06804409d408a7995c2b003	68195533	1	金瓶风月 1991 国语中字
18ee5745689cf30cf4a5122451ac5eeecdd9b324	236934956	1	泄密精彩视频五弹来袭！真实感爆棚！第一弹（第三套）
183897dff211a387636b09510228f62537c14fe6	1402994731	25	KUSE-013C
192f6aa3c8da76c9436a362a0462237bd7fd3e2f	1553816966	1	红唇寂寞少妇居家跳蛋自慰诱惑，特写跳蛋塞入逼拉扯呻吟娇喘自摸，高潮流出手指插入扣弄
199340ce7caa63921d08b47d66f58b0a8b8e4c61	262093559	3	苗条身材妹子双人啪啪口交舔硬JJ提着双脚猛插最后射在肚子上
19042ea3303df8da21ce0fea4830e4ab575581b2	33927555	1	亚籍纹身美女椅子上全裸跳蛋道具插逼自慰 呻吟淫水直流 太爽了
1b64b198c4fc9ff4c85be877c69ae5ec61f86e78	96143712	6	Nine Inch Nails 2006 (Promo) Every Day Is Exactly The Same
1bede029fdf3b78fe6dcc26cd679b1d2fa8ac094	36315280	1	高速公路旁手机现场直播夫妻户外啪啪大秀，一对大奶像红灯 路过车辆无一不减速 精彩刺激
1bef4f4e03ff3ae80be5bb1a5317264c7e339bb7	87955099	1	最新天美传媒工作室原创AV剧情新作-喜欢韩国欧巴的花痴女友 双腿夹腰和男友激情沙发操 盘缠大战 高清1080P原版无水印
1bc8dd490ab7a495b507eae2b33282e56c9ccdbd	40079166	1	某社区大佬整理亚裔留学浪妹不雅视图 洗浴手淫公寓口交啪啪5V
1cb12d6f26a264c4e0edda87c6aeb6ed64a7d4be	30157353	1	【家庭偷窥盗摄】最新破解家庭摄像头 偷窥啪啪啪（第二部）,真实夫妻家中激情
1c466458f849896243cc7c95fe2b6b16c2200de7	49738925	1	如家和美少妇偷情
20fbc0270e4bc9d6314912ed4cea795c929b8927	39675459	1	美女只招待土豪作品《私人会所》冲动佳作 会所的美女质量就是高，这样的夜生活都挡不住白领美女操不停
20e8110a7c4092d97a5b3f7bb3051560162779ae	64232940	1	看到姐夫在操姐姐-我也跟着受不了-到姐夫家原本想给姐夫一个惊喜， 竟然看到姐姐跟姐夫正在做爱 吃醋嫉妒之下在门外开始自慰 最后被姐夫发现
20b30dc15a21561392a6a6c46e082275748e20d9	50591690	1	秀人网嫩模杨晨晨sugar自拍黑丝魅惑抖音福利视图诱惑合集
21dbada3469e2122c739033ac8cc2eb50bca6c27	37794957	1	北京车模墨镜骚女和炮友啪啪，豹纹内衣开档黑丝翘屁股舔逼，上位骑乘道具假吊自慰
24c4f35234d0ca666a7dbec2aa47be4bef9638b9	36773382	1	眼镜男1500元约操时尚性感颜值高美女啪啪,都脱光准备干了,因为男的要亲嘴美女不同意要退他1000元走,男的非要干她.国语!
25354672427099889832b66ea4c7a4447e50131a	16474317	1	强少爷探花新人老哥约了个黑衣纹身少妇啪啪，近距离拍摄口交上位骑坐抽插猛操
25992d53b5203e7bbe3309702de28581f082fe4b	366970904	1	贵州兵哥2017新片宾馆啪啪良家少妇 刚开始假装矜持不愿意 谁知道一摸下去都是水 插进去的时候比鸡婆还要疯狂 无水印版
25bfa4eed1c211d52dd679b61e635262277ef4b2	80007841	1	玩出3P新境界【勾引同学3P】两美女同学和男同学玩双飞 可惜有个美女大姨妈来了只能口活 黑丝美女独自迎战
2715ca702241fd1e3ec6b5b9595fed9be72340ad	524853645	1	《户外嫖妓偷拍第一人》伟哥100元嫖农村站街女在简陋的平房啪啪
286061ca28a0182cedf7c5717e5e615153fcbf25	36655053	1	SWAG 黑丝空姐艳遇已婚男 舌吻舔穴老婆来电查岗
28792aaa1baa2bbbad2a10d07b6900d6309dc3d3	4592209771	4	Seks.insta.ekzameny.2020.WEB-DL.1080p
2987bca20863b64bf4f5ada0692dec451bc78dbd	24119727	1	苗条短发挺嫩妹子道具自慰 椅子上全裸道具JJ抽插多次喷水
2adac7902d2f747bf1c41dfc323163f8b48f4c05	353410927	15	Simply Red - Blue (1998) Flac
2a9eaa312dfe642b0d45e6bd05f7900a1307ecf1	710648226	13	1024_DTU2KVB595
2c274c5409d5a94aab439a1d9e0653bf2a869b76	54662402	1	两个十八岁的小姐姐 被几个同样年龄的小哥哥轮流搞 太粉嫩了 现在的年轻人越来越开放了 以前想也不敢想
2c2cb863541cb6a67ad191453a5f5666011b19a5	614329779	1	女神主播性感小嫩模1217一多自慰大秀 身材性感长相女神 自慰插穴很是淫荡
2d8dc779a057aca76d6def8ebe6734f07bb59c21	41555889	1	颜值不错身材丰满美女直播 激情自慰大秀
2d643959f3b3f7d79714d5f99493dc9b48bb6495	488175642	20	INXS - Why (Should We Cry) (1997) [declipped]
2fc8b1cb323f91185b9b6cbf4d06a03e09f846de	25240565	1	非常骚的小骚骚直播大秀 激情自慰 小穴全是淫水
30423c88ce7c08d723d67594a74e4bfd7dda82d2	114339430	1	上海魔鬼身材美女嫩模和男友外地旅游酒店艳舞表演激情操逼,洗澡时也不放过她继续干.边操边拍.高清版!
31cadc8e9b36d9a4729077749d1f487fea5f33c3	25813720	1	颜值不错是你的kk呀 直播秀 掰开小学很是诱人
31e8a254bd91e42047d68922bcc4193e7a7213cb	18568582	1	九月新流出酒店新台蓝色大圆床偷拍豪乳妹和炮友开房坐在床靠背上干
325b54b2df171dcddbe0a2e38863415df961cca0	47674944	1	麻豆传媒映画华语AV剧情新作-女奴翻身做女王 性玩物女孩的致富逆袭 麻豆女神吴梦梦 高清1080P原版首发
342af40ed245aeab88e2aa68e79030501275be3a	46697703	1	泡良大佬新泡高颜值妹子，【素人老嫖专攻良家】 漂亮小姐姐，闺房里激情啪啪，浓情蜜意玩得好开心，美乳翘臀这身材值得狂干一番
353a0ffbdc2db1a3cafdfb4f3d8fbd0a73d1d189	47485871	1	白丝女仆情趣装精品学妹非常会伺候男人，温柔的舔弄着大鸡巴乳头肚脐真骚，无毛骚逼上位好紧拽着辫子后入
35032b87db2f9346e1de50678c5c110b29a9e2af	80536899	1	放暑假约到的大二小师妹 还假装性经验丰富结果套套都不知道怎么带，还是我让她体验到了性爱的快乐
37b8b54b42c1535366132b746a86305b8636158c	88565760	1	Joe Shadows - Nile Sessions 094 (2013-06-16)
382390073286189950ede012c94cfed5dbe3a851	56753465	1	私有云泄密-棒子国爆炸身材小骚妻 被老公调教的很听话 情趣制服 超爽后入翘臀 浪叫声淫荡 激起你的征服欲附69P
38f125a6d90f66e5900c87927fb5bf6a0dd9096f	2490368743	1	37度C骚气眼镜妹子道具自慰大秀，近距离特写自摸粉穴震动棒快速抽插，翘屁股扭动厕所尿尿
3c96f46b3460cfdb0510ca9188a2d8ddde64c0bc	34028739	1	看这骚逼把自己玩的电钻狂插骚逼喷牛奶，茄子黄瓜加鸡蛋轮换塞逼，叫声骚浪高潮不断这逼真是无敌了
3d168d6df62b8dab15c7fa77efe6ea468584aa09	1148347419	1	精品酒店荷叶房偷拍身材不错貌似大学生模样情侣开房过夜干了几次
3d400efb1c1a749ee7634754aba3630100fe5d41	34310650	1	颜值不错女主播直播 口爆男技师然后洗澡 十分淫荡
3df6e98d0441c3bce29a2165f072cde8c684977d	35867772	1	【制服空姐】魔鬼小妖Ts李智贤 人美菊穴美屁股小且多肉，穿上制服老板连连感叹：哇，卧槽，都快喷鼻血了！
3ddc26f9ff1c212d0f75f4be7fd58b3613784d8e	108255424	1	极品学院派美乳漂亮丝模宾馆大尺度私拍穿多套情趣衣被摄影师咸猪手掰逼1080P超清
3d7dfaad6b845b1d3ae6a2b7babf2ef41bd833cf	14634994	1	家庭实况监控破解TP小饭店闭店之后老板与老板娘光着腚把简易小床操坏了直接跑饭桌上面肏
3df31a063048973a6ee0bcb246e1d460a3f271d4	42491543	1	颜值不错美女直播 乳夹乳头激情自慰 十分淫荡
3e07a364b68ae3101c2e431cf51096c3837194bc	56173544	1	颜值不错身材也苗条美女 穿着sm捆绑服 自慰插穴很是诱人
3f18ccca1ca9da512b7b9a05bce9ab986fc0e482	37888381	1	91大神约操魔都极品细腰丰臀幼师性爱实录2 多制服后入啪啪操蜜桃美臀 高清720P原版无水印
41832366dde321f5e3cf7808ba29a52ecc379f5e	35403025	1	炮王寻花约草兼职学妹，沙发上享受骚逼的口技看着真的很棒，捏着奶子让骚逼上位抽插，直接把小哥干射真刺激
41920578ffd38d41a3a4cf5b01e7b50adb10f165	18208194	1	没窗帘的廉价出租房偷拍两姐妹一起脱光衣服洗澡
413042ea7f8579445ebeb1bfbaf912788ba25f9b	19894460	1	人斩星选约挺嫩妹子舔奶互摸，倒立69口交近距离特写骑乘猛操
4200404e059cfa347ccdbc4be28311d9397a530b	1310839373	1	My Mom Likes Girls 5 XXX DVDRip x264-Fapulous
42faa5124b8fdf23fc351b37638fd93dc8e3f312	802535021	6	42
43203974894cd01f70130fb7276defef6fd689bc	442397161	1	漂亮丰满美女主播护士兼职灬依依9.9一多大秀 穿着护士制服自慰 坐插充气男模 很诱人
450786eabf8c369c5b26bcf4d46ce841e9b48235	77671766	1	4Q起拍的私房模特桐桐宾馆大尺度拍摄4套情趣装近景特写私处放尿过程看这BB也是没少被有钱人光顾1080P无水原档
47c600a3a57543cec760c86c3ef6a7934f962724	20027681	1	和单位女同事在地板上偷情草逼 太骚了 泄了还不满足
47236b8931e3ea2ae82dfddac19511ba73405730	2743254294	1	字幕 这么疯狂的女人野性欲望让人燃爆《人肉叉烧包之天诛地灭.高清完整版》激情佳作 丰满肉体随意刺激折腾
49012b9a16f7f19c9a7c808f056099de44208f32	30276055	1	二狗寻花约草风骚小太妹，调情中扒光小骚逼，舔耳朵舔奶子舔逼AV棒玩弄骚逼，各种体位抽插爆草有说有笑
493940e67069b1fdfb63d6595d509202e06c9a98	31991396	1	纹身猛男约炮达人【新星探花】首战约炮披肩熟女宾馆打炮 东北豪放女做爱狂野奔放 干完了想喝白酒真生猛 高清源码录制
4c753f68b5f0a95f3392d4a5e12353dcbc174ce6	73215744	1	迷奸 极品高冷气质黑丝妹被带到酒店后商定给予三千元随意摆弄啪啪720P高清
4d2e1d2a082c4c28554694773d41725cbe3c0a1b	26490181	1	颜值不错苗条身材妹子性感开裆黑丝自慰，大黑牛头部插入两根一起玩摆弄姿势，高潮出白浆非常诱人
4e304fb32ef8e193457fad45cc6d52b5d963e208	28193621	1	长发清纯大学妹子疫情一直不开学,居家自己卧室褕褕开果聊兼职赚零花钱,身体真嫩
4ffbcac16dda5b3d104dcf7830bd4a0f432fc43b	34892198	1	旅店针孔TP很能干又持久的小胖啪啪啪身材性感有腰窝的漂亮长发女友干的满头大汗面目狰狞很能肏啊
51163f24d8e480c5e5ace2780ab23108e85bc48c	20430185	1	91大神C仔经典情欲女仆装作品 小姐姐身材很好，抱着猛操真给力 看的是欲火旺盛大神就是会玩720P高清
52c8a16f167f53f349afa083655e689904b87cf7	72114612	1	商场露脸抄底牛仔短裙漂亮美女内内跑偏了露出一侧黑逼毛
5418a1f3cca2db204a52708385cf270219848629	29429421	1	大陆经典网络探头盗摄 各年龄段夫妻居家更衣沐浴日常性爱生活（第十部）
544344b9b87b260ee753b4d5eb1d8e66a63a0138	30922256	1	蜜桃汪汪水白皙少妇3P啪啪沙发上操，边口交边摸奶前后双插上位骑乘猛操
5503238f946baa140ebc2faa63899704cac8ade1	120057888	1	土豪铭哥迪吧认识的女神级性感DJ美女,2000元约出来啪啪,包臀连衣裙下面竟然连内裤都不穿,掀开就操,叫床诱人!
56298081eb428cb5b50ec39b95c06a9f4c77562e	44251414	1	精选裸贷特别档漂亮嫩妹，出租房内裸拍，胸大毛少上下皆粉，道具插穴一看平时就没少自慰动作熟练，附图108P
577abf7e97506a14c6b10fb96cd60da0ec62c96d	33055745	1	大奶妹喝口凉水再舔JB 边吸边发浪 爽的你不要不要的
587627744c45e90a997c6dfefffaedfd63846dfb	25834717	1	【文轩探花】（第三场）喊来闺蜜玩双飞，新来女神害羞要关灯，配合默契激情啪啪，翘臀美乳别有一番风味
593a90f000a49aaee000f6b72e543b3cd48f3df0	50547796	1	漂亮主播这对奶子是真的大啊 阴毛也很旺盛 近距离掰开小逼给大家看
5a030a3914ee176e1c89e86d122ec9ee7e556540	26662983	1	颜值不错苗条妹子连体丝袜[厨房诱惑 跳蛋塞逼逼一边煮面一边拉扯自慰
5a66706f67c483b1b1c30388fd6bf272d522925b	23259620	1	翘臀大学美女身穿制服被导师各种姿势狂肏口爆视讯辑（二）
5adb05137b128afbb248fa4503d5daf5114233bd	75362458	1	非常骚的娘们晴宝宝露脸直播，无毛骚穴床上自慰喷水，道具双插特写给你看，浪叫呻吟不断
5b5d1023b7f172bafb5cca89aca93a5afb16bcff	79650654	1	3P苏州小浪货 露脸上下齐入大鸡吧塞满骚逼
5dc9c91a170aab554bbd73be7357659b3a6b08da	208181097	1	百度云泄密流出视图调教喜欢后人女友家里玩得不够刺激户外野战
5fb92ef90a65f92e0a1ce51a4e9e4ddc3204492c	99572222	1	公寓管理员晚上值班很无聊躲在窗外偷窥女住客脱衣服洗澡出来
5f2192a6692a88b50938aded28e1d9bc8000017d	1918437286	7	[FTUApps.com] - Windows 10 Superlite MPB BlastX (20H2) Us-En (x64) Pre-Activated
603103ebbcdb6d0ceaaf4ca2b4a6582207870416	35050301	1	豪华酒店大屌哥1000元选了位刚来兼职的漂亮美女,还会倒挂金钩,第二次干到最后偷偷把套子拿掉射她一身!国语!
612101802187c6a9d6af064af27e3d3a617c7aa1	40646972	1	91东哥原创最新贷款题材精品大片-真实贷款潜规则实录第一部 -1080P高清完整版
61e1ac96bbf4a21ea3beeb20b94e35fa777cf4cf	21908050	20	[nicollubin] Elizabeth Moon - cykl Czyny Paksenarrion tom 1-3 [ebook PL] [epub mobi pdf]
63d6d4450afabd96f0792d5476da3ee70e565c4e	37181569	1	高颜值气质美女御姐主播收费直播秀 肤色也很白皙 小穴漂亮
63a158c1f24a954609b2f10b310bb2abdac3527d	36028441	1	要喝波波奶茶清纯白皙美乳妹子自慰诱惑，单腿黑丝拨开丁字裤大黑牛震动，近距离特写诱人粉穴
64519bcf650ed74a55ab856dd9ecfd518beca4d4	37951478	1	颜值不错90后小少妇直播 粉嫩木耳插穴自慰
64ff2d6656aa196f469192eb4f6bc068eb5365f5	303619350	4	Lustery.E394.Anna.And.Matt.Getting.Their.Fix.XXX.1080p.MP4-WRB[rarbg]
650658bdf3a190ce64e6f85a2245a1699561cc02	57097833	1	大陆SNS卖手淫视讯的豪乳嫩妹手淫视讯
658947c40534ea5eb576b2d5f63bc7143d30580e	237044901	1	酒店约炮打高尔夫认识的大奶子少妇 巨乳+黑丝 高清露脸
6692f252866020db6a20c726194bcea6fe23620e	65992754	1	颜值不错短发少妇双人秀 手指玩逼逼JJ摩擦跳蛋塞入毛毛比较多
661e196dff3b87b98483679925f5f28af39847de	61235883	1	网红女神陈丝丝全程露脸户外，回归母校在宿舍楼底下大秀自慰，紧张害怕激动各种情趣交织，揉奶抠逼流了好多水
679a590d2fef2b971a70ec099f710865a9e59efc	38503234	1	白嫩萝莉18岁小妹在宿舍和男友朋友直播，男友劝说她直播赚钱，蜜桃粉红极品，原生态腋毛都没刮
681e5f72214cf43267f8ab1df92cb04d279fb377	863122739	1	跑车福利の甜美清纯嫩妹手指用力扣穴自慰边娇喘边喊baba真是个大骚货
690f0fb2a0f0767e05f59c95871445d17fcb4c80	111702671	1	周末闲来无事路边店相中一位外表看起来很良家的马尾辫站街小少妇阴毛很少70块狠狠干了她一炮国语1080P原版
697b3f2d38aec4113d92b7896d1ffaf885584cb0	111876248	1	性感迷人CD小薰制服诱惑 精致的妖妖，肛塞玩弄小菊穴，爽完了再自慰，鸡儿得到完美释放 啊啊浆液射啦！
6a7785d5eb94f707a01aaadf155cadb3b4e8bac0	29137032	1	情趣制服黑丝骚气少妇和粉丝手机视频自慰 退下丝袜按摩器震动呻吟娇喘诱人
6c4201ad98e35d2fc45efeb4210873d93de3f20b	30970404	1	裸聊界的刘大美黑丝情趣高跟女仆，很丰满屁股很肥逼逼很大，连续两场自慰秀，淫声浪语极尽风骚就缺大鸡巴干
6e6697469c5c0d5318597c711ff6725c59069eca	5261086	88	295b_Ali-Baba_and_The_40_Thieves
6faba8193f4163bc0d40cb7c1387b926e051a6b8	466070011	1	链子哥高级酒店约啪身材丰满性感的气质大美女,从沙发上一直搞到床上,男的有点胖体力不行,貌似美女还没瞒足!
70ffdfba805b35382c5a7e0cbfa1315d090475d2	30429286	1	漂亮小嫩妹小月妹妹 激情自慰秀 清纯漂亮 很是诱人
702fcb34795ed238901f3dfbfc68299b8329c5e4	3023755331	5	Thicka.Than.A.Snicka.9.XXX.720p.WEBRip.MP4-VSEX
7209ac67cc325a2301ea991b9ecafc1f70fd3205	14326036	1	牛仔裤苗条清纯小美女与瘦小的男友开房造爱年轻人干的很猛啊体位还多干了2炮之后吃东西补体力
72b2f7b921d170d60bf14fccd298f02aa6bceac2	88083235	1	露脸淫荡少妇娜宝姐高价售卖作品 妮子大衣下隐藏着透视情趣诱惑裙用道具大鸡巴自慰插逼爽到高潮喷水超清版
732cd6189eacb9ce4b4dcb0b53b0913059a72373	571744230	2	HotMILFsFuck.21.05.02.Jessie.James.XXX.720p.HEVC.x265.PRT
74028576c5cd224bd01497a01eaf0e76bfa968a2	216916428	1	情趣玫瑰房女友穿鱼网连体内衣吃鸡巴，甜美的笑容骑上来好想射
75c7bd0f4c8e7afe20d7589ab7cc66659eb8329d	1127434279	1	千人斩星选下午场老哥代播格子裙妹子，沙发上操镜头前口交后人大力猛操
761aa9f42b2386cee99ee6827ad07e0df03ad36f	486365959	24	26
76618dcbecf5d07e693cd5259ee7acbb0c04aa9c	85068916	1	撩妹大神D哥再约高颜值气质美女模特一边与美女激情啪啪一边电话挑逗老婆虚拟做爱对白刺激淫荡1080P原版
76eb3c81fabdc54396ad1b12dd71c1faf10d829e	896329176	2	Holy Matrimony (1994) [720p] [BluRay] [YTS.MX]
76d42cd4f413019233f353b3d7a79ec3070de9ec	4447401345	10	[GM-Team][国漫][刺客伍六七 第3季][Killer Seven Ⅲ][2021][01-10 Fin][AVC][GB][1080P]
77a08fd415d2a1e20bb3a28756f2a470b031e51c	50376921	1	年轻可爱小美眉在大JJ小男友家中自拍视频8V
7935f77d02f2d6227b82f974958e92ccc1dc05e7	174803452	1	贵在真实年轻大学生情侣周日校外开房啪啪啪小妹子叫的很给力表情销魂叫老公不要还说自己骚清晰对白刺激
7aae300ad54c02c12eafdc650a6341d47dbe1f44	995304867	1	不正经的嫂子要多骚有多骚，双指抠她骚逼沾着淫水给她吃，口交大鸡巴各种体位爆草抽插，让她爽上天叫的好骚
7b9fbbf41f3728d23432d751fbbf38a35174c71e	650437004	1	颜值不错性感小宝塔直播大秀 双人激情口交啪啪
7cd3be1632893b62c5b7cd48f09f9c88ee43f01a	3157413972	2	Ameluk.2014.ITALIAN.1080p.AMZN.WEBRip.DDP2.0.x264-Candial
7c6a157b554176c846b2211157638633edf67b61	622940408	1	高颜值白嫩苗条台湾美眉又一超强力作！圣诞老人的赠礼！
7d2e4c8bd1c72a6a3b37ae9efcc877177aab5629	16588063	1	360摄像头情趣酒店 红心圆床偷拍 微胖哥和眼镜女友开房妹子外表斯文脱光就变得狂野了
7f07734a38cec4ed15833469d825d26747b3aa3f	198199903	1	乖巧女友丝袜做爱你喜欢我就穿喽
81abb145432f97485344af76c4ab51be92451590	244461125	2	地下妇科诊所拍摄大阴唇打工妹貌似阴道发炎做内窥检查男医生的手搁人奶子上抚慰
814b48df49ccc6c04ef93b6ce1d07f0da110469c	15238596	1	【女子SPA推油】少妇推油按摩TP视角，手指扣弄推完背部再推正面口交抽插
83cf03f31b1a7d0a451b9477d26f1b31b006cd0d	25642932	1	花椒绿播高颜值女神【曼曼man】下海黄播大尺度性感情趣内衣黄瓜插逼
834389e3651efc0384f1a9251b0424f580a2615a	45055450	1	KK 富二代草哥星级酒店高端约啪外围女模特身材好气质佳优雅大方美女被干的尖叫喊老公干死我了对白淫荡1080P原版
83b00eb0224fe66c4c64faa40002a58740167e96	27618889	1	年轻嫩妹风骚主播奶子很大 身材也很苗条 各种搔首弄姿自慰插穴 很是淫荡
847515d1a6b5a410e13dad4eb05cd48a2a0ead71	72001375	1	第一次玩一个穿汉服的漂亮小姐姐 有点仙 相当满足 因此有点飘 感觉自己成了汉武帝 720P无水
84cc3fc57b3b5e158e3896ddfc2d75427115d0b2	33136121	1	年轻小情侣吸精小少女直播啪啪秀 妹子小穴很粉 激情啪啪
842ef49322bc5c8c58c98b84247d22b0014665ec	107301900	1	高颜值白嫩清纯小美女KTV+电影院大胆露出自拍合集
87cf28630221df2029db85e8c6ed9ffef1c7fa7d	69849239	1	国产TS系列小语黑丝被多毛老外狂操 欲求不满高喊法克米
87aaddf237385589eba26d49df08629ef745ae8e	97477284	1	商场厕所口交后入无套啪啪
898649bdff14d493a860d2d4d3e36585dc8aec90	83423129	1	发现个秘密躲在排水口能偷窥到邻近浴室等了几天终于拍到了个气质美女洗澡身材好下面毛毛特性感
8b3abe3a7719dfe9c65d702041b12574bdf16f38	103287319	1	牛仔裤小妹野外战 后入操逼 然后操嘴
8bb9be7f8a3f7122da0d03315f7bfb1f065f99dd	143919523	1	元宵节巨献 逃婚新娘 女儿倔强逃婚 母亲激情补位 1080P高清版
8cb69fd994d96fe9049b3bbdc2c5389436447616	21614551	1	高颜值美女小姐姐！刷一万金币给全裸才艺表演 甩奶舞
8d6495972915d01ff696cc6b4e0e256fe16f32e2	24415118	1	家庭摄像TP蜗居一家三口地方有限只好当孩子面偷过夫妻生活孩子看电视媳妇看平板老公看手机下面啪啪最后关灯起身干
8e39cd864aa4ddaba13a89dce5aabb6094b264d7	900950427	1	乡村县城地下夜总会精彩不贵的艳舞表演全裸噼腿撅臀载歌载舞有几个年轻妹子还挺漂亮的红帽大叔直接近距离欣赏
8fa5cac4de7ad856a2983f56945b97cf09675d84	73954489	9	Dyb_Mork--Dystopic-(TOXIC389)-WEB-2020-BABAS
90f8f0d6821c22141c260a60afbe8d1e4b964b35	33745468	1	全身SPA美容店按摩妹给客人做私处保养美容,褕褕开值播,客人少妇都不知道
90a48bff819c1d6e5d5e06ecbc730e5f7a0460ff	89380457	1	P站完美女神苏苏全网最全22套全集整理
913ec92531fd33f028662e3e1030bff64c491f42	1450149055	1	【AI高清2K修复】【男魔小天】一字马，倒立口交，3500高端外围，模特身材女神，花样繁多，体力强悍，激情四射，收藏必备
91b8dd5d5e273e1ba59c35269de17e76f8841986	432820139	4	The.Simpsons.S32E20.720p.WEB.H264-CAKES[rarbg]
922aa5d00bba269954ca6f276d7a55a3ae2ad8e7	78719294	1	【季总全国探花】漂亮小姐姐温柔如水，教小伙如何脱丝袜，大胸翘臀共度销魂一夜,高清1080P修复版
9317df6c8b85105b45cbca84817642ec70da352e	61142317	1	X母大侠最新作品之性感辣妈丝袜绑着JJ吊打居然射了高清无水印
930e02ec5a7f3d758cfa722306957785a577aba0	42252816	1	疫情严重不用上课体育系帅哥天天在家干大胸骚女友再强的身体也会被掏空
93493bc4b67083d1e72216755239e57b162da7ac	1857281455	3	So.I.Married.An.Anti-Fan.S01E03-04.1080p.IQ.WEB-DL.AAC.H.264-HoneyG
9444f18ca8fec9bc1017f3dc588c282a8a0b6624	28609999	1	可爱小萌新‘萝莉’TS于梦婕和闺蜜约炮直男，闺房中充满妖声 啊啊你好淫好色呀 吃他鸡巴流出来的小液体 滋润呀～
946730be5be0914c70a8b2ab84bcb8214d89c63b	28323930	1	沈先生探花今晚约了两个嫩妹玩双飞完整版，舔弄口交上位骑坐抽插猛操
