7999fc91e757e1523040f873d5320255cad931e1	479628169	1	2020最新 近视角高清大床主题精选-极品小嫩逼和男友疯狂爆操 魔鬼身材 各式抽插
7a141810fdea1ef9786b40029807ca3f1bb1b517	34074309	1	老哥深夜探花约了个颜值不错白衣少妇TP啪啪 上位骑乘后入抱起来大力猛操
7a1de61e3a6ee4549226471e14226f92bb01a46e	47820873	1	极品高颜值美女【妲己专职勾引】午夜户外渴望被强暴 勾引网约车司机酒店啪啪 各种操把小哥玩废了 高清源码无水印
7a5b71422f04aa1f632f0cfed3cad96e253f92ab	8796653910	3	NHDTB-530
7bcf9af4b5c5d16afa8c06cb4cdd827f7c1ef46e	34900939	1	好菜让猪啃了长的像BABY的女神美女和小鸡鸡肚腩胖哥啪啪了看得狼友牙痒痒
7b86acdbb9d377a9906f6384c19ce54a45990596	237121454	2	高颜值甜美新人萌妹子自慰秀第四部新买道具震动体验呻吟娇喘
7ce64cc12a7dada7dc19fe011621d34adfebe52a	23491270	1	独居富姐年纪虽大了但有身材有奶子 与哥们俩3P边拍边干
7ce06f3caabafdb9657eb3d3c87b0aea883c5e48	26932018	1	国产拳交女王周晓琳第8部肯德鸡套餐口味这么重这逼真的不能要了
7c502f53fd1d3898882e9942f47574e4fe33edb3	39515654	1	颜值酷似某女星的水嫩漂亮美女酒店和富二代男友激情啪啪,纯天然美乳翘臀干的表情销魂淫荡
7d41372fe0e7e63cc95d9a70f3c6db93d076040d	27197927	1	虎子寻花吖约了个肉肉身材少妇啪啪，口交舔弄抱起来操上位骑乘呻吟娇喘
7ec6fcae1f334f8e4d2e5a7cebb2d0a7d30c49a9	1425339211	1	苗条大长腿性感妹子露奶自摸诱惑，翘起屁股手指扣弄揉搓掰开粉嫩，呻吟娇喘非常诱人
7edc6b1745ce61682cc6e7fe4cc0339ea79455b7	32221548	1	人妻的诱惑露脸很迷人，大奶子大屁股约出来玩个车震，真他么骚蝴蝶逼水好多，主动口交车上车下爆草射脸上
7f653091cda71643680a4bb043d8adb2b002a301	27758502	1	91C仔-白嫩性感的97年美女,女仆装操完后换上黑丝继续干,抱起来干时,美女说：不要,你的太大了,我不骗你,真受不了了!无水印高清
7fa1d1cead1db9a0ade51df2da262e02cfe9bc7a	104296258	1	91呆哥系列047-小悠妹妹和闺蜜双飞高清无水第二部 来了月经也一样上
809868e8c05c3c18a5e36ffa1df4e58ca142ecf7	59020367	1	麻豆传媒精彩片场花絮直击汇总 各种情色搞笑场面 了解情色片幕后趣闻 高清720P原版首发
810e84488536eb8ba33b2bcd629fd29f6cc1e23e	36591631	1	极品骚货人称〖小伊能静〗炮友来了小骚货必须用骚浪的小穴热情招待 学生装干完了还用玩具玩性瘾真大
8161e9eed64e2cc50bba9f541dda771b681d53a8	412361115	7	Conan.2019.09.18.Scraps.WEB.x264-TRUMP[TGx]
819b48e088417920023ecb8841b8acaa464373cf	35374862	1	颜值不错妹子漏奶装诱惑秀 胸上抹油道具JJ乳交椅子上道具抽插 很是诱惑不要错过
8114466d0965f2f927b545123c2d7cd71b2cb6e7	12926792	1	豪华酒店模特级别长发女神被搞出欲望主动吃J8干一炮换上空姐制服又干一炮呻吟娇嫩好听想要内射美女说不行是危险期
8267c8a114d74b7ae02db171d155ed04e3c4ea98	50831392	1	【陈导探花】约到极品颜值女神，美乳长腿无毛嫩穴沙发狂抠口交，格局太小不能收费下线
83eb06fd783bc82a2f2b335c6cebccc7ae37a79a	11854134	1	文轩探花深夜场约了个紧身裤妹子啪啪搞了两炮，骑坐侧入猛操搞完穿上衬衣黑丝再来一次
842ce847a109a8d3ee0973bf4f824d66a963151b	21728122	1	很久没播漂亮妹子美妞情趣学生制服第二部 漏脸椅子上道具JJ自慰大秀
85fd08736401a4e61e72f2a4589454921d0b3448	15884613	1	性感黑丝美女刚进屋衣服还没来的急脱就被内裤哥强行插进去了,鸡巴太大干的鬼哭狼嚎,好像操哭了,一般女人真受不了！
858f52443a850de78fd4fff334be67b7b1eb8278	202285719	1	情侣做爱自拍流出，露脸口交普通话淫语对白，插入无毛粉穴,高清1080P
855f40d192c3f765374cf4c47c73c338588c4fa9	245509644	2	大肥屁股留学生贱货李美静被野蛮人男友沙发上爆肏太生猛了干到高潮尖叫内射1080P高清原版
85f8e0a4d45e4a3298edc3b43e240ffdc57760fe	21861319	1	主题酒店心型情趣红床偷拍大学生情侣开房过圣诞节妹子脱了衣服身材不错
864477f04996e409913b401c018726ed0940ed29	102748142	1	【手机直播精品福利】主播【小污女与老骚男7】露脸高跟情趣，疯狂舔逼草嘴，多姿势爆草呻吟最后口暴
86bfa67112f8c04a266a995a2597ae5e80f0c73a	626392548	3	Law.and.Order.Organized.Crime.S01E06.720p.WEB.H264-PLZPROPER
86e31865523e977ad41c4aac5fd7fc383fee80d5	31111410	1	极品美臀美穴妹妹把丝袜褪下抠穴无毛嫩穴 还跑去卫生间尿尿
877037fb925c89def5c9a431f4ddf85cd9e4c256	240267223	2	91新人-夜愿-首部作品第一季-清纯学妹做爱初体验完整版第一次连操带语言调教,第二次在洗手间把妹子干哭了
88608b818dd57e5c1efa34ff929821cc8953253d	49895809	1	对白淫荡各种淫语挑逗又害羞又闷骚的文雅眼镜学妹被撩妹大神干的爱液泛滥啊啊淫叫不停表情销魂720P无水印原版
889b155d8caedbcaf316630b676e53bd108c88c8	34024709	1	老哥探花约了个颜值不错苗条妹子啪啪 洗完澡开干大力猛操后入骑乘非常诱人
891a22268af78fd3829c8d179956d69ca808433f	3143821195	3	Greys.Anatomy.S17E15.Tradition.1080p.AMZN.WEBRip.DDP5.1.x264-TOMMY[rarbg]
8942fc9ce9cc0f3b720fd903fc049fe4fd744e42	33735692	1	”啊啊啊 用力操我 鸡巴不要停“ 阴毛旺盛性欲强的95年美女黑丝开档要求男友用力操
8a4e7ad7ff00946f61ec9206169d3c78d2849731	119569769	1	精品国产抄底极品香肩长裙美女的骚窄黑内着气质兼职完美
8ab69f468b25cd5adca51fa8f3d8b5578a422153	17488428	1	水滴摄像头监控TP挺会享受性爱的夫妻边玩边拍相互用嘴搞得对爽地上还有性爱椅方爽
8bb74fc2daaffcab5a6e7b6b9daa91f91b99a3a7	104835902	1	吃药操40岁大奶子富婆到虚脱 高清完美露脸完整版
8bc6dced6263b3e5d3859dff909f68b0e5df6bb2	199209851	1	性奴桃子,调教,强制高潮,性虐,sp啪啪合集
8b0cc20211ccb076442dcbe9c1f6f02062363bb5	2757480	2	Noise_ A Flaw in Human Judgment by Daniel Kahneman EPUB
8b1660914e7eafd5416827d07cf08602c8ffefbb	613998790	3	Star.Wars.The.Bad.Batch.S01E04.Cornered.720p.DSNP.WEBRip.DDP5.1.x264-LAZY[rarbg]
8bd1b295b5d0207ba2dd13dd5aa83dde93458fd2	624338958	1	高颜值主播大脸u收费房自摸逼逼躺着呻吟娇喘 超刺激
8c92be6351e9c741b0a4fe2afc70b7af071db3ba	1791057257	2	Courier.2021.1080p.BluRay.1400MB.DD5.1.x264-GalaxyRG[TGx]
8db091b00b051b94d79b0639962b375590e03dc3	6325642293	6	sdnm-282
8d8e13d2b853aadeedeb56dc1c79ddb3078491e4	5791909853	3	Minari (2020) (1080p BluRay x265 HEVC 10bit AAC 5.1 Tigole)
8ee579c9ba274baf67bbaf492b08d95a48d55913	23229515	1	六岁看黄片1的牛人酒店约炮身材苗条的淘宝兼职模特各种姿势草
8ee0a077396a3f107abb9b81ec1a146aecb63c3d	128020293	1	唯美摄影师L.P.VISION众筹作品集之海洋馆大尺度露出拍摄 小姐姐展现完美身材
8e69089b5017a3b1657b00d8200b0f5f55a90e78	17630082	1	气质型御姐主播身材超正自慰棒插穴 阴毛很茂盛 淫叫不止
8e877990f0484624d954d6b7782261191f6d6ae6	108302133	1	丽江三人行双飞轮操 精壮男操完女友又来到隔壁偷情女友的闺蜜 勇猛沖刺 国语对白 完美露脸（第一部）
8ea3976a8e665ff49fcb7bec3e52ab67678f78f0	14132302	1	声音超级淫荡的极品女主播玩SM，大喊爸爸干我
8f5e53d25ca3fccf7dc43215b5f4effa3b905c9b	37095446	1	抖音上的精彩走光瞬间，少女少妇熟女都有，最爱那低头一瞬间的美丽闪现，不管无意还是刻意，音浪和流量都已到手
8f5908a42ce69b4c05e08de7ea4f12b4313000ad	123538129	1	最美极品爆乳女神『娜美妖姬』定制版新作-爆乳巫女诱惑 棒棒糖淫插粉穴 舔乳玩穴
90091888b3120aa4800b33cc36fdce13d2996137	16796352	1	小宝寻花约了个黑帽高颜值外围妹子，舌吻调情扣逼沙发上操骑乘抽插猛操，呻吟娇喘非常诱人
905c63d1c33b5d3fd146d8fc24c434dfc9fdb537	126448564	1	某站最新流出作品颜值网红美女生日吃饭被灌醉手里拿着玫瑰完全死猪状态被多人玩弄
908fa432da1e89a015e14dc93ad2ba4d5ac2a590	786034479	1	千人斩星选约了个苗条身材萌妹子，丁字裤超近距离角度拍摄口交扣逼，第二炮穿上衣服露屁股搞到尖叫
90afda9c6940a450c44140a5886b23eb799db2c9	32076663940	5	[West4it] DG
90255120f293e497bbc45d4af2b9adac0307dedd	47316259	1	【人体拍摄模特直播】模特神似非诚勿扰“闫凤娇”再现不雅照现场拍摄啪啪，看女神赤裸相见搔首弄姿美艳动人
9114f7800dede5270e62774a57d838f1d9b0b22f	20531059	1	售楼部小姐姐露脸玩个刺激的与小哥哥户外车震，还来着大姨妈就开搞，被大鸡巴草完了赶紧去厕所，尿尿都滴血
914b92646e42a3cf26a388b2af5ab963ce98b571	42281174	1	极品热巴高颜值妹子双女互舔逼道具自慰，近距离特写逼逼无毛张开双腿一起抽插
91269a1f5315657a04981aaf50786c73da365474	22955004	1	【360】补漏黑色主题6月7月精选24集 哥哥不要停 好舒服
91d81c2c4b8c391de153bdb944190ae462adfbb7	1934006850	7	Just.Die.Already-CODEX
91c0efd559dff8425d584682f6e8d253f262abd1	60445982	1	高价收买职高女同学在集体宿舍浴室偷放针孔摄像头偷拍同学洗澡
926cff3052b072d4ab605bef7e19dc85a817d561	1680877377	5	Four.Good.Days.2020.1080p.WEBRip.x265-RARBG
9219f0e67ccd05c0d651c8c4070f41836a600382	2862136462	3	나만 믿고 따라와 도시어부3.E03.210520.720p-NEXT
924f0b2f7a1e702a6a67e63211bb28dccc6272e7	44825437	1	长发少妇各种道具插穴自慰与俩粉丝车轮战操的好激烈
939f77b710f05557358d2df7aab60b4f715e5413	1195570612	5	Star Wars La Remesa Mala - Temporada 1 [HDTV 720p][Cap.104][AC3 5.1 Castellano][www.maxitorrent.com]
9344bad1552e69f56350f6d75325bd78c551d73e	356054732	16	Pat Metheny - Down In Texas (Live Houston '81) (2021) Mp3 320kbps [PMEDIA] ⭐️
94fac641acc06c94e5471ce9ca349a81a408abe6	51669269	1	91大神酒店爆操车展认识的172CM高挑性感豪乳黑丝美女模特,高潮大叫：好大,干我小骚B,快点,好厉害,好爽!
969c0ed8b99909520b46704343a21f507bbfc051	82376601	1	稍微见过几面的漂亮语文老师
966599a8da7510c0959b45c28b0ba1294019137f	25543550	1	【战狼行动】（第一场）超清4K镜头，新晋大神首场女神，肤白貌美魔鬼身材，沙发啪啪调情，潜力大佬值得关注
965a28caed3ef92460ea095db07bf0a5c493cd8e	32036629	1	高颜值性感女神美女和几个好友一起酒吧聚会,玩游戏输了被好友惩罚带到洗手间激情啪啪,男说：你的逼好紧啊!
972da6fb6a9fa0910472112f33e579d77171031f	40525658	1	高级酒店爆操极品白富美黑丝气质网红 解锁各种姿势爽到欲仙欲死 听淫叫就想射
97ae75b9c5dca151a7ef0d922f27c169ad5f143a	2041221556	1	被网友评奥斯卡影帝『人送外号杨导』周末晨炮纹身美乳夜店女神玲玲 无套抽插私处特写 多角度啪啪
9762caea99e324a4e5e08fd939418ecad67e7f57	28571477	1	骚气黄发妹子研妹儿道具自慰秀 椅子上近距离特写拨开丁字裤跳蛋玩弄逼逼
97d36f29d39684f2d2195ffb06ec53bd596deabf	15583839	1	家庭摄像头偷拍纹身社会哥被轻熟少妇娇妻挑逗慾火焚身按头深喉狂肏,超多姿势
97e68a964a49f57d44d73224c0ae2fe7c15e8ff7	37555670	1	男子报复前女友，怒传女友裸照（完整版）（上）
987e9615631e7d4ebeea72f75bce1d4dd2447646	22841871	1	极品校花级颜值美女【甜心小Baby】性感情趣睡衣+黑丝绝对领域俩穴双插，漂亮又淫靡3V3
9ac4855ce1ceb5cb6eb5d9cba232a3ed96a06c5a	14991513	1	老王花重金套路一个大学生妹子用微信聊天相机拍摄女生宿舍的日常生活换衣服不少妹子春光外泄
9b36ebc33c6795670102321a7b9e4c3a881a616a	983773005	1	高颜值美女球迷的乃求 直播大秀 身材也很好 激情自慰
9b0d165ab71858adf100c3f6921d7ddc1e9caedd	25911471	1	超高颜值 极品身材的模特美女被有钱老板包夜服务-高清720P无水印完整版
9bab24e2ced90dcbc3e95c139d6cc93f8800e6f8	140602783	1	最新众筹『风吟鸟唱』性感骚模美林大尺度私拍流出 首次全裸三点全开极骚 高清私拍354P 超清1080P原版收藏
9d7cd0a78f90352d638c85b3a353bb53693fff44	59129084	1	叫了个按摩师来家里享受全身舒压护理按摩 诱惑身材让按摩师羞涩勃起 那就不如脱了裤子好好享受一番 高清1080P版
9eac1abb1bb8f03debdbcaed998ce5e0b9e87ccc	199759458	1	超级巨作！史上最美气质美女被下药后死猪半睁眼玩法超多 9V+78P
9f1a5da7784c86f319fe1cda3f2cc8c736a81910	978099890	4	Station.19.S04E14.720p.WEB.H264-PLZPROPER[rarbg]
9ff61b2edc8851038a3e058f559dbf723a716749	45369150	1	最新推特女神精品博主高颜值反差美女大尺度性爱私拍流出 极品『骚+浪+贱』精致粉穴 完美身材 豪乳篇 高清完整版
a0e2e88e3d20033c73d0f64db110ea03392abe20	10883187	1	酒店最新偷拍合集,360终于发力爱好偷拍的狼友有福了3V
a01a417818405829e0fbe4c9abf0c156db4efced	2914277378	1	Dracula.Untold.2014.PL.720p.BDRip.XviD.AC3-ELiTE
a10f6cf98b4b0779c0e73370f96328d67f42fa12	539689606	3	TrueAnal.21.05.19.Leah.Winters.XXX.SD.MP4-KLEENEX
a121002cab26ba489191f3790d57011e259583b6	395952313	9	Mayhem in Single Valley [FitGirl Repack]
a17e06770d8e73012592c8f443192cdcefbf7ae2	30756812	1	极品网红 脸蛋超漂亮顶级性感女神彤baby9月2日啪啪大秀
a16f85222905ff9eaec18654b3af23ba4f9c57fa	39088891	1	台湾SWAG淫荡女友『Arielbb』制服店点到超跩的邻居妹连续三发强制射精
a15e61fd5f8a4fa1b71e11580ac06cfaf871aefd	224538059	2	推特绿帽大神YQ-K贡献自己的老婆三男在家里从客厅爆操老婆到沙发，精彩不容错过
a3378f7160f54bedbcb1b3c363cc4dbee1a30f7e	41199042	1	很久没有约过外围女的屌哥今晚终于砸了2500元约了个音乐学院的极品兼职妹身材火辣最后撸射奶子上
a41d5f9ba27589643029d53f9e0158bbb92bb8d6	1564425196	1	双飞两个御姐 两闺蜜又亲又摸 羞涩互动互相口交 轮流干两个小骚逼还要什么自行车 完美露脸 高清720P原版无水印
a6aae9358de4b20bc91621fb0ae712a012029e35	21759592	1	韩国极品网红alwaysgenie超大尺度自拍16部全集 难得的极品身材 很匀称的身材 美乳不大但很挺 还樱桃小嘴
a79b7da24163d6430e09ec031e2d220b058f0c11	45936845	1	高颜值长相甜美眼镜妹子露逼诱惑 近距离特写掰开逼逼跳蛋塞入自摸阴蒂
a73a0255f968d7da95c564bd6213d38ec9ff28b3	20501284	1	美穴逼型肉感十足的大三美女【星星公主】玩刺激 和两纹身猛男啪啪3P轮操嫩穴 漂亮逼型让两猛男操不停 高清源码录制
a82b4094a9662b981ea45144b0b24dd94d240f44	1413723195	8	JUL-588@18P2P.COM
a8de7e9941d7b1aabb0004f7fcfd837992c1e665	911054436	1	年轻小哥和两个风骚少妇玩3P叠罗汉加上个电动小炮机辅助普通话对白
a9304ee2d1df404f7e3e1dfcb0ff5680f2521201	66891831	1	骚浪纹身师约炮粉丝，鸳鸯浴逼推口交大鸡巴，跳弹大黑牛撅着屁股被手指抠，腿架在肩上后入爆草浪荡呻吟
a9072a1fdd5c7d2a94749a440e742ed397b3d054	805755148	8	G0519009
a9363cfe5e4493f42821e359016dcac689a29072	189577801	23	I, Pariah
a9e5fb2eb8ca3019d9a7cad35c8e13d4341fb6e0	28668387	1	特色酒店偷拍气质长美女穿着男友买的性感内裤和网友酒店私会,女的不脱内裤说：我怕你睡着睡着操我,你出来,别动!
aad8100e60bc1fcaf6f36ac3f248066ac0567d39	3529804561	2	[JAV] [Uncensored] FC2 PPV 1826072 [1080p]
aaef41d39c358d0e3347508c360797c5eb245c3b	26627362	1	91原创国产AV剧情小伙偷闻淫荡女邻居的性感内裤道歉要做爱才有诚意1180P高清版
aa7c1253745d54a0d360fd361968ec7ac618647c	515637310	10	TVBOXNOW 大滿腹
ab5bb65a80ab7653388c3a5450bafe7793765003	23416976	1	通过地中海服务中心邀请的超短裙黑丝大奶漂亮小妹加了1000元才同意啪啪大叫：好大,好舒服,操的我淫水直流!
ab930004ddfcb57c93550fbecdc5071ead2ae654	26037673	1	杨葱葱新人呻吟嗲嗲萌妹子单腿白丝裸舞芒果自慰，苗条身材扭动诱惑掰穴芒果塞入特写自摸
abc19b2cc801c11852cc183e4c381e681771229a	54341766	1	91呆哥新作系列之风骚女主播33分钟高清完整版
ab8045d8edc97343ec9c77535ded7704568aecb9	529240488	1	长相甜美妹子性感情趣装白色丝袜 胸上涂白色乳液自摸乳交道具抽插骑乘 呻吟诱惑
ab052b2ed3a6214559c99c733de3f2ba803441d9	30269012	1	风骚漂亮主播玲妹妹灬双人激情 一多男女啪啪大秀 多姿势做爱很是淫荡
ab39abfb14868f1f502fd06b38ff1a9565ff19eb	410015631	1	Xfer Records - SerumFX v2.2.9.b8 and Serum v2.9.6.b10 MAC
ac39ed0db48c1f2af1878f61a7026aca6263c47a	5575553233	4	SisLovesMe.21.05.21.Catalina.Ossa.Stepsis.Cant.Get.Enough.XXX.1080p.MP4-WRB[rarbg]
acc7394299b48475e7996c1d5240e2e931cfd593	27865823	1	午夜探花 约了个双马尾萌妹子 穿上情趣女仆装大力勐操 & 胖哥约了个顔值不错的妹子 宾馆开房口交啪啪
addc5dff7cebd3372141bf2028108f3a44367dcb	41105526	1	豪华约炮房很有情调的激情男女啪啪穿上透明黑丝连干3炮打炮椅健美球全玩一遍奶大臀肥女友爽的尖叫不止胡言乱语
ad6c1b524f13406f9e3afff8b0d93c97cf8b81ea	44566511	1	群P盛宴【小桥流骚水】极品美少妇和闺蜜挑战三粉丝小伙群P乱战 超级销魂 超级淫荡 极致诱惑 高清源码录制
afaffb4e7420648ed629ad22b6a0e5dcffc50145	22283987	1	【重磅推荐】推特大神DOM-窒息高质量出品新婚人妻sub母狗反差婊调教
af8b145392dff162048d3fbbd315b4df384cb2e3	47349271	1	微博新晋大尺度美少女魔法少女小柠檬之白丝礼服 漂亮美乳 粉嫩小逼 妩媚呻吟 高清私拍99P 高清1080P完整版
b0b864a18aff5272e1283ef8d9aa4a7f2320733b	50852323	1	苗条身材挺嫩双马尾妹子双人啪啪秀 口交斑点丝袜后入抽插呻吟娇喘
b104f16a7d8d3f748151f084b45d199c45e37f43	15639337	1	推特大神DOM窒息调教售货员母狗和她的女老板，两个母狗舌吻再吃着鸡巴，淫语对白精彩刺激
b1c905264446f56741411ab0b2cf100d2a39ed7e	40539660	1	PR社尤物女神の我是你可爱的小猫大尺度诱惑福利60套打包合集
b1b7c8fb5a97930e70a6c6f439015aeb036592cd	469396748	1	颜值不错桑拿女技师先是给客人认真按摩 然后激情啪啪
b2648ad704fcf412549d7cf5ffab363eed52b1d3	135048660	1	高颜值清纯大学留学生优米和闺蜜一起伺候男友 口活劲道有吸力很有当AV女优的潜质 无套后入浪叫 高清1080P原版无水印
b3032f4823462e26bb1f21d6c5df141ed70a4b9e	85121917	1	据说是某明星生日宴喝多了叫鸭子扮成女人偷偷来打炮!以免被发现
b4b80f87d16be946f682b8f7dcc5d7a67ab8ce07	49407492	1	【女神福利】青岛高学历173CM性感美女主播＜医生亲亲＞和男友聊着天舔着土豪鸡巴,被操的多次喷潮!国语!
b4795f85d60b82f707233a044e641e46b038a447	22847059	1	高颜值大白美人妹子道具自慰秀 逼逼非常粉嫩跳蛋震动塞入高跟鞋非常诱人 很是诱惑不要错过
b4d5985b5599056d7d1cf532ab62735a0c58ca97	20644725	1	风骚韵味美少妇道具灬媚儿丶 一多大秀 戴着一个眼镜扣穴自慰很是诱人
b52e7bd1bb06d4101305c873d8ffaeed6b550133	24330691	1	【深夜寻花】酒店约操兼职美熟女，淫荡骚货配合度高，后入大白臀冲击力超强
b519bc71f994ba4e4207c2d140657e69959285f0	41526877	1	淫乱的房间年轻帅小伙控制不住了，被老熟女舔鸡巴压在身下爆草，累了换姿势看老干妈激情上位，熟女就是败火
b6e28f7436b1f075e9ae0950472fd571b6ccdc3c	271724112	2	极品苗条骚娘们海景房穿泳装被啪啪还是一个馒头逼娇喘呻吟
b6e7e9c94895fab3e3803e967b49838fb359497a	35987393	1	胸前纹身骚气大奶妹子道具自慰秀 情趣装黑丝振动棒快速抽插出水
b798e23ec0a36ab351f175537e01da3d1c807b15	44538039	1	首发嘉兴房地产女主播售楼处小姐姐勾引男同事户外啪啪
b875f8626ca326a636b80b87921cae33844f8321	26901329	1	水嫩漂亮的长裙美女刚兼职援交,脱衣服时还害羞用被单挡住隐私部位,真激烈套子都干坏了又换一个继续操.国语!
b89450af0e119b5ad4c507c152e63385fa8c6ba4	734731285	1	虽然长得确实不好看，但身材不错，最重要的是她是潮吹女王，我的爱如潮水，潮水就像水龙头，深深的插入抽出鸡巴就狂喷
b84e73a87e0c2b3b079d9382f974989b1d5a47b5	479841032	1	重口网红嫩妹艾儿.秀.DV.原味制作情趣内衣搔首弄姿说好久没来了想要大J8干自慰超多白浆高潮喷水很有撸点对白淫荡
babf9122566dba211a6f7f9f47f64cc79dcec2b6	341829655	2	Chicago.Fire.S09E15.WEB.x264-PHOENiX[TGx]
bb5407f2acca6b894ad034e56a38bf4cdaa5837a	49260265	1	青涩小哥跟随好大哥一起干大奶骚妇玩3P，旁边小床还睡一个妹子，大奶骚逼轮流被两兄弟猛草，叫声好骚刺激
bb081e1a99846e6bf12f2dad21b1b58cb462bba6	22309655	1	骚少妇露脸与炮击激情啪啪，看着真刺激露脸深喉大几把，炮击抽插骚逼还让男主舔逼真她么骚，激情爆草浪叫不断
bb94737c6256023b980cb846c5808ae1a008bbc6	25641105	1	国产精品大片182cm车模女仆装VS混血哥完整版
bb43b45a173f22e4a3237b2d92bf7c5f8a2bc2d2	43724621	1	颜值不错长发美女小舟女仆装网袜诱惑 拨开内裤自摸逼逼摩擦阴蒂呻吟
bcfa4cf44392afba7f19efc6d3ec1060a2533057	42451621	1	童顔巨乳短发邻家萌妹,外表与内衣不符,坐椅子上自己扣嫩茓,表情清纯惹人怜惜
bcf52a265be0d58d7015490eaad9ad76d4cc6fff	623344428	2	Omer, sueños robados - 1x63 (HDTV-720p) Castellano
bdb52a22a5666e812b781905cdbf61e55db03457	1889140419	1	【AI高清2K修复】小狼友探花花臂纹身说话温柔外围妹，无毛粉穴一线天，吊带黑丝学生情趣制服，69口交翘臀套弄后入
bd1860048980882b7df84b99fb3937df2c06b9c6	31263566	1	中国勇敢人妻和5个黑鬼6P，爱真的需要勇气。三洞已爆废。排队插入少妇轮流内射后用嘴清理鸡巴
bddf85c33e35367831f7cf24549cc105c476f8e5	48583393	1	哺乳期的少妇户外跟大哥偷情啪啪，全程露脸喂大哥吃奶，激情口交各种姿势抽插爆草，骚逼特写尿尿挤奶给狼友看
bd7d70cf37051021bf8cc3f3a89bc788edf1f1ee	35787749	1	听朋友说隔壁出租屋来了个靓妹晚上偷偷的躲在浴室窗外偷窥她洗澡乖乖下面毛真多
be02a78d30e534c871d4a0d0637d9aaa6db77e6a	232535158	27	Lazy Ambition - Discography
be1dc00e87e1af0b9f716fc34364a5eaa3d241cc	1498020789	4	SexArt.21.05.21.Eve.Sweet.And.Ivy.Rein.Girly.Talk.XXX.1080p.MP4-WRB[rarbg]
bea9747d0eef2cdf5c2a326175e50e12ba2728cc	33493043	1	对白精彩淫荡骚男一边给妹纸打着电话聊骚一边享受胯下另一个妹子的口活电话里妹子还想听他俩做爱的声音720P高清
bf6e3c318b669f8fc5f5de96930beba95e0b231b	1649934459	11	forum.japanadultvideos.com-HZM061
bf22208475b564e43ca49c10cf4788a9ed8f60cb	26541913	1	午夜寻花酒店约炮精品上海白皙D奶巨乳美女,口水当润滑油被姑娘嫌弃
c0b5071047bf52d59895ba7f43ef89a10313b1fc	41927212	1	最新国产剧情TAV瑜伽系列淫荡小只马身材苗条妹子瑜伽练习被私人教练猥亵爆操解锁各种难度体位国语中字
c179939bf2cd2b3c02e2d5dc7e03c727f7c04e32	1790365365	29	2021-05-22-1-24
c156b4d490891fd6720321af7287287177f85759	64761083	1	清纯漂亮小嫩妹主播和小男友光着身子直播 一个舔逼一个吃鸡巴 有个这样的小女友肯定很性福
c157ef1abfe5993c91ecc94ab0716cffa5467299	41366416	1	棒子国经济不好啊 混社会的纹身小哥带女友直播 实力秀恩爱 沐浴亲吻扣逼
c1ca95871540e2f5711514b5e69519242be4c8b4	83175307	1	极品推特网红生物老师『闵儿』自演剧情诱惑 指奸菊花再戴上狐狸肛塞搞的小穴湿漉漉
c27e6ef583da92d917fd49c875d3f35469e1c98e	737561573	1	开裆肉丝高跟鞋骚气少妇情趣秋千上啪啪 站立后入大力猛操呻吟娇喘诱人
c3cfb9446bd99775c3fb59a4342b75966cee8c29	96973589	1	很骚的野摸掰穴近距离特写 湿淋淋的鲍鱼很诱人1080P高清
c3608364138f11fee4ab0973b11de29be2b8c842	40820606	1	帝都小骚女微露脸后入狂干大屁股，边打边草写字羞辱颜射吞精舔干净太鸡巴骚气
c325995fcc0228ba4e3b4c97b44e24099bae7d43	44635296	1	不戴套弄怀孕就成你老婆了大肚腩胖叔嫖妓被套路原来这小姐是有鸡鸡的伪娘假扮的
c32e0f500b1a1c8c0402e3aa001e0212d6078ed5	170454771	1	冒死掀帘零距离欣赏发育丰腴的美眉冲澡,雪白肥硕的豪乳和乌黑阴毛真想伸手摸摸
c470437946584cbae49cc6861230938d166be61a	43289386	1	【美腿靓出淫荡】完美身材美女和男友激情日常炮 翘挺美乳 全裸肆意抽插 从床上干到沙发上 抱起来操
c4b83aac11d80da4876c1c0cc4dc460fdfa8d46d	38764150	1	高颜值身材苗条长发美女主播第八季 自摸扣逼全程呻吟很是诱惑不要错过
c6ff4488194939ab166575573fdce073cae36617	69533592	1	试衣间里爆操骚逼，真刺激
c635499dbf2d21e0bd6ee301116f6eb7d77c2125	55355062	1	一类狼友爱看的蛇妖大圆臀撞击
c61549dc0cfa58a4d9600590cb61ba96cd9e3c7d	97582356	10	Bernardo Lanzetti - 2021 - Horizontal Rain
c6c509c9de9cb2dc40ba7d89b7e592be0e9456c3	1139395338	2	Star.Wars.The.Bad.Batch.S01E04.1080p.DSNP.WEBRip.DDP5.1.x264-END
c73eb131ea29855fc6ae60c732f51f1ffcb9983c	941459999	99	NTR017C
c72f10202ac00ff6d95e72cff1e53a1e22cc484b	500645636	1	[Passion-HD] - Marley Brinx, Kristina Bell - (Pussy Pose) [NEW January 11, 2016]
c8c5f6e6230c257596abb088bd377bb08924dca3	25178391	1	明星颜值长腿比范冰冰更漂亮女神马儿关键很骚长腿细腰
c8672ffbe7f056fe6a4a8679b7a97d1ffdcc77c1	45356861	1	胖男老哥【全国探花】约了个性感大奶少妇，连体网袜后入猛操搞完休息下再来一炮，很是诱惑不要错过
c91c63c45189722a34e3bc7dba16be2dc0f7b0ca	19940261	1	定点偷拍公共浴室女士更衣间少女少妇脱换衣 有个少妇逼毛真性感屁股白又大
