013bce2233720fcb40a7da42629954276b2d1b6a	43220074	1	新品清纯草莓情趣装爆乳性感女郎极上高级泡泡浴正统帝王套服务推油乳交毒龙足交打炮国语中字
09daef3e7f2d79a5258f239357dd4cafa52a5309	68199452	15	Critical Beatdown
0bd0c137e94cbdb3bea5473d83e2336e8f35b60e	21287540	1	国产SM,女教师&学生,抽嘴巴,舔B屁眼,圣水,各种羞辱，最后把果冻塞屁眼里再拉出来喂给女奴吃
12c25f016771231c2549ca987a0babe8dabf8aa5	25715482	1	纹身光头土豪肥猪佬按摩保健会所嫖昌懂英语的兼职少妇推拿手法很赞吹硬猛干这是充电了连射2炮很猛
13f1d72850c00cccceeb1530adf486237fe348b7	92124224	1	完美胸型美乳少妇 女上位
2555a485bcb704d65fd208b3a946174b4f936330	43749461	1	如此饥渴的大奶熟女忘记自我忘记世界沉浸在享受的世界中床单都湿了快来个J8干她吧
286ac7cd03f729360cb364aff88d370b9f245048	104472231	1	91小哥酒店猛操南航空姐的嫩鲍 操的太爽了
28fd001c680a1642401dc460444fc8e8c6f6a6c0	66059435	1	骚胖游全国会所享受年轻小妹的全套服务，口交毒龙冰火漫游刺激的不得了，各种姿势爆草蹂躏身材娇小的嫩妹
2db285b5340512232f46aa804ac4f21a46b20de2	373365593	12	Антология русской народной сказки. Том V [Герман Садченков]
3e3f4931176fd477c30e0e7c31e6f5850abb3f8f	12585455	1	探花野狼10号约了个黄衣牛仔裤花臂纹身妹子啪啪，沙发上调情口交骑坐再到床上操后入抽插猛操
4a1b951d14e6e52d549e4d1c3a43664a3ea2a079	33698552	1	高颜值气质长腿外围美女被大屌男搞完穿衣服走时又加了1个钟继续操她,沙发上各种玩弄嫩逼啪啪,钱花值了~
4c2466fa65290e79d86ca0be06120f5314d05d34	38888610	1	长相甜美大乳晕巨乳妹子【颜值学生】露奶掰穴诱惑，粉嫩肥逼自摸揉搓特写非常诱人
5887d43c0cc02554cf1ffd76d14bc9e7138b5aa7	41438442	1	性感漂亮主播直播秀 穿的情趣内衣很惹火 自慰插穴很诱人
5ba2062108022994a76bf44bdb80dd67b8464473	77964698	1	露脸抄底红色超短连衣裙的蕾丝白内内的姑娘
5deb9bfd95d87b8d002644d5c99206400a5284ed	679319403	9	2021-04-08-19
60daddd55da2f141f4f96e7efce44b6dbd1ca6de	1033146534	3	Ava.2020.BRRip.x264.AAC.BGAUDiO-SiSO
682497d7bf33d4987c4220ce491c32d073e2c0b8	85302569	1	最新众筹风吟鸟唱模特婷婷被摄影师EDSION用棒棒淫猥逼逼弄出了血
7354a7091b232c251f15f9b99d41938bc0e586f9	461024641	1	颜值不错长发美女性感黑丝高跟鞋诱惑 床上脱光光自摸扣逼非常诱人
765b3fac15ece06c84c610f6155fabb0370f7591	44850167	1	『韩国版百度云泄密流出』和极品白嫩美乳情人激情炮 69互舔 后入怼操 全是淫水赶紧擦擦 高清720P原版首发
7a9d24e311122d3e75b5c5efb122a5f2fd463e44	14311633	1	稀有360之吵架打架系列,看着挺清纯的苗条漂亮妹子裸体飞踹男友，身材好颜值高一对美乳大长腿
7ab634983036f9585f208bd18d3037e6b7b4e4f2	199391983	3	【肌肉佬探花】偷拍极品外围女神,丰乳翘臀魔鬼身材风骚尤物,猛男激战淫声浪语娇喘不断,高清源码录制
7d0842353c180185ba56af213936499cfa4cf2ab	273052216	1	RCTD-374-C
7d137c725009e9cd3907ba282caf82ec217d95e9	39897030	1	地铁尾随抄底偷拍美腿短裙真诱惑（第七部）
836fae520ea864c73d45ee0eff163524bfe50427	64164851	6	Visionmasters & Tony King Feat. Kylie Minogue – Keep On Pumpin' It (1991) 320
861742fcc32f320e7cb3cd1486017017ea4b934c	77360012	1	京都漂亮美乳大一女学生约炮粉丝户外啪再战小树林 极品小骚货 漂亮美乳 边揉逼豆边后入抽插 冲刺内射
8aa49aea0bb50963b5340c8426cc5b1f71901738	23609181	1	颜值超高长得像某明星的美女主播为了赚取打赏不惜约表弟家中直播啪啪,小伙真猛操的淫叫不断,国语对白!
8d9d8701be2b04e78336674c48104c31a1e42631	28645107	1	最近超高人气主播探花现场直播真实约操高颜值C罩杯网红级美女 有点羞涩 有点像香港一个过气女明星 最后冲刺
8dadff6f603228e9fa12c6fae7076600bf6db658	41121848	1	全日航空极品苗条身材高颜值空姐与公司高层开房啪啪啪 叫声好听姿势多操的猛
8eddcd02e75f7f7a5d82e0a231c748c5ac4f65ab	1798144418	1	BDA-121
93fc563864d002b30d0d9fa30172d7d97a7b2d47	93392277	1	开头手式验证 操逼内射
96005197f716f60647df7fdf497a5b29cb5fd550	326889258	9	torrent
a0a47ac493862e867053d62c1e9334b7131c3350	1798832657	20	Barney Wilen - Inside Nitty = Gritty (1993) [SACD] (2016 DSF-WV Stereo)
ad23d3abeb7ca79f58f5384711064a5b5f64534e	44427866	1	最新极品网红爆乳女神隔壁小姐姐会员版之高领露背毛衣 欧尼酱杀手大CD 揉美乳 露粉穴 超诱惑 高清720P原版
b181664c7a78515d82aca934321151168fec4035	35323822	1	午夜寻花约了个黑裙苗条妹子，沙发舌吻扣逼调情口交舔弄，上位骑乘抽插呻吟娇喘
b2ffc38ae884ca70550be0c1670932745ad2dc3d	176492574	1	苦涩异地恋 见面疯狂操 披肩女神级美女见久别男友奉上肉体任由男友玩弄 太饥渴操到叫床快哭了 高清1080P版
b4c80ecf034b844ed12daf7b478be5707e2dc4e8	39107255	1	皮肤超白,嫩的流水的艺术院校性感美女私下兼职援交不小心被大鸡巴男无套内射了,逼好像被干肿了用镜子照着看,鲍鱼很特别!
b9647c6e07517e9dfef6403277cfb6486bdde565	41145864	1	颜值不错戴着口罩的妹子 身材很棒和炮友在家双人啪啪大秀 床上口交 后入操逼大秀 非常诱人
c2e55651960868c940678849c0b0169cbd15340f	26371827	1	91沈先生探花深夜白色背心萌妹子啪啪，近距离拍摄口交骑乘大力猛操
c7b298c031983c87b8d4f1fe8767f6ccb045454a	66727613	1	SWAG 大眼萌妹VIP粉丝约啪实战 指定主题OL诱惑 窄裙高跟鞋颜射
c9a255b3f3746003960ae292f0ec820229c86de1	712835524	1	常住越南的老狼哥 约啪9分极品明星级别的越南妹子 高挑的黄金比例身材 还有真实大波 老哥居然说他都操腻了
cbd616e0a5dac68d3fa287b43621ee3123c80d6b	1060445068	3	#_INDI036
d47c282ec30800f611aa104122c4ee5201f79a57	24211195	1	王总酒店约啪胸大性感的齐逼短裤长腿美女,特别喜欢自拍,颜值高身材好,下面特紧才半个小时就把他搞射了.国语!
e9680526e9c2ae9c78ab2967c60d671b85c62541	84144564	1	【极品女神】极品尤物美乳嫩模『梦心玥』魅惑私拍合集流出 丰臀美乳诱惑 及品质诱惑 视觉盛宴 高清720P
ed320e1672d915067804ac4c85fbf27a581ec67c	276623061	1	nsps-960
f3994113692efbb6eaceff45fb6b79d02111882d	40119235	1	刚直播时间不长的小妞露脸玩的已经很嗨了，护士情趣服黑丝高跟，骚浪淫语小逼很嫩，两个道具玩逼到高潮爆菊
f8d668cb58300d18c63faab6db1ecb1d8a29403a	54732169	1	屌哥酒店大战外围模特小安勐干了2炮换了两套情趣装各种体位啪啪啪抱起来日啊啊大叫说亲爱的快点1080P原版
fc42cb4dfba7545eaa0a4d9e5eb70191d7587086	463274258	1	劲爆身材，超燃Cospaly究极蜜桃臀调查兵团啊卡曼之【进击的巨屌】 狂热高潮自饮进化淫液
