76342f5764f3cd4c0856bf7a66bf5c196db2928c	32572494	1	推特很火的骚女留学生刘玥同闺蜜一起伺候大洋屌干净无毛B撅着翘臀戴着肛塞换着叠插爽歪歪
78c524cd9c8c4f6ef5d20676dc629c9910149768	61624045	1	会说几句英文的SPA会所女领班炮房亲自接待非洲黑胖哥还好这哥的鸡巴不是很大
78aa002826810fa74f53ba7d60b7fc5978d075e9	31499715	1	极品风骚黑丝少妇跟和光头老公居家做爱,观音坐莲啪啪的直响带感十足
798b6d5abee79fc28a1ac1bc2fe5588afd3f2904	87225199	1	最新门事件刚放假某省财经大学宿舍没装空调情侣跑到院子里的树荫下啪啪几个同学躲在宿舍里偷窥调侃
7a3481864ac932986fc877e3a852d6bde5a52bbb	20756310	1	一龙双凤骚妇粉红少妇小甜甜和闺蜜 大战头套男双飞papa
7c3c22808e5ef3e6aeb53129a6835296107e6cfd	5246037431	15	Agents.of.S.H.I.E.L.D.S06.400p.ViruseProject
7e2efa2f60155e88421328a747c1e26e60f34134	176783360	2	Lobo(бестгеймер нет )
7e770051446f3483efe5482dcce27131a2abd197	61599759	1	红肚兜少妇夫妻啪啪秀
803b84cdddb9f0ff648d8908f34d719ae9918707	17958514	1	小宝寻花约了个颜值不错花臂纹身牛仔裤妹子，舔弄互摸口交上位骑乘大力抽插猛操
806e1b1b0e0252e8f5f842ae8d3bf27463bfce99	31997276	1	酷似陈妍希的小嫩妹，光头哥一点儿也不怜香惜玉，手插出水后抱起来疯狂蹂躏，娇小胴体尽情享用
81f91dd36ba0e88edc50f4493c463093df676215	2219407242	1	高颜值气质美女第二弹露逼情趣装护士装 近距离特写跳蛋震动逼逼塞入拉扯非常诱人
81cf75ad70390a508361fcb63de240fdfb7b7872	33196324	1	最大胆高颜值白富美宝马女车内全裸掰粉穴直播 外面一群孩子打篮球 脱内裤开车满大街找单男求操 淫语对白刺激
81c8255d0a21c52e9a536974efd515a0727686f8	1548087066	3	The Skyhawk (1974) [1080p] [BluRay] [YTS.MX]
858c9fa08c2cb03d62fc4f841582c4355dbd9aa0	1226686653	1	清纯女主播【韩伊伊】，清新派美女，露脸福利，揉奶娇喘呻吟诱惑，笑容美，叫声甜!
853ef6ec72f3d1dc9a9227ae2d07a08359fa4ec3	34507442	1	洞口偷拍女生宿舍换内衣，清纯学妹白嫩大奶稀送阴毛真诱人
8678a4f5e37d9e9d4c87bda0dd1405d630ee4942	43080392	1	身材苗条气质口罩美女主播闪脸自慰大秀第二部 新买道具JJ椅子上抽插自慰 呻吟诱惑
86cf27e284dfc1d1e321aa1118142eed20b77270	291369800	1	丰满巨乳主播全裸道具自慰秀逼逼无毛
865126c1835382f4f3d339ca2afd8d864cab3b82	443350722	1	最美爆乳嫩模网红〖闫盼盼〗罕见与土豪粉丝1对1大尺度私房流出 白丝吊带 极度诱惑 爆乳丰臀 表情妩媚 高清720P版
8627328309d465f602fde94701343f39e735e783	9576534899	15	Doom Patrol S01 Ita
87998ed19c03810860022c138c54644cd92b6501	122872926	1	步行街潮流精品服装店的短发气质美女老板娘喜欢大鸡巴猛男
878cd58b0cc4f6f2b0ea60f3d01c5e0453db5b30	637164925	1	FTL_Multiverse_v4.10.4_Rus_v0.4
87bc70652ed030c0eba6fb4707dfed0b02db3d3d	307604506	1	性感美乳女神小鸟酱大尺度COS超清视频写真
877a1da0e9c8a51bc8e556811579320ff6da81ba	28402553	1	金发网红脸少妇全裸扭动诱惑 椅子上翘着屁股道具自慰呻吟娇喘
87c97b1c50ea9b7477149aebd34f77f680b94dde	31258426	1	白嫩漂亮的美女被2个朋友故意带到KTV包房挑战刺激啪啪,不仅轮流操还让美女脱光衣服站桌子上唱歌,唱的真好听!
887b1bce088c10a5d8666e892e28f632404c4902	60645664	1	色影大师王动之作【Kilig】性爱私拍 多场景激情啪极致美臀 漂亮美乳 高清私拍113P 高清版
8913ce82f9110e788e17afa82db4d7de83ed4768	30776420	1	高颜值小姐姐 床上单腿黑丝 阴毛旺盛 手指抠逼 边扣变说骚话 透明道具插逼 来回抽插呻吟 非常诱人
8907b6202b0ab512f71c36ef92441d9d99e8fed0	166868108	1	2016深圳内衣展唯美性感美女模特内衣走秀L-02
8a8b027fdca8c0437f880b8359ee0a12c5c2a48c	336868999	3	GirlfriendsFilms.21.05.16.Diana.Grace.And.Penelope.Kay.XXX.SD.MP4-KLEENEX
8abc5dcd2efec2534c7e52e662d979b85599c0bd	20687524	1	果贷新流出御姐型美女曲雯在床上全裸紫薇抠逼视频
8bd2c0ee6dbaa571848c98ac926900d588549f94	8967133071	3	Cowboys & Aliens (2011) Extended (1080p BluRay x265 HEVC 10bit AAC 5.1 Tigole)
8ba49c4a02289282b40d48a0fe598b44b0ea5fcc	40036840	1	颜值不错美女薇神直播大秀 身材也很丰满 激情自慰
8cfcb77cf996cfcd7bd0624b2a3f577c66a0f7a1	71233695	1	萝莉@吃货小绿M 会员付费 NTR少女死裤水
8ddeb575d95d8153260d2c11019c1d639f3fde85	298762047	1	“不要拍照 我要拍的漂漂亮亮”无套爆操大奶小女友开始还害羞躲闪不让拍 后来给操舒服了也顾不了了
8ebee48dfaffc7aefd5ce4545f6c7207be17f0dc	223593621	1	【360水滴TP】颜值都很高的小情侣在家里翻云覆雨 马达臀上位很给力
8e6a34855401ed3696143cd1a36094f7eae6f9ff	32663865	1	猥琐大款富二代酒店开房约啪清纯漂亮大学学妹 开始有点害羞最后还是被大鸡吧一顿勐操征服了 高清1080P版
91de49038126597b484a8b6aba426f9dcf6fb864	86299083	1	熟妇3P第二季露脸口活漫游毒龙脚丫子屁眼全都仔细认真舔个遍年度精品
91668244f8d29b1b85a863d7b82fedf3c875a468	39316608	1	苗条嫩妹直播玩幸运大转盘 转到什么做什么 观音坐莲揉胸叫床自慰等等好多活 十分有趣
9194c9ced3034890a29d93b59f6be3ac4ce07576	42080890	1	皮肤白皙美少妇和很逗逼亚籍男友啪啪秀可惜弄了半天硬不起来
926ecd4de66b871bd55de45052544bd30a5eba38	49207017	1	青涩小哥跟随好大哥一起干大奶骚妇玩3P，旁边小床还睡一个妹子，大奶骚逼轮流被两兄弟猛草，叫声好骚刺激
93f68c5c219dce1957f1514108ca3e0cfd9f976a	19353518	1	演绎被骚扰 激情啪啪大秀 喜欢别错过
94bebc4e0f26a4a0d14c283788671be2599ea80d	18876638	1	高颜值美女主播韩老师98收费大秀 颜值身材俱佳 阴毛不少 很是诱人
949b15e7bd2bacf6b3ea8c8ac2ee62c9fd622b0e	40188994	1	裸替演员沈樵剧情演绎夜晚池塘偸偸与男友约会初尝禁果开始说不要进入后爽的说宝贝我要呻吟给力很有撸点
9427449852e73dc4292d660f1fe5c967ba971474	243241233	1	PegasProductions.21.05.11.Ella.June.Morning.Surprise.XXX.480p.MP4-XXX
94f16c22f0a696d7eba42f0dc76c73f78a456d78	3770637043	49	B.Positive.S01.WEBRip.x264-ION10[eztv.re]
961253e391f0fccdb4f7f2cf8d0fc5386a85098b	53315531	1	汤不热各种小母狗调教视频合集
96dd07082567de63b03f5926816d94851d7e138c	7286663168	11	Comedy Club.S17.XviD.SATRip.25Kuzmich
96a8bfe5ec72224763f1730eadac434ff82be49c	42864318	1	贵州小旋风之调教白富美千金小姐猛干再口爆
97caafc57b33959da37f1bdda9258a6dd907c87c	25239843	1	学生情侣开房被房顶摄像头偷拍 都玩上69姿势的 女生表情给力
970f181fdf98ddcc6c3675ba5a81204def832590	305809393	1	最新推特萝莉美乳网红『青木小荷』随性私拍合集流出 激情啪操 无套抽插 干出白浆 高清私拍77P 高清720P版
98d34c623e61e3a776ca5b17133ca1e85d001a80	61706903	1	快来艹妈妈,妈妈受不了了,风韵犹存的熟女臊妈和没多大的儿子玩母子乱伦,最后内射水流一床
99ae3f3ca1942e1447c2254c76976916d441b892	1910456954	4	fc1763753
9ac69c544f19cd5a54051c95bbcda8b1eabccdf8	526803943	1	xh98hx 星级酒店浴缸里大战女僕装饥渴少妇三百回合 高潮爆射吃精
9c0bdf0dae77daf0320d61f8371934b9ff809a98	45122694	1	精彩3p 粉色情趣连体网袜诱惑 肛交重口味拍JJ
9db5f9041f3fd500e31013633ee277dc87057310	30896860	1	年轻小情侣啪啪秀 女的很漂亮 年纪不大奶子却不小 多体位插穴
9d622ccb357f184a7883debf5b259bdc9e59758f	1263772492	9	503-15
9d81e36b2daed193c310db05ffea6d880784ba8f	17871587	1	冷先生调教不听话的小女女戴着狗圈口爆吞精高清无水印
9d1595f172c44f29fd26711659e09c23e1ec8ecf	39446451	1	做爱还打电话诱惑我 干的你起不来爆菊
a088672f756603d9b7f65543d75ab9ef01b38766	28439623	1	国内小夫妻度蜜月在旅店洗完澡后浴袍下的嫩白肉体鲜艳动人，身材特给力。难得一位漂亮熟女. 插的哇哇叫
a054c7af9f15481444e40c93e24a45d571b9e378	1406691738	1	91大神呆哥最新重磅精品大片高端约会系列-极品声优人妻听声可射，刚生完孩子就出来偷情，喜欢听叫床的狼友有福了，刚给孩子喂完奶就出来挨操～1080P高清完整版！
a082ef962bd06980bcd06e63c9983c378ccbbbce	36363353	1	巨乳小骚货啪啪自拍，呻吟声娇滴滴的，听了就想射
a0f073f5ba302930c6ea981bca9f7648e12faeee	34613131	1	【探花中的花蕊】肌肉男对战小萝莉，美腿高颜值小姐姐不容易啊，高清源码录制
a17894b4a77d34571fd594814b93cd42fa36780b	40477239	1	91K弟最新力作，露脸约操小甜甜，狠狠的操完她，口爆吞精
a128a6ae2edb2ef7db6aa7d5d74ddee9d1d68498	62826860	1	露脸骚货浪女，舔屌搾精一脸的享受，之后女上扭腰草个爽
a16973a803780138d5a31a34f0129ce94e41d8e4	80862575	1	风吟鸟唱身材非常棒的国模梦琪(水空月)私拍大尺度套图视频
a218a46c288c453bb668560dfe74213061c0434d	43291090	1	公务员小女友周末一大早把我弄醒玩鸡巴上位骑坐720P高清无水印
a23caf15d9f53fe017c964dfffbf8c5d4af0b47b	57352207	1	李寻欢探花花臂纹身高颜值甜美嫩妹子，舔奶摸逼深喉口交翘起屁股后入猛操
a28932c06b893b7076c6fa35780af85b6c8690c6	25160541	1	身材丰满野花哟双人直播大秀 激情口交啪啪
a4679e99525a06862abb6efe3084643301b5450d	42651690	1	【网曝门事件】喜欢做爱自拍的新加坡性感女博士与不同男网友啪啪不雅视频流出 多姿势AV式啪啪 高清1080P版
a50b74eecabb39d75462a286d9b767ccaf74ff55	37098347	1	颜值不错眼镜学生妹直播大秀 双人激情啪啪
a6a8147ea24011e82ad6f4d9c0acb5e410a3a846	49753155	1	金发网红脸少妇全裸用笔摩擦逼逼 凳子上翘着性感大屁股手指插入
a7bbd507a7eb5e8b7b527e62a3e369195c346093	37127461	1	风韵犹存丰满大屁股熟女黑丝诱惑 露奶翘着性感肥臀摇摆看着非常诱人
a854c2966c51081324678959f26b2effe464d91e	196033271	3	狂插漂亮大二学妹～骚货明明很爽却不叫出来～表情够带劲的
a8f33ede38536a17b30d2bde5d8024785af7b1ca	92520898	1	网红嫩妹二次元狂热少女私拍套图视频合集
a9b56470dba8f06322ad00a72c932a2f692b3d8d	19787245	1	闷骚的眼镜女孩，大厅独自玩起了自慰，免不了被男友一顿爆操啊，阿阿阿淫荡地呻吟 很是诱惑
aa41d1b245efa66283a8bd963c83a7fd46f8cc93	774459153	1	91新人16先生最新精品原创大片第二部-不穿内衣的E杯气质白富美,172cm很有知性美的气质女神，高潮时大喊：干我,不要了,再不射要把我玩坏了～1080P高清完整版！
aafc4cb9a28d55764dc390c917d8b30d6f1d7aa2	24783116	1	颜值不错苗条妹子约炮双人啪啪 后入上位骑坐大力抽插呻吟娇喘诱人
aad595ab49fee743d14a76e40a73bd09beb0c0a6	24269475	1	完具少女W 最新 收费视图
ab34f96f25627fc05ca5d4cfe7d6f6d4245d8ff3	31758139	1	双女道具自慰身材丰满大奶 床上炮击玻璃棒抽插出白浆呻吟娇喘 很是诱惑不要错过
ac913b6316160d72af5029d83e41760989679394	10779229	1	弯屌男3500元约啪36F极品性感美女,提前偷吃性药,各种爆插,时间太久美女不行了说：你还不射,自己打飞机吧!
ad7f43305934ad36f9d7eb756b4e59d9bb20da70	904076992	2	North Hollywood (2021) [720p] [WEBRip] [YTS.MX]
aed754a594d885ef090b3efe41500109499aa599	32058419	1	裤衩响叮档新人探花酒店嫖妓偷拍口活非常棒的兼职美少妇用矿泉水漫游激情啪啪
ae750336c4953d84c171b68d7089334e392393ac	15921632	1	威哥全国探花约了颜值不错白衣妹子，洗完澡口交上位骑乘床边大力猛操
aea2b3aab3f4d9c0d84b08751e6bba4ed319b5fb	61968245	1	国产CD系列胡玥枫给身材精瘦的小伙激情口交射嘴里
b0336fb4f7e35c507ea8a3902ec0354840509440	29269137	1	刚开苞没多久的漂亮大学美女又被男友哄到酒店要操她,美女害羞躲闪不配合,男的各种姿势猛操,妹子有点受不了!
b053fad129f19e82f577103847bb674a80b1c8c5	157409197	1	妹妹掰开自己的两片粉嫩鲍嘴让我进入身体
b09d85f93dd6e7a8da33c0bcecdf69aae31b9ae9	228732636	2	小旅馆偷放摄像头偷拍光头哥和漂亮马尾辫子美眉开房啪啪妹子身材不错
b1b59ecc97bc402fb3ab9acef08262af83ca0814	326443243	3	MomDrips.21.05.16.Lily.Love.Busy.Husband.Busy.Wife.XXX.SD.MP4-KLEENEX
b175aab1b759808534802d19789d9de6a94ee3ba	51825389	1	南航空姐完整版 10V
b22332902fb2a39bd5c19724ad0386b40ee52780	74253524	1	云盘泄密-36F美乳性感的漂亮美女和土豪男友居家性爱自拍流出,各种虐操体验,捆绑,滴蜡,逼逼超粉嫩,边干边拍!
b357b5fdcdc7a38624a005f43616f03a36d7f701	39450819	1	打电话剧情演绎姐夫吃了伟哥和小姨子激情做爱中途妹夫打电话查岗对白精彩
b3cb524db9b6c5c4db6d3931b57e98169279c5e9	622789207	1	国产特色裸聊冲击岛国【日本招男演员】岛国专业男优体验约操素人女优 后入内射 白嫩美乳 千岛丽子篇 高清源码录制
b4909dcf7844d9ca3cd75b28dc38e1332a025382	340204224	1	重磅福利百度云泄密高颜值气质美女小学教师李雪梨与男友啪啪不雅视图流出
b43babbc48fddac8aa5e07f48e220bc4dcda7af5	30820102	1	露半脸口罩妹子貌似挺漂亮 苗条身材自摸逼逼道具摩擦一圈毛毛挺嫩
b687d70cefd709af797b94c541b8f244b90d09eb	657239295	1	新来的主播白虎水润粉穴晴宝宝，露脸淫荡的女仆，黑丝情趣道具双插，口交假鸡巴，表情骚浪淫语不断
b988b922b5bf60faa9b9ecc01b5c1cbd8a6e7d41	33323701	1	女神级性感气质白领美女和公司领导下班酒店偷情啪啪时突然接到男友电话查岗
b983a2979ebea1966d2d8ff1b6ce3006ae0149db	56889317	1	丰满爆乳网红少女云宝宝er 极品死库泳衣搭配白丝袜露出肥美BB 那一对美乳大灯太耀眼了撸点十足
ba8ba243d3ba3fd33e0a9411a27de41cf5b4a848	22228848	1	【精品福利】极品网红大胸美女请房东帮忙修空调时诱惑啪啪,淫叫：房东我要,快点用大鸡鸡操进来,好大,操死我!
bbcc11cd5848401445980f8bc46966a3d02c56c0	38977382	1	肤白貌美年轻苗条嫩妹浴室洗着洗着手指抠入臊茓紫薇,嫩嫩的很可爱
bceebb0ccf912477e590d7fe9cb85ab6817f6464	53213872	1	年轻小妹一个人的寂寞露脸酒店自慰，全裸身材不错屁股很俏自己抠骚逼特写呻吟，逼毛都修了精彩不要错过
bca2c0ca9ceaa7ac4d7bbc1f60cbca6157863fc3	46006608144	14	Світ.навиворіт.S12.2021.WEB.1080p-ylnian
bde56dc7134d50e5f221bb06442b69aea5572c12	29604526	1	对白精彩淫荡网红美女御姐演绎母子乱伦儿子放学偷看到母亲和父亲啪啪待爸爸去上班后被母亲叫到屋内挑逗打炮
be41ce33189442bf02e2f8a410ca719fbde7d0ed	34506374	1	颜值不错的美女和国外小哥视频直播
bf0588ddf7d6a79958df3e1a0441b5f382c7aa92	36740983	1	02妹妹短发萌妹子和炮友驾车户外车震，后座口交上位骑坐抽插猛操
bf453cff86dc950eb23a970734ecd2fc705d62ae	235593049	1	FamilyScrew.21.05.13.Family.Fucking.In.Every.Room.XXX.480p.MP4-XXX
c0370612597ff2cfa0169f06818971d9f58833ae	640771355	81	VA - NRJ Music Awards Deluxe Edition (2021) Mp3 320kbps [PMEDIA] ⭐️
c0f218ccefe51d63798c61a149acbc796ce1f6e7	32635598	1	【利哥探花】返场再约风骚人妻，相拥舌吻热情如火，岔开双腿肆意狂舔，角度专业各种姿势插入多毛骚穴
c1f9b66db0d5f2aef8e586db64d51bacd4090cc9	1402860026	1	1男2女直播大秀 3p激情口交啪啪
c2185311915f8020bc7cffb9b0ea598492078ec8	44910170	1	开发后入捆绑调教骚逼淫荡炮友干到她爽到不行
c3f541e458b4590463fe8424a4d41843ae65d188	5021687853	1	(無修正) FC2 PPV 1817733 (UNCENSORED 1080p)【大量中出しと顔射】地方リアル合法J●とのイケナイ関係（制服×イマラチオ×鬼逝かせ）
c5696fd3beb0810bb5d59f27602e5957de87f01e	25479941	1	最近火爆的极品网红美乳女神鹿少女在家准备洗澡时被来串门的邻居侵犯,操的高喊：好爽,受不了,好痛啊！被操哭了!
c5ca0520e290deb1f4526af8c7616c5a24102fa2	9313354	1	【网曝门事件】火爆全网『姐夫门』新娘与新郎姐夫偷情视频婚礼现场播放 饥渴疯狂做爱 高清720P最终完整版
c5d432f57c11ed018cc301eca96906367c0573ce	46254435	1	最新网红少女『恶犬』VIP私人定制 白衬衫狐狸尾巴 紧身胶衣 柔嫩白虎穴 水晶棒低吟自慰附29P
c75d31e7839fff01d3f3ab4a62de407752e473af	846039995	1	素颜美女姐姐穿着性感网袜和唐山炮友浴室啪啪到椅子再到床上720P清晰无水印
c7b9318722261eb634090bf8aeceb6b81b0047e3	58965238	1	漂亮美女主播和炮友开了一间情趣房 在大圆床上口交啪啪 十分淫荡
c8da665aa2a517b79fe1e95988ebdfe1ce4b90e1	43402393	1	偷情人妻就要狠狠的操
c968e42e9edfcf266b03e0443de7fc428a8201aa	38933613	1	精品推荐-某大学超性感漂亮美女花了500元微信红包才答应酒店和网友开房啪啪,小逼又嫩又紧,水真多!
ca9830fd1595320761386b7e624aaf471b033f06	2530816564	4	The.Wall.US.S04E09.1080p.WEB.h264-KOGi[rarbg]
ca9daac6d631ab1f147b1c232235489f003eab0f	26571417	1	重庆直播偷拍约啪苗条颜值不错的萌妹妹！人瘦奶大！2
ca042ee4e56720a6f8bc8a872e470812dc5a3386	151003427	1	3DMGAME-Samurai.Aces.III.Sengoku.Cannon.Build.5511053-Chronos
cb4db2e737c1c4ea0fa7a8e6ffb904948be6d442	404092459	4	EdgeQueens.21.04.22.Juliet.Pumping.Off.My.Step.Son.XXX.1080p.MP4-WRB[rarbg]
cce8509f09dc1bb4370a961251f845211dc710b7	3477907736	3	Godfather.of.Harlem.S02E05.Its.A.Small.World.After.All.1080p.AMZN.WEBRip.DDP5.1.x264-NTb[rarbg]
ce7513abd7b4579fbb411188869190a5124b2393	39566447	1	草莓小喵喵大屁股少妇女仆装居家啪啪，特写口交拨开内裤摸逼后入抽插猛操
ce415af33ecc23fc0ef653c12be9ab08bf7295ba	1924582638	3	라디오스타.E720.210512.720p-NEXT
ce13ed935770653f867cca2d7d5c3b0e1e3405be	744082907	1	连体黑丝情趣骚浪女露脸自慰勾引哥哥干她，口交大鸡巴被爆操屁眼，干骚逼叫声骚浪，干到求饶
cf95ec833321b1517375284385b9070f29d6b89b	29844165	1	广州留学生非洲性感大黑妞，直播喷水 非喷尿，好好看是喷水如何从阴道穴出来的诱惑哦也想去操一番外国大黑妞！
cfbc619020c3a39bc7da25396d1f66060443d2e7	5297224	1	玩转极限汤上莱卡摄影师破神众筹视图版 大尺度罕见香逼秀 超秀唯美 创意X观念篇 高清1080P版
d094ed4521fc833a89271c3ff577d9cd5275063e	6402788	1	破解家庭网络摄像头偷拍骚媳妇晚上睡觉前要和老公来一炮
d0b4a4052e76ed5cdc3a273c7ec47a12b8cb6c4b	53176560	1	超级极品高颜小母狗[涵菱]完美露脸22v福利视频
d0dfb75ee660efc978a26b84fa91a1d7a28d21c0	22009558	1	鸟笼情趣酒店水滴监控TP饥渴男女激情啪啪这男的JJ好小啊估计满足不了这欲女
d084934a800f04e70f06a581f69354f3389ef0ce	23817495	1	91把妹哥-年度巨作 淫荡沮洳空姐 让你欲罢不能 尖叫高潮喷水
d2718afeb7a36cbc47b3af5bc84df9c8f86229cc	35393864	1	女人何苦为难女人对白下流粗暴的女王浴室调教侮辱女奴隶嘴里吐口水舔屁眼喝尿抽打奶子720P高清
d3a2f3807ec733d9ae1b621c7d39859a279f5d71	48487189	1	尤物小仙女系列第三弹，露脸激情多种道具虐骚逼，在浴缸里玩喷水澡秀诱惑
d3f4e9756b09626650943849f69d346d0566b9d7	431423031	1	Microsoft Office 2019 Mac OS v16.36 VL Multilingual
d3bd83d2796c897b32673435e07066214baf26ef	907245615	1	高价约操高颜值大波嫩妹 黑丝网情趣诱惑 这火辣身材操得浑身是劲
d6e1bf9656cb9b02ba35303218e06e8e4bbad5bf	633987250	1	年轻性感的大胸美女正在蹦迪被情人约到酒店,男的迫不及待解她胸罩干她,美女有点反抗说：这是我最后的矜持!
d7c82b69e56037237bb2045dff440b84b72848bc	2015592240	4	The.Choirboys.1977.1080p.WEBRip.x265-RARBG
d8a5839993d8cd13d3821ecb69a56a1555086735	180863728	1	国产TS系列性感美妖芭娜娜黑丝大长腿用坐骑电动棒自慰 呻吟不断还尝尝射出的精液是什么味
d8e3cb173cce4757edf237428c5a04affed945d4	202573902	1	颜值不错短发萌妹子道具自慰秀 逼逼无毛跳蛋震动翘着屁股非常诱人
d90ca6f96516e460bc434b7555f6eee7f0d9222d	2072158602	5	Ammonite BDrip XviD Castellano www.yadixv.com
d9224b5960007d7706198614cb8f49d82884be3c	41007816	1	各种稀有私享台精选大合并（第十一部）纹身小伙开房勐操没穿胸罩的巨乳女友
d9d46fa17e48f740bb5c1f38531c239832640b66	36894819	1	妹子为了钱豁出去了，两个猛男一起上，一个胖胖的能把她娇小的身子给压坏了
d9d40f7b1ede47b7cfcb2afb9f3d44b52d4c64a0	54672500	1	两个萌妹子双飞啪啪扎着辫子 扣逼摸奶子操完一个再换另一个后入猛干 ，掰穴玩胸肆意把玩青春的胴体真开心
d93e4572fd60667e5750d4ee88305dd809fd72d4	601623228	1	最新众筹流出推女郎巨乳模特松果儿揉奶揉穴淫语自述挑逗“快来J8操我用力干我骚逼”粉嫩嫩小穴都开门了1080P原版
dad9dc68d8980765358867895aa2da5e2a7a623e	44527207	1	戴着猫耳身材不错御姐主播一多自慰大秀 黑丝诱惑 自慰插穴 很是淫荡
da1a0f33d6ff93ca08faf2b82051a7b4cb5b49c0	28837124	1	极品校花级颜值美女【甜心小Baby】性感情趣睡衣+黑丝绝对领域俩穴双插，漂亮又淫靡3V1
da38478669a4913f95af08223f575099b05f68f1	44667894	1	MD0061给丈夫戴绿帽子的风骚人妻 淫荡本性显露无疑 秦可欣
db2e64cefc0e7914d096c9b4cc2d9e689bd605da	3315119099	3	Dracula 2000 (2000) [BDRip] [1080p] [H.264] [DD - 5.1] [Lektor PL] [Esperanza]
db1db6db1f27910302ebf369449a1bf9531634e4	144798436	1	鸽子脸蛋小美眉，‘宝贝，我可以进来没’，‘come on baby,来吧’ 笑容真嫩 能融化心！
dd65692b34f1fdabca1c940bb902bd70eb0e1f0c	19624329	1	【猫先生】兼职做平面模特的女孩 被骗来舔棒棒
dd026d1bd0d523c7d3d4122d9bf3f5159a9cb011	7100877	1	平头哥酒店微信约操身材标致性感的高素质外围女,太激动男的第一次没操几下早泄了,口硬后干的美女直求饶.国语!
dd2f8b77cf6085c3316c252869e8bd25a383be20	27258474	1	常住越南的老狼哥 约啪9分极品明星级别的越南妹子 高挑的黄金比例身材 还有真实大波 老哥居然说他都操腻了
dddd805ca1271a449e15e481b4dbe521c53a29a2	12866792509	2	Land.2021.1080p.Bluray.DTS-HD.MA.5.1.X264-EVO
dd612946e813c017bc5cbe7c2cb03e63fb1be4f5	48874709	1	最新约操极品F爆乳知名网红『喵小兔』 极品女神骑乘顶操 淫荡浪叫 F杯爆乳口交诱人 完美露脸 高清1080P版
df83f5178b28326235597757bd563693cd02be21	372620634	1	PR社极品美乳完具少女 在浴室用假JB后入 口技了得还很淫荡BB水流多了把丝袜都弄湿了 高清原版
df199495930cf3e852a9bb410a5605f5b9a6eb27	2618326634	5	梦幻天堂·龙网(www.LWgod.org).超级的我.奇幻之旅
dfe01a75d624e8bb66938f133a8b02a8722df192	223400455	1	国产CD系列润儿3 双妖服侍土豪玩3P 口硬了以后被抱着腰猛烈后入 射了还要看着拔出来
e0247e3ba88bb77409762d2f4db3fce6382b259a	712979328	1	难得一见 素颜都超级美的小姐姐，和男友超大尺度互动，刚发育好的奶子白里透红的，修长的美腿 大眼睛清纯的脸蛋儿秒杀各种网红
e1f4abf632933c41f83f070ca602ad605822f52c	28572014	1	抖音7.9W粉丝网红 玲玲7 一对一调教+大尺度福利合集！(34V)
e25abeb26e21b8b265b948b775f1af232eae1d92	966410263	1	看着很清纯的小师妹镜头前卖骚，身材不错皮肤白皙，自己揉奶娇小的奶子给狼友看骚逼特写，精彩不要错过
e4fdf30dffc796d844e46876c51e330732049c18	161978763	1	约操披肩纹身女神翘白嫩美臀“茎待佳阴”一插入就疯狂后入啪操把女神操趴下 女上骑乘成功反操 高清1080P版
e548af2a76d353a0eebd18e3a10fd2f1b6ee7a58	34134895	1	小哥网约了位高颜值性感大胸美女,臀翘奶大,扒完衣服就舔奶抠逼,情趣睡衣撕开丝袜狠狠插入,国语!
e7d5731c6b9a259e12b023b4467c2f1abb600719	27960793	1	会所激情妹一人赚两份钱，偷拍顾客享受服务全程直播，啥活都会把顾客伺候的瘙痒难耐射精为止，精彩不要错过
e8f2e13171518018c46cae7bf23349ee69c75d18	27672890	1	最新流出坑爹的男技师偷拍【女性私处保健直播】碰到欲女小哥胆儿就大了脱光光按还一边唠嗑，趁她不注意敢拍脸了
e9321f9f9fae17c8a8c82e8f58446f8935309f34	1755502131	4	Paws.P.I.2018.1080p.WEBRip.x264-RARBG
e9cb59ec186b71f74a1cda63b8b9335481b5cc59	11747979	1	高颜值妹子私人玩物七七道具自慰 性感情趣内裤椅子上道具JJ抽插呻吟娇喘
ecc458c484dec9c44a5b9b950ff67ac003c21a7a	49784984	1	女同事来家里送文件丝足又撸了一次 妹子很实在还帮用手机拍摄
ed08060567eadd2e31f04902f66e3f06cce10903	16268543	1	喷血推荐-酒店偷拍高颜值长腿短裤女神美女被情人狠狠爆操2次,高潮时呻吟大叫：大鸡巴好厉害,射里面,受不了了!
ed59faec088a8a52f67131a3e79156c6c93a1def	33029501	1	黄先生酒店嫖妓偷拍必出精品说自己被骗忽悠长腿气质妹子360度口活啪啪
eec1eecd1dde1cffa2f369c53fa10e3b3ff1405c	29025887	1	性爱砖家自称的《薛总探花》主题酒店约炮丰满豪乳妹穿上制服丝袜高跟模仿AV姿势草
eeb8a440a58b15b2f9d3effa0eacc970f2791be3	145380699	19	(2021) Damien Jurado - The Monster Who Hated Pennsylvania [FLAC]
f070ef7b2bd895b0b95afe85ff4ddd67f5f22028	1242248893	6	The.Ninth.2019.RUSSIAN.BRRip.XviD.MP3-VXT
f0bd4f49b99c1e1c2ccd7bd31af48bd8d6713095	32934906	1	土豪猛男约操深圳某艺校音乐学院美女大三学生桃桃 迷人性感高颜值操得鸡巴爽歪歪
f1e381572bb60f5bd47c51ab76d68a1f973e9167	42166109	1	杏吧&天美传媒联合出品 TM0013 学妹鼓起勇气告白学长 性爱梦想成真
f3dcb988db20286d437f63044b3ed52628e4d434	103295380	1	国模私拍-最新宇航员大奶骚货小姐姐各种掰穴玩BS+V第三期
