004d98a89f955475bd7843fa811a060da8fa6a68	63011699	1	【龙一探花】极品兼职小姐姐，沙发AV视角展示，美乳翘臀骚货很配合
0080b785e0fbabb333d67aeceba6e709d53c73bb	20800497	1	白肤美婴儿肥嫩妹子和大鸡巴混血帅哥宿舍啪啪激射肚皮上
02970ceda21d7bc9ba0929914540d40cb9292276	84397958	1	魅惑娜娜露脸情趣黑丝表情很骚，道具自慰呻吟，淫声浪语不断，小骚逼水多耐操，镜头前被哥哥调教不要错过
04a460d8481a7ed088527e35f93aca108ad70480	64372806	1	超猛泡妞推特大神『狼少』大尺度性爱私拍 无套抽插操爆裂黑丝女神 蒙眼操更有感觉 高清私拍55P 高清720P原版无水印
0517c9e652325191cd88e9e8eab2cda44521cc40	53185898	1	狗爷雪夜城中村嫖妓赶上小姐们在吃宵夜花多眼乱不知选哪个有小姐调侃他双飞四飞
06bf95668ad8e5672fe538781e4c396e127c0fcf	2320321157	1	SGA-138
08eeaa62772b1a8eb988a2c13db547bf5e1e2d14	471580882	1	【疯狂7P乱性战】3女4男乱操 狂野纹身男女释放野性 摄影师都忍不住夹乳战团抱起妹子就操 太刺激 高清720P版
09068fa7e72ec92f3f330292d04ec4a28967d92d	1208481792	2	Я иду тебя искать. Московское время.(2021).WEB-DLRip.Files-x
0962b18a9f86094353e54c2ea0acb86c2753403e	9582291	1	【爱你们万人斩】超清4K设备偷拍，极品外围女神，沙发啪啪调情抠穴，高清源码录制
0a7fc48243055e45921f62a06e5d50cb1416d616	34844764	1	最新极品身材靓乳美女『法拉女神』凌晨土豪粉丝约炮户外车震 玩操1小时竟无套内射 车外还有人走动太刺激了
0c792320142c6fbbe3860e2a0379c36eada2e403	29561929	1	【按摩店男技师勾搭小妹妹做特殊服务】清纯眼镜妹，00后小萝莉，鸳鸯浴女仆装，近距离镜头对准鲍鱼插入细节，体验青春嫩妹的温柔服务
0c2b6ac14ca0ed8afe8f8f1107ae71916375424e	37629417	1	大哥草逼真猛白丝情趣女仆小女友被大哥激情后入爆草，草到兴奋时打小骚逼屁股真爽抱起来干
0d17275f77b74deef2af7c7fdeaffce0d06c3bba	66649255	1	91大神让身材不错的老婆穿上情趣丝袜啪啪啪
11e93fef72f250b79681a8b28b05485cf2620a06	5006270307	1	El virtuoso [MicroHD 1080p][AC3 5.1-Castellano-AC3 5.1-Ingles+Subs][ES-EN]
127541ca62cd1b8e71d15ab16486fb7b58fcd802	640576007	6	174女神这身材让我流鼻血了，而且还有明星般的9分颜值，说网友如果要和自己线下约就得准备一两万 如此极品 土豪肯定愿意花这价钱
1343a7c6d9cb1f3ebd9f5456ebe8f0194efd3516	713018693	7	Fear.The.Walking.Dead.S06E13.WEB-DL.XviD.B4ND1T69
1315c801d1e5c597c74037972b426db1d2761347	1220275479	1	VOSS-177
136ed47bf426d17d80dd49943e1b0c8e25b6bc49	1559859629	3	[ThZu.Cc]051521_477-paco-1080p
13990c0a5f4d5112b3f23561d1f1fbda95c33c79	26448611	1	JL屌哥最新-约炮网红大长腿美女倩倩,撕破丝袜沙发上各种姿势狂操,高清完整版!
13a048d42b922cfe30ec689bdd42f9c1d93ad0ec	614687876	2	serakon
159f97b1b065490dc91a5f49cdf39efb4eee3a73	2366711808	4	Персональный ангел.(2021).WEB-DLRip.Files-x
16b881e69ed77ee768643c03f91506c3a7d11538	21711979	1	萝莉主播柠檬晚上出击勾搭上个演杂技的同龄饥渴小伙玩母子乱伦对白精彩
16e5112434fb0ab29bd3b18d471cc29b2639953b	1579984392	1	小旅馆红色大圆床偷拍胖哥和气质少妇偷情搞了2个多小时看她那淫荡样平时老公满足不了她
17103c4dbc0cd080e003f397b228bc52456a0a4d	170280628	1	超级大奶骚妇,8字形大奶.自拍自慰小视频提前预祝各位春节快乐
176e33f981c506f2b0e87dd52bc6a6ee3dcf67f3	46423465	1	【制服御姐】携眼镜骚闺蜜姐妹花勾引姐夫玩双飞 上下吃鸡 左右齐插 各式奇葩姿势玩的好爽 特别嗨皮 高清源码录制
18c705d98198dc89dee4d4f52613a28d62981603	54479327	1	【精品推荐】Transexjapan最新流出中国TS小乐乐岛国拍摄系列 与直男的各种姿势缠绵被无套内射
18ad1ec2a80da2c10b4b0209c470ecdb32de1635	38174377	1	颜值不错苗条身材金发妹子自慰 情趣装自摸掰开逼逼特写道具抽插非常诱人
19be49ac5cf44df69f58980f3829bd7f1fa93631	2229073637	4	Chaos.Walking.2021.1080p.BluRay.H264.AAC-RARBG
1965878914d1b3915d2015506c8e34fb66e9f370	65832464	1	推荐精品棒子三级女主角写真极品身材长相诱人让人欲火焚身感觉
1963ddcff7683d79473568ef02e79051d24791a7	311570141	2	横扫全国外围约了个高颜值苗条长腿妹子调情一番上位骑乘
1a38c6ba63d38f217ade3fe31e5afe0f967a8926	299991041	1	某商场买衣服认识的气质美女老板娘混熟后没多久约到家中啪啪,连干2次,操的她欲仙欲死,说：爽,好兴奋,我受不了了！
1a13a3105b10b273816ba9bbe65ddaeab9eabeb3	124620207	1	良家特录-性感新婚少妇为要出差老公录制操逼视频说:这是人家特意为你录的,你想我的时候看看,操死骚逼.原版!
1af0c318c4a8f3a19ce3db178c381e33b54bb9e1	21537231	1	这哥们是真猛，自己玩三个年轻嫩妹，暴力性虐抠逼草嘴绝对够刺激，一个轮草三女姿势真不少，呻吟可射
1a06b4433b1f690c6153a86505d3aeed8e270bfb	32965538	1	出差肯定少不了女人，约炮可爱少妇情人过夜啪啪，早上晨勃起来干屁股，真是好地方
1b173a6bdd00f391ed892592c8e83d41e4c2884d	59591237	1	学校の学生の性奴隷の无毛白虎馒头屄 鲜嫩多汁 极品诱人
1bf4648eb0f9d7c848bf5e311afa5da04ed1405e	27799072	1	风情万种的熟女妈妈被儿子扶着肉臀挺着大鸡巴后入，艹得妈妈嗷嗷叫，不枉母亲带你来这个世界，真实刺激！
1c76a14d218fe193e09303fee7fea283cef2b834	279564757	1	汤不热最近很火的嫩妹小鸟酱啪啪啪自拍销魂口活特写性器进出交合水多呻吟刺激720P高清
1c7a2e071ee6608df24f65bb3a92f28c960ab1f2	1592939405	1	妹纸按照要求展示逼逼并且自慰给大家看
1d78fa0740359351845a67de06687b5f8899f26c	48888821	205	[ツルマメ] ハニートラップ 1-4
1d3229847f5308fab77c7c9587cb0cee1e73a2f8	43265372	1	【网爆门事件】韩国校花情侣分手男方爆出自拍视频（第二部）-高清原版无水印
1e318a31fadb18aa6bf0ecbe36fa1c2b2fe4c82c	26060930	1	【帅哥酒店探花】帅小伙酒店约操小嫩妹，调情挑逗把妹子弄得喜笑颜开，服务周到毒龙漫游全都有， 身材苗条插得娇喘连连
1e45742c96bb04ad9c485cd877ad26beaf46c232	583618039	10	メドラー-ラスト-早川瀬里奈
1ee7fff05f878f334b4138631d4e3f9b30c8aa32	30760961	1	高颜值大红唇苗条爆乳妹子自摸诱惑 脱掉内裤沙发上全裸自摸逼逼非常诱人
1ee3da538626acba720774495380486149f29b73	61410035	1	去4S店修车时搭讪的一个极品国际航线的空姐，这身材和口活技术让你体验到人间的快乐
1efae66e00a1c3bdc380e911a18354206b2dfe78	36546059	1	极品欠操姐妹花【颜射颜射女神】群P乱操 翘美臀和闺蜜被轮番爆操 战况激烈 群P盛宴 三场连操2小时 高清源码录制 (2)
1e788d15f86906979ae3a6b4ddd7d118fddc6aac	19466924	1	漂亮美女FH溪水1103自慰啪啪秀 自慰插穴激情口交啪啪 很是诱人
1e530affd16caa7d023b7038f117fe63c317bbe6	35610861	1	高质量精品酒店浴缸房偷拍年纪较大领导模样的大叔和情人开房鸡巴不够大用棒棒辅助干了两次
1f1ed05ccfd107a3e5b1b950c87e60aa0c97eb07	26047720	1	最近火爆震撼【极品18岁小萝莉】白日宣淫三龙战三凤 轮操极品纹身姐妹花 排排操翘美臀挨个操 高清源码录制
1f6c825f7cf49670d0f02234aecdc18b899851ce	143321659	1	哥们儿大晚上自拍女友撸管服务 把丝袜裹在枪头上爆
20b2a7814419590dd4ec269b27398a6e03a176c6	18103714	1	新人高颜值美女主播蜜桃臀女友 收费大秀 颜值高身材好 无毛粉穴 激情自慰
21451f0f935c774faf1616df7a1f7c66ebc6074d	8618829	1	看起来很有文化的妹子性趣很大 要了三次还帮老公敷面膜 一对豪乳让人爱不释手
25a616e114d96093858e19da53600ec6cecc4a34	34445879	1	源码高清录制小树哥宾馆约炮大学生兼职妹换上情趣开裆玩六九
25575982a182360c06d653683208176ad1ac9348	102297448	1	小伙某小区居民楼出租房里200元嫖酒吧小姐身材高挑体形不错内裤很惹火叫声好听生意不错不停回微信
25fb5882105e96b3f8021b0ac1dd90fca0a9445a	63539080	1	迷倒嫩妹子全程死猪，无毛小馒头逼，样貌清秀，黑丝白丝都有，菊花大开，扣逼，原版720P无水印
25f38912469df3c240961b10ede5de91bf2d8e78	28890451	1	太子探花极品返场昨晚双马尾黑裙萌妹子，69姿势口交近距离拍摄上位骑坐抽插猛操
25d19adea8d458c63a03336546e67327b6635af5	4317240849	1	SSNI-673
26f63a673049ef75f7e83f06917d535bf1a3a22a	52123462	1	里应外合超级大奶老熟女小旅店包个房间卖肉屋外有人帮忙偸拍大爷很猛的卖力啪啪把老鸡操疼急眼了对话乐死人
268032fb95ae5da192f0809fbb3defa28eb1e947	37530537	1	〖稀有资源〗最新微博网红S级巨乳女神吴温Q大尺度私拍流出 玩弄爆乳 极致粉穴 高清私拍293P 高清720P完整版
26f67f1adb2afa303ace577af5e22c2f70dcc1a1	464669147	1	高颜值纹身美女主播全程露脸被男友的20cm大鸡巴疯狂抽插 淫叫超甜美 听到鸡巴硬硬
2822fec8d221edc061d9ca9a577180d404428154	24676805	1	HD大神直播2男2女4个小青年群P叫春不断场面不输岛国AV对白清晰
2832cd7e2f319981f69aab46869ee24c1eef18e7	165262541	1	EboArt桑拿系列HY288
2950fb85a5f0e7d251db9d09c07e3f95a4f6d510	445251242	1	探花约的开宝马白衣极品身材颜值的外围美女偷拍啪啪啪,被操的不停呻吟叫爸爸
2ab5763a4fcfff9cdb33b79a78131b77ad66d7d6	34453334	1	很是风骚的美女主播 露奶诱惑 跳蛋塞进逼逼里 用自慰器摩擦阴蒂 在卫生间插逼喷水 洗澡诱惑
2ea70ea3f38aa5adce183cd05b5f52fcb9b0b0fa	63234292	1	迷情骚货户外坐在地上AV棒刺激骚逼调情，公测内开始耍流氓了，站着尿尿草逼，楼梯安全出口门前后入刺激
2f8a4b2bf05a5327300a195cb2999904cb911825	2763789044	14	895
31418c803ed72d623b4225f3f95f64b442bb6a41	94012326	1	小县城的上门妹子无套吹，口活很棒，完全没有齿感，深喉。过程很投入，私密话、水特多，很有小情人的感觉
3165bc07d146a89a4e802ffd6ebf75eb961089c3	26015105	1	《午夜探花》铁鸡巴老哥昨晚重金约炮非常风骚的模特身材美女洗澡后半夜第三次啪啪
3200262d83a39228ee960a2d4b44a10b2ab91ec2	345600765	1	刚刚18岁的大奶萌妹为了零花钱给土猥琐大叔私人定制的露脸自慰视频,鲍鱼嫩的不行
33dd1745db78f26c0afb84a70342de8fbaee2829	12113469	1	主题酒店工业风最新 假期尾声激情未褪深夜从学校熘出来开房的学生情侣探讨性爱姿势
34f158004443950dd0dc25a3ac82659f4349f200	83161270	1	抄底买麦当劳的白连衣裙蓝色蕾丝透明内内的妹子,超近距离偷拍镜头快怼到B上了
3483a3047a875674f9cdf2fc0fc79cb9a5f08b44	8289667646	36	2 Guns [2013] DVD9R NTSC Latino YG
35b35b65b38ba05b9fc419df8739d83b38112448	23128557	1	颜值不错身材丰满主播直播大秀 双人激情啪啪 十分淫荡
3542b719f71aded9e398def8a1ae9e5c3b4aff81	48065368	1	重磅福利蛇精模特女神思瑞性感开档黑丝约啪土豪粉丝 洁白美乳胸推后被内射
364aeb4b1fd8a8d88d4202dbabb6f7468b61af5f	128214566	1	和极品白嫩情人玩足交后再草逼 肥美鲍鱼真是爽
36bdd2ba36b896acd2f80dc220d774af937626dc	18889057	1	【360豪华情趣房】白色摇摇床-身材白嫩的一对大学生情侣进房连干三炮 炮炮激情
384b848ba2f9c333a2b1221f7690d2921700b8b6	3313339644	35	IPX-664.HD
39ec44ab9194eb17a3b39bb1481cbd2f43d6d92d	28098487	1	颜值不错黑衣少妇【黑大屌干姐姐】倒立69深喉口交，骑乘抱起来大力猛操，
39a792bf2f9ebac2c4e724d8bf71617f8031d259	392619865	1	推特 【董柒柒】丝袜臭脚反差婊（423P 100V ）
3992b09c83972c0c0e371d8eaf8f443ca44541a1	12445958	1	精品酒店豪华房老板带着秘书开房特意让她穿上性感吊带丝袜后入骑式啪啪
39c95224ee56df2cdc61c2ab07187c0d2c5736aa	75011144	1	办公室里骚货挺多美女制服诱惑一言不合就开干刺激冲动作品《流精花园未删减字幕版》激情佳作 妹子淫荡啊
396277e6def53723de6cc1dae14b9e3df1ad37b9	33888447	1	鸡头李二娃带妹培训性技巧 轮操纹身姐妹花 浴室站炮干纹身表妹抱操真猛 回到床上再干表姐 高清源码录制
3a11ead04cd6fd43f5e8630ceb3af69b45210b5d	12271851	2	ManAkin - The Rift (Single) - 2020
3c4a179b3dd881163e5731b5f47bb104ea8d8b48	91888535	1	趁着媳妇不在开车带着漂亮小姨子到户外熘达熘达把车停到路边与她车震干的嗷嗷叫“姐夫这样太深了受不了了”对白刺激
3d5ed485783b31d9befa1f7ae9d79e56b7c4e20f	121096818	1	绝版留学生妹子easygirl被老外男友各种狂虐 29部合集（下）15V
3de3ac7e804c1c7f1ac9d8904db1a34047331a74	57190412	1	宅男爆乳女神美少女之九尾骚妖狐 露背毛衣 处女粉穴高清展示掰穴特写 十七分钟假阳具插入 高清720P完整版
3d9b664aa71326f492ab50a75165734b00d7ce92	6341737220	2	Deputy.S01E12-13.1080p.WEBMux.ITA.ENG.DD5.1.x264-BlackBit
3dc9821d12ac33979dd1dd1e96c580a1b4b913fa	35485265	1	眼镜丰满巨乳御姐OL装短裙诱惑 漏奶掰开肥逼脱掉黑丝
3e1a066189dffa4a846f2e1673ceb1784eeef3a4	156508939	1	高颜值网红脸TS七七和小平头哥，酒店欢快性爱，看平头哥那笑容乐坏了，被这么美的人妖操 永生难忘！
3fc7dfb44416b8dcfa9f7c94ae25b32a9ee642d0	859240932	4	The.Blacklist.S08E17.720p.HDTV.x264-SYNCOPY[rarbg]
407c58c107e9e2e97be7d63e3b55faebd49e2e4c	11825821513	6	[GREEN TEA] Удушающая сладость, заиндевелый пепел
4054dd7e03685035ed31b9c745238903c4cde4ee	38815787	1	整容脸丰满好身材美女,搔首弄姿撩人,翘着丰臀摇来摇去
419f0b31e4e5bbf552b4522466c390860b13980f	37331779	1	曼妙身材翘臀98年嫩妹居家大迟度果聊,翘着屁股十分诱人,年轻真好
4235b92efbadd8e5cd22e50cb4722c43ab3b9dde	1916019188	1	强烈推荐 一家三口其乐融融 儿子估计也就三四岁的样子 不停的吃妈妈的奶子
43eda138d9fd59eb05494a74ee772dcdf322ce87	56157295	1	最新91短视频极品御姐淫妻【淫儿】大尺度性爱私拍流出 浴室跪舔口爆 镜前边录边后入啪啪猛操 完美露脸 高清720P版
43fc568c5c2bfedb63bc2ad15ef536dd2e436dda	40279226	1	在东莞某会所做小姐的兼职女主播和样子很2逼的小伙直播啪啪给刷跑车的狼友发福利
43830440580ce42a00d8aa454a7d587793c7d4fa	44446987	1	高端会所〖按摩技师〗极品身材女技师超棒服务 全身漫游胸推服务 给自己都弄兴奋了 赏小哥一炮干到射
461372dd5d40abb1200739711233d497f4087000	18406125	1	大奶少妇漏奶漏逼诱惑秀 牛仔裤慢慢脱掉内裤脱一半漏出肥逼很是诱人 很是诱惑不要错过
46ca91e84e9367a17025028c42dac5bb4d64bbc3	29658219	1	颜值不错无毛美女主播我叫nini收费直播秀 自慰棒大力插穴自慰 十分淫荡
474367e5ab4a23aea7c486b575a333f222f0ce8a	29139051	1	最新流出7月居家夫妻-打工夫妻先把孩子喂饱奶 然后再啪啪过性生活
48791e3baf1404e36ddf053d269495c6875cc1da	49537574	1	【重磅福利】超正点大长腿翘臀白嫩大奶木瓜总有你中意的类型の57位大尺度举牌嫩妹买家秀
49a5929dfdce973896ef8edea995e6b4ec9c1541	142228536	1	91大神高质量短视频系列全集一 极品美女46V
49955214991678c29e93c4c368376bcf383323af	32722077	1	手机直播颜值不错妹子双人啪啪秀第二季 69互舔完再啪啪
49e37baa6fc924aa135a48685804a96b18751ed0	687251717	1	麻豆传媒联合蜜桃传媒贺元宵新作-外送家政妇 爆乳庆元宵 呆萌萝莉女仆斑斑 高清720P原版首发
495f1950ccb59cd96785da6cf3de0179f94ad5e3	26875346	1	火爆推特博主『榨汁夏』大尺度性爱私拍流出 95后极品E奶美女淫妻夏 已戴避孕环可内射 高清720P版
4a8e4f39ea4d3ac29ed73992acce7457e979d5ae	105569184	1	露脸约操漂亮丝袜小骚货，口活挺不错，操起来很配合，叫的也骚
4bda9775f53999f904e418d42a4c3930367c481d	6143465472	4	KVN-2021.Vysshaya.liga.XviD.SATRip.25Kuzmich
4b98acae303dfd24aeee6b6ca9c9969c8c410374	8813462492	5	WANZ-893-C
4b521f7c883e42f34b832874224f161b3d11feb7	158581265	1	商场露脸抄底白裙来例假和男友逛街的妹子,这么短的裙子就是用来偷拍的
4cd95de1b741f02da16057e810fa630ab27c8783	43697046	1	先吹后干，真实操上海露脸学生妹
4c4a662306ae9155ba64bbf4168f3af783474dfa	243413019	2	嫩白美乳小骚逼骑在上面坐起坐落，这身材真的享受，而且骚的主动叫的也淫荡
4d913ea2906b114beffa6572132637dfb04af24f	44276910	1	按摩女郎忍不住放进去了
4efdfbfad904045a871985ee8124981edc43accd	1401120552	1	BIJN-174
4ed49e753c28024008896bed9726b77c04422efe	35322852	1	SWAG 私人健身教练掏出大肉棒插入学生 巨乳萝莉爬到教练身上扎实的骑马啪啪大力干教练
4f0c1c5747daaa8496b5211ba59b00b699309e17	668185178	1	91爆乳黑丝嫩妹半夜开车酒店私会土豪,魔鬼的身材真是让人受不了,被干的连续高潮好几次,粉嫩嫩的奶子又大又坚挺,干一次死也值了!
4f5b53f195bc776d5887447448e3da046083f7b7	18105440	1	台湾SWAG淫声萝莉『Ouopuppy』潮吹大喷水 约炮粉丝哥哥浴室干翻小姐姐
4fba41e18cd6ddf49123b80a673c3b873badb0e1	18714163	1	大胡子洋老外桑拿会所体验绝美漂亮技师的贴心全套服务
52198e26845fb82f96d911543df2852698108b09	38196336	1	把小骚逼抠的神魂颠倒淫水直流，露脸主动舔弄大鸡巴，无套上位表情好骚，让大哥直接射在嘴里给狼友看真刺激
5293da6b6c5e5c0da020227cbb6e8a4d0ba6761e	57141435	1	早上的和情人在她家打炮，女主身材白皙靓丽，高清露脸完整版
52486913032bd3f37b773dccb8480ea77e12cbb4	48354681	1	点击量很高的某成人网素人投稿作品约啪18岁非主流援交萌妹子无毛馒头穴搞出喷水貌似阴脣干肿了1080P超清
53a10387d60d5bba0ea7fd15b5d1e651d3add30f	435630690	4	The.Blacklist.S08E17.WEBRip.x264-ION10
54e1026b465e1755854ba39d360598adbb803b35	200704304	3	American.Dad.S18E04.Shakedown.Steve.720p.AMZN.WEBRip.DDP5.1.x264-NTb[rarbg]
5566f7dc932b195f2d5898ad5781a975a1797494	11597324	1	【男魔小天】外围小姐姐甜美可爱，苗条黑丝口交近景展示，床上暴操娇喘不断观赏价值高
566cda1e1ccc90481fb031acddb04cbc2a87b4da	300771138	1	碉堡了啪啪啪玩出新高度一对男女大白天在空旷的郊外脱的精光激情野战站位互舔放肆的搞太刺激720P高清
56f82e0f0b2a76e588b8c258c9f5da5320cc9cfc	45595234	1	纯纯的小骚妹露脸真骚，坐在车的后座上玩直播，偷偷的漏出奶子自己玩奶头，逼里塞个跳弹玩骚逼还没有毛
571f0a2db75f334977f47c0d4a21bf3df10f0b3c	235356908	1	果哥 秀人网乳神美女嫩模李梓熙新作性感小猫猫大尺度白金版拍摄
586b0c6afd400985d02dc88204af57745ec73514	23055933	1	高颜值人造网红脸美少女闺房与炮友激情啪啪啪足交口交服务到位小骚逼还是无毛的嗲叫声刺激口爆颜射对白淫荡
582e4865f75f7fbbbe2103c0a4890e40fe4948c7	39179415	1	霸气富姐和姐夫调教虐待狗奴才舔逼吃口水姐夫大鸡巴也要吃一吃对白精彩极了720P高清
59d1fdcf777e379e12f500fb91455211ffba9294	42210528	1	弄奶水充盈的美艳小少妇 一边肏一边喷乳汁源源不断 最后射得她满脸精液样子淫荡万分
59d386500540d881ca81563ab7a145ff4cbce7af	33073733	1	最强2020极品爆乳女神『隔壁小姐姐』旅拍新作-清纯小妹妹假阳具整根塞入BB 唯美私拍778P 高清720P原版收藏
59cf776e8fa4f058161e967992042c5ca5c7d9cf	119045576	1	性感漂亮的美女制服诱惑の磨人的小表子火辣浴室撩人自拍1080P高清
5a6430509a272fd8c7875811bc2dc9f7bbd539f6	24599733	1	做一杯好茶需要的是奶大，奶子大了，奶量才会充足，不是每一滴奶都能滴进茶叶里的。懂茶的人都愿意和奶子大的人品茶！
5e20e3c151adced16f794ec94d7b4c92a47c6876	301084287	2	真实迷奸系列1-普通话对白逼毛黝黑浓密的貌美美容院老板娘吃宵夜被灌醉带回宿舍啪啪108P高清无水
5ea1a4968093966985ab196fe0e9845193b2fdec	43304590	1	最新极品黑丝亚洲浪模Messy赚外快上门服务 饥渴大屌猛男在厨房爆插猛操 暴力深喉 干的真尽兴 高清720P原版
5fa5215375d09ec84cb8da5d153b56af2665dc53	22135061	1	出租屋多视角情趣台偷拍胖叔找小姐过夜啪啪坐垫上给小姐舔逼炮椅上啪啪
5fede80f011eb28ba013008fe9097ce6c2cc9881	18601668	1	【极品御姐】最新推特网红空姐『温柔与霸道』大尺度性爱私拍流出空姐制服诱惑啪啪丝袜美腿霸道篇高清720P原版
5f40769a7a5b6faaf85c0b023e3df9d3a0fdb5f2	42584439	1	国模秋秋宾馆私拍长的一般身材和奶子还是不错的
60121ef74bcf168f8d83b326e2727f6bf7f3af20	19784727	1	长吊青年偷拍和奶子有大又软的大学女友爱爱无套内射,并分享给各位狼友观看
608ee31d89d17e237a489c837dcc523f9187ae5b	96241996	1	JJ非常坚挺的年轻小伙出租房啪啪啪听话可爱学生妹戴个狗链玩轻SM变换各种体位小床要干塌了1080P超清
60d7c64936264c23be8a79ee837cd58f78a6ecb1	7492048632	15	[ThePorn][SIVR-052]【VR】彼女がいるスグそばで幼馴染のまこが嫉妬心まる出しで密着誘惑伊賀まこ--更多视频访问[theporn2.xyz]
633554f12be0d4a5744a76761dc1623db704f403	62031771	1	【真实灌醉】【国内精品原创】灌醉甜美女主播 5V+45P
6414a7ef4aac77f158c782fabd8be879f213003f	33990213	1	【野狼出击】偷拍网约上门的大奶风韵御姐少妇，高颜值大咪咪，大喊不要不要，我不行了
669929a125147a46ce34708004937360f6c5ef58	36188731	1	PR社性感美乳姐妹花の铃木美咲-绝对幸运的男人高清套图50P+1V
66197bdb1ca5d170dea9e779701637e149cd9cff	468187396	2	RoccoSiffredi.21.05.15.Shalina.Devine.Capri.Lmonde.And.Lylyta.Sex.Stepfamily.XXX.720p.HEVC.x265.PRT
670b4f9a10aa393572bf216e4f04700b8ac45736	40149455	1	台湾SWAGE奶小猫咪『amylulus』最猛6P女助理大战男上司们 公司日常淫乱大会 
6720b8c0dbe6458021cece87fdb5eb8b15c3cd40	21774990	1	第一坊丰满漂亮嫩妹主播丰乳肥臀学生妹收费一多自慰大秀第三弹 木耳很粉 激情自慰 淫水多多很诱人
68318893d1197da4851e26b64b5a53db37facc17	100242727	1	【超稀缺重磅福利】【学生网盘入侵事件】大量超嫩学生自拍性爱日常遭流出！吐血推荐！！（第二部）
68c57339f27376811397b88aed0d218aa6e6a71a	15788516	1	千人斩星选再约极品大白美乳妹子，特写掰穴口交上位骑乘猛操，晃动大奶呻吟娇喘诱人
6a71cbdca1a5dc571a6d4f078da6df562112493e	54294540	1	【少妇小雅婷】，练瑜伽的极品御姐 上班办公室玩露出发骚，寻求刺激到商场去偷拍买胸罩！
6a990e5ecf7c135ebc7058d750833e28aeaf9e4a	76068670	1	夫妻与外卖结下不解之缘 一天之内四个外卖员宠幸过你老婆 一次野外草地 一次3P 绿帽老公就在旁边偷看
6a9a02965afe7cea0f093c67367b9fb6dca7037b	1633515425	8	olo@SIS001@CEAD-118
6c80f1fcde423949a0a02e1be1be3ef9d31a4107	325503545	1	真实暗拍高级会所巨乳技师妹子的全套胸推指划服务超爽体验
6cfc1de2a71929a574abc349bbf399d3232422bf	412951456	1	【清纯女神】主播【小钉】（收费房）大奶子嬾逼特写 超漂亮
6d755a0cda3839277f123566febd0173d11f1f10	111436862	1	最新某房重金购入迷奸01年水嫩幼师极品高跟丝袜后续1080P高清原版
6dbdc4cdf4ef3d7851be0b91ba831aaf9d882534	230177192	1	瘦瘦的小骚逼女友，逼还是无毛的极品白虎逼，各种招数变着来操的她好爽
6d6a40326701d4f42fac8d0139762c44c012b298	178218446	1	爆操高颜值女仆装车模女友 完美身材 操爽了主动骑坐鸡巴疯狂扭动 全程淫语对白“操的再深一点”高清1080P版
6d8be91b0c919af16f1d03d7be33b56f4d3677fb	395018783	1	美女姐姐和同事吃宵夜被灌醉后酒店开房死猪般随意玩弄后啪啪酒精过敏脸上起红点有点吓人
6f81613427b4bef774096936fc955e2560f1073e	413078547	1	约操水嫩欲滴的韩国留学生当女友真性福 口活超爽 主动骑坐 无套后入冲刺内射 完美露脸 高清720P原版无水印
6f2e1f421507b73b9e841d4bed4afbac3312d883	119477442	1	国内某大学真实偷拍系列6 零距离接触清纯学生MM
6f727b1591eecdc96dc9cd1ea09ee53a433c60c3	40946642	1	高颜值美女孑孑大小姐福利小视频没露脸集合 绳子捆绑胡萝卜自慰浴室洗澡
70dc106f60faa81bd6be1f27b29dd3dde13c1686	72350580	1	【千人斩探花】嫖老师上操约了个黑衣妹子，近距离掰穴沙发上骑乘后入大力猛操
710adfcdd99f40f4ece86fff6dafdbc4d809d319	118874607	1	高颜值白嫩苗条台湾美眉又一超强力作！圣诞老人的赠礼！
71dfa8763797596c52ce30d566b35007b7fd65a8	31401201	1	全国探花嫖老外约了个黑衣皮裤国外妹子啪啪，口交舔弄抱着大力猛操上位骑坐后入抽插
729b99781881f7eaff1c0927ae80007589244e34	44254969	1	【全国大学生良家模特】疫情严重都被困，东北小伙约到漂亮老乡来啪啪，颜值高身材好淫水湿裤裆，亲得叭叭响
7330a32dc521af7f4c3b6b2ef7484176f9127f3d	16631900	1	颜值不错十八岁嫩妹子约炮啪啪 推背按摩内射两发
754b3238cd5baa5a4678978226f9be99388ef56c	34209556	1	拍摄写真高顔值嫩模和色影师的日常,破房子拍完照,就地啪啪,身材白皙
76adf6619a78574a71e36fc4f68584199266ef66	68030515	1	雷子哥刷了好多礼物开房约会玩直播的网红美少女连肏2炮干的娇喘哎呀叫看美女表情要被操哭了对白清晰1080P原版
765e1dcf12c5ceb258552f664e005a848cffb2a1	286855761	1	极品身材网红少女软萌萝莉小仙 空姐性感制服配黑丝撕开翘臀露出白净的小BB 水晶棒抽插自慰出白浆
