01a85c1e50502b35f2808636b54a905bc63d122a	29143282	1	哥俩一块儿酒店约操外围女神，先让小兄弟干，坐骑爽到爆!
0131e0bf1095af40bde990f174539628953e3b5f	891241000	13	pacopacomama 061319_111 人妻自宅ハメ 〜バスト100センチ超えの巨乳妻
02e9919d91769a604cf888cac715fb974d2a690a	29232865	1	大长腿黑丝女神，大家最爱她的骚舞，穿上黑丝，那翘臀和大长腿简直要人小命
0288b952f174043dbddc443924f832ec6226f3d9	1088304175	3	RuPauls.Drag.Race.Down.Under.S01E03.720p.WEB.h264-SECRETOS[TGx]
03b7748987a20627b1985054a8a491ac47314138	28103641	1	独家买春盗录：略胖中年男啪啪娇小漂亮援交妹
03ad2d2385d56b55a4609ac5a805fe8ff5da309e	52388189	1	最美2020极品爆乳女神『私人玩物』年终定制版新作-格栅制服 黑丝超挺爆乳 无毛嫩穴 高清私拍31P 高清1080P原版
03006f8157aa3acff65e30846869e63d9421ecb2	32875858	1	ACE001 一个从交友软体加我聊聊的学生妹子 台湾 自拍
045a134adf05857eb48ff94b39c882aca2d9c2bb	57066624	1	星哥猛操和服美女作品 这大屁股一看就想操了厉害欲望高涨很冲动，技术不错椅子地上搞的超用力720P高清
053228f76906333bcb683fdcc1256be27973d3c4	39023092	1	91老铁眼镜刘酒店啪啪喝高了熟睡中的女下属还拔了人家好多逼毛720P高清无水印
05df39b5d2fcf21bf5430a9c865e5b864c4082c6	279064639	2	【太子探花极品】00后在校学生，175极品高颜值美女，完美花瓶纯天然
0631966fa5048eacdd946606941db6c195a139ec	26186834	1	最新高价购买PR社极品网红少女私人玩物良心作品之主人的性感玩物2V(附30P)大奶子头都要捏碎了
07dc279425f178d874b09a1ed4f8195962cfe49f	141186268	19	Shamanic_Technology--The_Secret_World_(The_Otherside_Beat_Tape_Vol_3)-WEB-2020-BABAS
08915956fbc9f3632540f82959ae99050a3152f4	7226921258	2	神奇蜘蛛侠_免安装简体中文版_www.kk55.net
090224b7e42fd619a1e3060ee229d1a25eb12511	650267138	1	老哥越南约了个高颜值苗条妹子再来第二炮 骑乘后入站立抽插大力猛操非常诱人
0a3eb894e0e90fef31e726d09cc0ab936d305d2b	246558765	2	乳神主播[SWW小甜心]妖艳般的诱惑奶子和汽车大灯会亮的
0a75f34cee17fcde0e1f14a221862fb718045f38	25881773	1	新晋探花新人【阿水探花】约炮极品高颜值车展御用模特啪啪 芭比娃娃般 口活深喉超棒骑乘顶操
0a3e387abb21f483d0ee62a8f35bbb55128edd5b	5158988009	6	oned-184-uncensored
0bd2267544aa47413bfe31aa1b145c73bb841145	78403269	1	三王一后 啦啦队学妹大战篮球队学长们 伏地挺身被抱起来猛干
0c0324743f3d090bd17c6d09e41b9960fbf8febc	425485491	2	LegalPorno.19.04.17.Vicky.Sol.GIO988.XXX.720p.WEB.x264-GalaXXXy[XvX]
0c87783d9773695861914815f88b1e05878633dd	52606764	1	天堂素人系列-性感黑丝美女嫩模酒店潜规则,先在卫生间洗手台上干完又到床上操的高喊：爽,好舒服,插的太深了!
0d5a759b8b48cbfd6f2355a5d7dc83a5708ee74f	36294425	1	【国产真实灌醉MJ】酒吧搭讪美女，深夜喝得烂醉如泥，带回酒店梳子玩穴强制口交啪啪
0d543d8aa5e7896b799d577d512c891c165a7e8a	24796506	1	神似李小璐美女主播镜头前自慰 高潮呻吟淫水直流
10de1026d3131b38662f37e1ee5ca1db4dde7e55	25053741	1	横扫站街美女【嫖先生嫖合作站街会所选妃】带漂亮美乳兼职学妹酒店啪啪 无套操懵懂妹纸白浆内射 高清源码录制
10ba2f161ab7c2f293af2dbcea64219ef41e90b2	27419992	1	新晋偷拍网约炮达人【老表寻欢记】约战身材不错的白嫩高校萌妹子 清纯韵味十足 床上火辣饥渴
119729060d02701251a5dbf10eb7a7afe5b44332	27065978	1	【wqx520胖子探花】阳痿男约操极品小少妇，疯狂挑逗硬起来激情啪啪，风骚尤物美乳温柔
1154ce6c3391219ed49f7e3c0591c63b2b829093	49770358	1	大叔户外车震小情人，【爸爸的小骚货】现在00后太淫荡，大鸡巴无套插入不过瘾，跳蛋辅助到高潮，高清源码录制
128c4711547de34cf1864d444b4bf93089c3ce06	1283988760	3	나는 자연인이다.E445.210331.720p
12d9e842a0e607aaecc4624a8e2f4a4a0085506e	1389067296	1	手机直播福利之少女心露脸自慰大秀，身材很好粉嫩骚穴，手指插逼淫水很多，浪叫呻吟不断第四弹
121af618e970e9ddfbcdf14c7cbd052123412176	29836793	1	看着挺嫩苗条身材粉嫩妹子自慰秀 脱光光近距离特写嫩逼手指摩擦阴蒂
14ce2c252bfb619352933647d27e67c800d68304	23350668	1	听对话是曾经被人包养的气质性感美女男的出事后自己出来做直播,粉丝出钱到她家操她,女说：不带套要加1000元!
141af9688dd7c72b7ce72a8ec165afcb7860aa54	58733933	1	小别墅里享受妹子的至尊服务 长黑丝脚丫裹着丁丁慢慢搓
1477794e0d250725829c2e874ecd8e46ba48de6c	76763570	1	【巨乳女神降临】最新G罩杯木瓜奶爆乳女神乳儿大尺度玩乳私拍流出 玩乳揉穴 G罩杯福利 完美露脸 高清720P版
144d3f57b1dc0996801b9c1375dd9d6ec3dfeab3	4249945791	2	SexMex.21.05.16.Sheila.Ortega.Fucking.The.Principals.Assistant.XXX.1080p.MP4-WRB[XvX]
15c89293b4bd89d6846d67693b919d12002db67a	30104017	1	专操女神探花达人【神秘探花李八八】花5000约操顶尖极品混血车模 直接去车模家里操 狂野纹身 今年最靓最高端
167956941a390c26243ebd45ad811827caca0453	7607543	1	天气热了出租房内各种美女放纵的动作被拍下230
1972042b753f622bb2bed9102884d6eeef68c5b5	510409678	1	身材苗条 颜值不错的骚货妹子 黑丝 舔逼 口交 手指抠逼 女上位啪啪 道具插逼 骑乘 流白浆
1958de3c94485778bc3c7dc03eeff3cb5494f7be	29002987	1	颜值不错御姐美女主播直播大秀 激情自慰高潮喷水 十分淫荡
1af53e5d4d229cdedcf25f004af6885454482acb	458884771	1	独守空床的妹子寂寞难耐睡不着只好自己解决了 用胶棒干逼 阴毛厚重都立起来了 该有多寂寞啊！看到都想上～
1c31c7605f9f7ac72caea4995126233302c6e227	231849578	1	高颜值泡沫女神 淫骚的阴道，自慰棒插爽逼逼后换跳蛋搞，小穴都被搞红了，拿镜子照照 心疼死啦！
1c29c3693bde7b2893f55edc735b1be7b5813e46	66418334	1	【重磅福利】极品国模虎牙妹小丫与土豪酒店超大尺度XXOO私拍视频曝光,呻吟声真大,国语!108P无水印高清版!
1cfea90aff6b39ff11a11ad05282ffbe3b4bca86	18018343	1	王总酒店2800元约啪御姐范高颜值长腿美女,苗条性感,直接换上情趣黑丝啪啪,又骚又浪,恨不得干晕她.国语!
1dc9019afa7b6c9657c28f77da12ddc7d3287367	43718452	1	情趣黑丝套装淫荡嫂子清晨裹屌给我弄醒 翻身无套抽插猛操淫浪小骚货 浪叫都操出白浆 冲刺内射 唯美完整版
1d16622714e636c3a3d665839bc06f7948a69a75	1416436349	4	MasterChef.Australia.S13E20.720p.HDTV.x264-ORENJI[rarbg]
1d038ec8843aa0cf351d1a87ce26806e261eaf8d	27809433	1	骚货嫩妹极度诱惑 凌晨 一件件脱掉情趣内衣开始自慰棒插穴大秀
1e9ecaaf21c6ef2efb931255f57cd7da86eeefa5	31459128	1	麻豆传媒精彩片场花絮直击汇总 各种情色搞笑场面 了解情色片幕后趣闻 高清720P原版首发
1e2bae9c68187594c1ba2f1c3b6e5e0d0779bde3	206084953	1	抖音红人舍得妹舞蹈10《Crazy(疯)》4minute
209aeaaa5d3594a3336b371742214fffa8468046	83636600	1	按摩美容院性感老板娘今天生意不错接了几个客其中一个推销蜂蜜的大爷几分钟就换来了他4斤野生蜂蜜
202ddbb2fb97975f98bab0a73b4337cadc5824a7	31567485	1	“儿子快操骚逼受不了了干妈妈”熟女大奶富婆与干儿子乱伦啪啪边淋浴边干回屋继续干内射对白超级淫荡
215f6f58b8a2600e6b521f9f41671ff6309cef2d	41783760	1	颜值不错的妹子 全裸露奶诱惑 手指插逼自慰大秀 炮机后入式插逼 快速抽插呻吟 假JJ骑乘 非常精彩
21cc9a3df7653aeba418f658d801c66f73a5c64d	35604087	1	催眠好朋友的女友邪恶玩弄啪啪作品《提线木偶》字幕佳作 女的质量不错这样的情节很刺激沦陷肉欲性奋冲动
214266a9cdf295e9fbced04ba886158cec715b79	33919938	1	【大一兼职学生妹】宝宝 在大床上跳舞拿起黑黑的大牛 来玩肉肉小穴 爽到流水
21ec68bbd81244789bc34ad44e6780b6b1ee4ec7	37588343	1	好几位女主，偷拍相当牛逼的拍手从房门猫眼偷拍房间情侣啪啪啪，叫声很大，相当淫荡
22c94d23c8d88a3fae5b780906b7143e28937835	2318295498	4	Тайна.мертвого.леса.(Season 01).WESTFILM
226d97816775358e8e923c58632c518f72462af0	27135028	1	小宝寻花黑裙大长腿性感御姐TP啪啪，脱光坐在身上夹JJ摸逼口交，上位骑乘后入猛操呻吟诱人
2377dd148ab613e35dabc80d861fc1d96825e570	13169305	1	颜值黑丝女神【黛爷】名媛小姐姐APP勾搭少爷上门啪啪 在不知情的情况下让闺蜜躲在沙发后面偷拍，尼玛被操得淫叫声这么发浪！！
2324ff7556ce49b5d2ec88ef8562977967ce8bdb	97428959	1	内涵捆绑精品系列之〖我的后妈〗 全身束缚熟睡的后母 激烈爆操反抗不得竟对不伦性爱成瘾
2481d579451d649cd833f80f80ed66d6c8860f14	81175300	1	露脸在校99年学生嫩妹一个月时间疯狂投资5W终于约到宾馆啪啪 和随随便便能上的就是不一样
2665a4d73fecc2f5a28d9aa07ac2b3f82943391d	24654625	1	豪华情趣炮椅酒店热恋学生情侣激情啪啪美女颜值很高身材很苗条女上位自己动的样子和叫声真骚
277457b6de539a3fee7e26c34900089757b31316	34489102	1	撸管推荐宅男女神魔仙和狼友唠嗑看着性感粉嫩美乳和淫骚小穴让人精尽人亡
272ce8108d26e47cffd5db86835cb1b310af7ce0	89233955	1	天然巨乳二次元美少女，肉包子一口一口吃，宿舍淫乱摇奶，舍友都笑了，我要去买辣条吃辣 你继续玩你的巨乳hhh
289c8c5cf1508a41d7cf208d7a69a9488e90cf50	46335852	1	野外树林里熟女大吊奶野鸡坟墓台阶上铺好战场迎接白发中老年大叔还给口活了一会无套内射完事给30块国语
28089847b24318b3ebe6536cfec5169e26f75258	8417157	1	害羞大二学妹跟男友开房啪啪，男友要拽下内裤看菊花羞得她激烈反抗，娇嗔又想被干真实刺激
281eddfa38aee4f6ccba984694f58a52b7f59992	64598935	1	公子哥健身房勾搭的巨乳美女约出来吃饭被灌醉唿唿大睡带到住所各种玩弄一对大奶抓不过来啪啪捣出白浆内射
2809173d787702a9b94b7472d58a2961598ea2c7	13634550	1	KK原创 重金约啪极品超模Lisa洋妞身材高挑金发美乳一点不输洋屌日的很生猛干的美女啊啊淫叫不止叫Baby
289c8c9219dead006d3a901902233bcfa95d78dc	62226347	1	重金打造只做精品 长腿大奶蜜桃臀极品美女发骚浪叫
282b4d336c97cb0d3a178d7ad211c69f39bd00e3	152512549	1	最新极品白嫩巨乳网红美女『温儿』车内挡杆坐插漂亮粉穴 车档杆入粉+穴电动棒双重刺激 高清720P原版无水印
29f584fd2c848dbf46e375cbefbba7e046a51187	3682598912	6	unrenamed-japanese-systems-ii
2a2dd57d0e28cf36728cc02e641dc95792b4405a	23505245	1	一坊颜值不错美女主播长腿校花丨婉婉 一多自慰大秀 身材也好 自慰插穴 淫水湿润 很是诱人
2a820205debf58db4261a611390e04ede4333cbc	160490898	1	真实下药迷奸娇小嫩妹子小萝莉，被插得时候像是在享受一般，脱光带到酒店肆意玩弄一整晚，高清1080P
2b8c7baba782fab18e7841e477925bf05f663887	8238818	1	千人斩星选第二场丰满白皙大屁股少妇，撩起裙子揉捏屁股穿上透视装，站立后入镜头前抽插猛操
2b1435075b697bdcb3cb65301eeb5fa8aa7a8ef5	31846110	1	国产TS系列王可心4p直男，3妖1男场面火爆
2d5abc12cc9be870411cd7147727657994e4bccd	25506492	1	【艺校三姐妹】鸡头带三个00后小萝莉直播，年轻漂亮身材好粉嫩乖巧软萌，掰穴自慰娇喘连连真诱惑
2eb060e2f33c3ee673b170142e61e425a6fc0a33	42404862	1	中年胖男酒店激战气质长发美少妇,一对美乳爱不释手,从地上一直干的床上,拼尽全力操,美女都要干哭了.国语!
2e336efe1841e8837eec36bdad51170c2382c436	23562737	1	【360】12月份天狼台超级稀缺-大奶少妇内裤太性感了胖哥鸡巴硬梆梆隔着内裤往里插
2edc323a93f079d79d8e3cf825f621bc4f105c65	20345073	1	勾引了个艺校的极品身材小妖女 翘臂美臀让人看着流口水真是个尤物 弄起来淫声浪语叫个不停
3099ea8adee14239590ae9c16e86d50bdee6c41d	29390264	1	漂亮美乳嫩模『梦梵』和粉丝激情啪啪 靠着墙站炮插入浪穴 抽插猛操 无套骑乘风骚扭动 口爆吞精太画面感了
3063a474a4edd7a349abb0e4aafc06b5a600fb55	867868512	118	VA - Music News vol.99
31d06a1a154c952a3eeb6052b8c938d26cd663c1	32300144	1	热舞妖姬小魔仙 钢管舞自慰插穴
31f06fc04a97f082fa63bd8092c71fbf3e8528c2	47117517	1	逼毛整理的很好看的网红脸女主播和美团外卖小哥啪啪
32c49c8f11573f15f39f085452a97f8a9e0ad503	26364229	1	旅店针孔TP很能干又持久的小胖啪啪啪身材性感有腰窝的漂亮长发女友干的满头大汗面目狰狞很能肏啊
32f888706f9f1a19a2cb99c3e9fdbabba3352d0d	61897736	1	最新户外啪啪推荐〖虎妹儿〗娇嫩小妹户外约炮上坡上席地而战 就地解决抱着操 废墟房无套后入又干一炮
32ab60dda3ac2f1191b3e9cde76b0c908b0e6216	55868630	1	气质高冷女神在吃饭时被男友下药带回酒店扒衣服各式玩弄啪啪 无套抽插骚逼随便干
332d372204f710b38ebe98da60877c94a7bcd2a5	35007898	1	【大一妹妹】蚊帐内小骚逼自慰 粉穴水流成河 室友还都没睡 紧张刺激好担心被发现
33de870dc3a5cef0eb9ac4cf69c9f22bda3ee4c7	43853471	1	非常骚气花臂纹身巨乳女主播浴室牛奶抹逼逼尿尿无毛馒头逼很是诱惑
342a041e4efe5295e50a6578a54828d5d39eca5c	2144805569	2	시사기획 창.E562.200314.1080p-NEXT
351c0646765feac49f2137940302ff18f909bd96	3116714035	1	DTT-047
37df975d4dc164b50f17120d7663d60b2e787102	76513271	1	堕落人妻少妇借贷高额贷款无力偿还只好奉献自己的身体慢慢扒衣循序渐进推油玩够在肏干的尖叫用棉签玩弄阴蒂
378a22552dc40a9da177d92a5330b84c246c942e	438706810	1	[ThZu.Cc]大奈奈05-16直播实录
375dd00ed64beef100bc9ba7e414ed1f4ef7d1b0	34575733	1	闷骚的小仙女甜甜露脸看着很清纯，没想到纹身这么多，粉嫩骚逼奶子也很翘，淫声浪语真想干她
395a3f8cba8c446e411b3032c4acbe3aa90b9856	61456027	1	推特大神DOM窒息补充大合集（第二部）
39cd74874fedbab0b412ae679e5cc98e74399290	28549600	1	【1s陈老嫖经典回归】极品兼职00后苗条小萝莉，干得鬼哭狼嚎叫爸爸求插求深入，两炮下来瘫软在床高潮满足爽
3a794e748d60f7052cab6008745f590cddb36cac	5647307994	6	MIAA425
3b05fbbeb39d1c2b1938975387fc5a7f3eeea06f	255844398	1	颜值不错苗条妹子吊带网袜自慰秀 椅子上跳蛋道具JJ抽插抬起双腿呻吟娇喘
3b0f99309c2ed7f37b20c190660ba92824598cee	17431754	1	康先生江苏酒店爆操高颜值性感黑丝大长腿美女,魔鬼身材,翘臀爆乳,没太诱惑在沙发上撕破黑丝直接开操,最后在茶几上内射她!国语
3c9851a3dd1737f91e3e46ca5beab611722e3eca	193777831	1	韩国小母狗调教 在地上爬来爬去被干视频全集
3d35b4bd25fc31c146968762ed78685d3df3e296	1663567132	1	【91沈先生】老金约操00后清纯小萝莉，制服调教，强奸式啪啪疯狂蹂躏真残暴
3e21cabbde1157c7908e29db128ec7c88915da04	33982322	1	人气网红主播【九秋之菊】办公室里塞跳蛋玩法真刺激，经常往跑洗手间里泄欲3V
3f208cd4018bbf908204d86dac05ab2169535b01	32022855	1	颜值不错御姐床上一流 自慰大秀 白色网丝 激情自慰
401136ae74100550e97a53a050cf263d7a5ecc56	21998002	1	天然白虎骚气妹子双马尾性感黑丝 慢慢脱掉道具双洞齐插自慰秀 呻吟诱惑
41f7207a8f0d80e16c41b7fe2df6825e61c98ac9	20366988	1	【360】补漏 红色纱帐 偷情男女 男子没答应女孩要求 做到一半女的翻脸不做了 还痛哭 真可怜 长的还不错
42c55a9fd06c977e8386374eef626a11e7871ef9	27145869	1	呆呆美眉薄丝嫩脚丫子开满火力FJ 脱下丝袜爆浆抹满足底
43fd08c1145ad5ff6397e84939f2210191211e89	290598723	2	91大神露脸约操170长腿在美容院工作的少妇瞒着老公出来偷情(续)
433a4874bbb76aa4d7556d5c197dd860828aeaef	82545562	9	Lucidor - Turn (2016)
4453c550301443d001f0f255827afb2d8427effb	39531521	1	高顔值长脸漂亮表妹和帅气表哥居家啪啪,牛仔裤剪开哥洞洞,吃伟哥按着表妹爆干
457d640bcc2fadd375f60621323918f88494ee0c	2755053320	7	[Kotono] Idoly Pride Vol. 1 (BD 1080p)
4617209f838cfae51d0c38ee1e7787cde6e0125b	28856792	1	国产高清AV剧情-刺青师2,冷艳刺青师性爱成瘾高潮再起
462ea5c3e8c7f409f25745d7670e199c520d96f1	26143138	1	男闺蜜也可以是做爱的炮友 裹爽J8主动骑乘上去扭动 无套顶操 口活超棒 口爆男闺蜜射嘴里超爽 高清源码录制
48ef5fabcb50fac3622a2d38139b4cfebbd88759	24142293	1	高颜值黑丝包臀裙美女酒店私拍时太风骚性感摄影师按耐不住趁机诱惑啪啪,淫叫：让你干我,不要停,好爽!完整版!
48706c0b2d10238d980b688189d5b3fab0d35bba	285355265	2	极品女友在出租屋任我狂草，露脸淫语呻吟不止，童颜巨乳值得收藏
4812658de522a0c506ef79339fed7840d20064f5	27187012	1	【170长腿良家】妹子兔女郎装扮，沙发舔屌扣逼再换套情趣装，口硬上位大力骑坐猛操
490af03f67f574ff0e8418881fc33a442cf01146	40694275	1	湖南某院校暑假开学出来兼职赚外快的172CM性感短裙美女酒店被客户操的受不了,边干变回男友信息!
4995749c4999725e5943b3963a1b3e23afc21f80	54492951	1	【千人斩寻欢】第二场性感黑色长裙妹子，翘屁股舔弄深喉口交上位骑坐自己动
49bda93049d172b4c8c92961d09804ce472fcc89	35594652	1	禁忌之恋性疯狂〖可爱的灵妮子〗大屌弟喜欢操粉嫩美鲍姐姐 主动骑乘风骚扭动 后入速插无毛粉穴内射流精
4905b31407e33c7e702a7dd0e9605425d347f494	84572164	1	最新极品爆乳女神私人玩物之性感家政服务 爆乳女神工作后玩跳蛋浪穴 高清私拍48P 超清1080P原版无水印
4909d6d3170634081b8e766dffab8b1bcdae64c5	28085664	1	闭月羞花的CDmomo，趁着女厕所没人赶紧去露出，骚鸡巴有人吃吗？ 厕所撸炮，墙壁插菊花穴 刺激死了呢
4af43cb759a3e319abe988bbb90f6e1fbc8dea06	212317443	33	Батаев_Владимир_За_гранью_добра_и_зла_03_Шут_в_поисках_Игорь_Ященко
4aae85c5dece781ade39062c6e8d36c852e0066d	16555449	1	大学城附近工业风主题房摄像头偷拍高贵气质眼镜学院派美女和男朋友下午激情做爱
4b35bdb91edada6c245003d3b8a065ae0dbefe5e	25680838	1	城中村干逼，扒下裤子就是一轮猛叼狂插，干到骚货哇哇大叫
4e38f6c05759b41a70e965b3b64a8cc170f1ed24	18699353	1	重磅福利-气质漂亮的长发美女晚上和朋友撸串喝多后被带到酒店脱掉短裤尽情玩弄后撕破丝袜狠狠抽插!
4e7efc0f589c48022c6614f41dae59745ea1678c	101671706	1	绳缚摄影大师巴贝瑞色色的美女模特【白荷】想要全裸绑在窗边自慰DIY给大家看图117P+1V
4e7f863230e4bf5ce6185aa011efc5684859eca8	17248817	1	极品气质小姐姐三点特别粉嫩白皙的肌肤跟水做的一样，无毛嫩穴感觉阴茎插进去就要秒射，呻吟贼好听
503e9abdfd282c5d3c634306d9a64cd7e6ac7725	29062579	1	大连KTV小姐酒店打炮时候被操着接电话---我一会回家
505b5680d1750009944e30fc4193453da23509e3	14112054	1	年轻水嫩的漂亮大学美女酒店被鸡鸡粗大的男友抱起来猛操后又趴在屁股上狂干内射,美女受不了呻吟惨叫!
52e56b1b9a1bffa16d6000d3d2957268f4ef68fb	291638694	1	本来是庆祝妹妹高考结束，结果意外勾搭了妹妹的闺蜜，小骚货大姨妈来了，干净了马上就操爆她
53dd8f6e1510d2a64794812ea83ee0b392797386	3421462744	1	【小姨子和姐夫】大美女，美乳大长腿，模特身材，啪啪两炮干起来，风骚尤物做爱最佳搭档，高清源码录制
548643d0cb1210a6e8f3ef89e360aef57bab8d57	53420568	1	骚女夜晚户外带大黑牛自慰，找了个厕所震动逼逼头部插入非常诱人
541816d8bf77dbb0194692ebc7dd83bc6baabfa3	1281538189	30	mypq.xyz-HZGD055C
54e738a069d2b32e00d006989643b42e15bfb0be	2402077671	4	Jimmy.Fallon.2021.05.14.Chance.the.Rapper.1080p.WEB.H264-GLHF[rarbg]
57c0fba5be109f30d3e3d70ef58c3046473b8009	56741090	1	富姐白马会所体验猛男的特殊一条龙性服务,想要富婆包养你得有这绝活！
57ed28b28fa0c8653aa9aa0cb6a37348d552af61	34700063	1	漂亮清纯的小女友女上位快摇到高潮时,男友发力操得欲仙欲死,绝对精彩！
57596e3ea3b8b58fccc263b89fbea4318e9e22cf	35829078	1	全国探花 刚约了个极品白嫩兼职妹偷拍啪啪秀
57b69c28e29f288b3ff0dab16a74eddbcf2463d9	243727525	1	新人飞机头小帅哥路边探花约了个颜值不错的小姐到小旅馆吃快餐
585ecb9f3b0edcd56c8845d1f0fa49e012257f4f	36561869	1	七天精品探花长相甜美萌妹啪啪，情趣连体网袜互摸调情大力猛操
5866f107a7ff48fb6651f35b61eb2ef7f093f57e	37579264	1	新鲜出炉，酒店偷情约炮粉丝，【年轻的少妇】，三十多岁的女人性欲真强，热情似火骑上大鸡巴疯狂扭动
58774f3d4db54b20bf46f8efa3c1c83e2ae02d92	6323648630	3	YMDS-030
5908bde88090e4b81481ce296d34ed57f6353ada	1153765623	1	探花约草95年大长腿爆乳模特妹子 身材颜值均一流
5ac9c21db155cc20e3f6b82a846ad04cce9799e1	39825897	1	一坊最近挺火漂亮痴女主播人气网红陈丝丝0328一多大秀 穿着高跟鞋捆绑sm 自慰插穴淫荡喷水
5a2e025571098c407fa1e3d79979b0aef7c7b4e8	2181157711	5	Batteries.Not.Included.1987.1080p.BluRay.H264.AAC-RARBG
5baa57721a1d352d95e12342fb76cd8f0a7ebf9e	39137028	1	胖导演约了个高颜值黑裙泰国妹子啪啪，特写口交脱掉内裤上位骑乘猛操
5e474aa0966f4d24d264b90b6c7520ad0d32c6a8	43382330	1	台湾SWAG主播funnyg制服系列，分公司的浅野先生
5f4d4c2afa1006832661b1c0f7d7aa29272196be	56392697	1	嘉兴区售楼处短发销售小姐姐约了个硬不了客户,吃了伟哥梆梆硬,内谢臊茓
60a4a0d4be92310ca61508d4ea7c945cff273927	82361571	1	商场高清露脸抄底多个极品美女的裙底，全是长腿高跟
600a218d6a1b72fc189392d6d3dbee0a45b76a59	65587373	1	秦先生第10部夜连续宠幸两位妹子全记录全程高清无水印完整版
602ccf97ad9fe6d64a3b49dd084cde49784678a4	24015941	1	两个极品美孕妇都有宝宝了还这么拼揉奶揉逼诱惑 看到巨乳无毛逼有一种莫名的冲动刺激2
627ce12b0084c716d4a18dc9ba85e1c818163043	4482410343	1	【神秘探花李八八】极品车模，妖艳风骚御姐，粉嫩大胸黑丝诱惑，骚货这眼神看一眼就让你硬邦邦
6255510bef9f5d0e3877d1e909854e034a7fb682	20209236	1	专职红灯区 约操高跟OL女郎 床上浴室激情两炮
624493183b49f9dad144ef6801a0ad427b28e9a3	15592956128	2	IndyCar.Series.2021.Round05.Indianapolis.1080i
63d6647559e9283f032b9c79529fd70b01a6433b	147585101	130	twistys.com - Kagney Linn Karter - Get Ready to Get Naked - 130 pics
63b648629cc9bb564fc6aa35c196b98f90c262da	1340035664	1	职业装气质性感美少妇酒店沙发被胖小伙扒掉内裤掀开短裙快速抽插,边干边脱衣服,逼毛刮得真干净.国语!
643f163c92daec2ddacc0c3952f891e10aaa1d24	12808052	1	极品爆款身材【苏苏】一如既往钟情闺蜜表弟 翘挺圆乳 玩出白浆直接开操 无套抽插 淫叫好听刺激 高清源码录制
653303a3c1a9a735906c18ddd8ea57d67e82f162	10922413573	7	No Man's Sky
66f93828c8c74fddc5fc406914b1809355b7d1cd	149823919	1	漂亮大学生被男友真实灌醉啪啪
66bfceb24b34e2f67d6b83b648967426115f20e6	32403624	1	颜值不错的美女主播 身材不错 热舞诱惑 露奶露逼 把跳蛋塞进逼逼里 震动感强流了好多淫水和白浆
6b82289703ebcfab90fb5d305ddf98d0a35a1a4f	33005217	1	颜值不错朵朵母狗直播大秀 穿着丝袜自慰插穴 淫水多多很是淫荡
6c4ff98b4b2e18b27550db7d3901d26e6fbe9393	68310354	1	超高颜值外加尤物般的身材七七女神，炮火连天叫床声非常酥，没几个男人受得了，撸点极高，炮友给力被干得要掉眼泪了
6d56b08f313a0ba698ffb1042e5754bb8ef368a2	32186053	1	淫棍洋土豪米糕东莞行酒店爆操木瓜大奶豹纹黑丝小可爱这小妞被糕爷大屌干的呻吟太刺激720P高清
6d3404f26eddc603f88c7a14dbf646b333beccac	55105807	1	经典香艳超级打真军纯妹子心动啪啪搞穴作品《淫乱人间》激情佳作 剧情很丰富各种插穴妹子漂亮看的鸡动啊
705c668c68066770309845aff16f8ca98e31fd64	28987172	1	露脸做爱 身材超级棒的美腿御姐 先干一炮 再穿上薄薄的丝袜尽显美腿 两位猛男轮流干 御姐还没有满足的意思
7092aafd12cb3882567abb0678cfe14ced8b2186	129570674	1	脸蛋漂亮的长发女神级妹子和闺蜜在宾馆磨豆腐,各种玩法，脱光了跳舞,相互吸奶舔B好嗨哦
71ecde3c63d1094defe4b1995fc657f2073918b2	18311248	1	约操瓜子脸性感小美女酒店服务,娇滴滴的,看着就让人心疼的想干她,床上大力抽插,叫床真骚.国语!
73a09b5929457526ebe1206093e64f7075c18927	200417655	1	xh91hx 闷骚纹身学妹 口活不错 换着姿势操逼
73f24408720c53fc16037caf415aac6875a3e729	65869861	1	家庭摄像头破解强开TP夫妻客厅看电视欲望高涨把苗条大奶骚妻扒光打炮少妇呻吟声太刺激了啊啊嚎叫
746c472504c8c41aeb632cfe036e67e513f56e61	32052602	1	做服务的女技师两个肉肉少妇啪啪双女互玩，双飞后入猛操跳蛋塞逼自慰互舔
75ce574856f5e56da59c38d4678cc0cbf8c2a3df	551307868	1	光头胖男2600元约了位骨感苗条的清纯小美女,干逼粗鲁完全不考虑美女能不能受了,操的嗷嗷叫.国语!
75052aaf5941993e5881b76b02a299b239771afe	22968821	1	清纯妹子与多几个中年人发生不正当关系！被操到不要不要的 被干到要开始怀疑人生~你们忍心这样对待她吗？
