c889aa6df776b2d2a853c894a81bf9574b034a92	328150039	1	地铁站露脸抄底肉丝超短高开叉旗袍小姑娘气质不错
c85bb013917bc6d783a3fed6b9cc51991d5408a5	28023961	1	少妇被操的淫水泛滥，高潮连连，骚逼夹的特别紧，最后强制内射
c9d129512acd9c61fcd0dad4b2a0ef1ac867cb3d	33404265	1	大老板约啪赠送好多礼物才能干的网红大波美少妇先给钱在干骚货会的真多服务到位轻SM啪啪对白精彩1080P原版
c909af8fada78e4db65e2bcd3a928f533d8c3cc6	29502222	1	『赢了会所嫩模 输了下海干活』赢钱宾馆玩操美乳粉鲍美少女 多姿势无套抽插 内射小骚逼 高清720P原版收藏
c90a88d2360ce88bf509d0f0b0082b3444e1ddf9	38128834	1	最新微博红人校花网红精选啪啪合集（第五部）
ca563adfb4646fb374e26f8cb1232722ac490402	33044875	1	小妖精萌萌大尺度福利，绿播转黄播首次全程露脸大秀，年纪不大的小可爱粉穴粉奶自己抠穴，淫水沾手指吸吮
ca759d683eab2c8d93e9c8253ac4de7056b41599	127829424	1	熊孩子偷偷淘了一个洞，偷拍爸爸妈妈啪啪
cbce444f8d4e814b614605bac7123f250f100a01	40732028	1	颜值不错肥逼妹子全裸跳蛋自慰 诱人逼逼跳蛋塞入拉扯高潮喷水给炮友口交
cb5bb4980344a8c70f1dc21c9b4fe992a91f626f	29637678	1	亚籍纹身美女椅子上全裸跳蛋道具插逼自慰 呻吟淫水直流 太爽了
cbf18acc1ef37e45dd2afeaeeed02314a83f358f	39167279	6	Torrent Pro 3.5.5 Build 45852 incl patch [CrackingPatching]
cca2d59170f6dc66731cdf8eb04beaf59afb6b15	353514400	1	BrattySis.21.05.21.Harley.Haze.Slipping.It.In.My.Step.Sis.XXX.720p.MP4-XXX
cc827c93c9bc24bfc47badddd925a1dc8d8c085c	3605930716	2	HandsOnHardcore.21.05.22.Victoria.Daniels.And.Billie.Star.XXX.1080p.MP4-WRB[XvX]
ce937b35b0e6afad0f6fc61ac10882f8e70fa92d	548943785	1	宅男女神琳琳家里和网友互动 让她去夜店勾引帅哥户外野战直播
ce96e355db557fb7f47f8dd281536aa361b7a46d	215796886	111	2021.05.21_Femjoy.com_Lil-Ivy_Natural
ce0802ea27c8c39ae4152c2c32cd9b86a42c8a8f	18092056	1	一坊身材丰满爆乳灬美穴君君 一多自慰大秀 极品美穴十分肥美 自慰插穴很诱人
ce067376fd829becee38e8778673b4d0673278a4	1036143369	1	路边养生馆漂亮女技师偷拍给客人大保健推油胸推毒龙吹箫一条龙服务
d0237ce90c9cad380a62d9940b495f72f5ce9404	26185509	1	民族舞蹈系新生，身体极其敏感，被操的趴着起不来了
d03c77b6cf967c79efc9452e636004646ad3bb84	51084402	1	约操饥渴露脸小骚逼，吃鸡巴拿假鸡巴插她小骚逼，狠狠的操她
d06a471b10aa0ccb988a0ca8f468992bfa021b94	52895063	1	宅男撸管福利 价值1800元的推女郎女神黑丝翘臀露粉嫩蝴蝶型大鲍鱼 好多水 这种女人这是欠操 太骚了
d17dad51dba6f4ee2e00f8b93dd79f901ea95d07	27971627	1	厉害了我的姐屌丝狼友刷礼物让主播在寒冷的夜晚和两个大爷户外玩3P对白搞笑
d1df86b9ffc20e354ba4ff1150fa02d75011761b	39908802560	52	OVAS-PELIS-DR-SLUMP
d1860adbb70828ecaaea98e6725d32b46d0f142d	175188690	1	【真实MJ】史上最强 4p迷奸女公关精简版，3男讨论各种怎么玩法，各种拍照留念，女公关被死鱼摆弄被轮奸！
d119f3d3203595737342622ccc55246f6a313961	26142885	1	小凌约男人新人高颜值苗条嫩妹子炮友啪啪，口交舔弄上位骑坐自己动搞了两炮
d1a588cbd5116dc185a056ad17c08596fa0c4187	264645967	1	广东某大学外语系校花级性感大学美女周日和帅气学长酒店开房啪啪,先舔后操,干的销魂淫叫.可惜了大美女!
d149532ae0591104b9686c6475e87bfa242a40c0	42179683	1	骚妇培训计划把小骚货带到野外小树林扒了猛干，捏着奶子后入不停乱看有没有人，带到车内爆草射她嘴里精液掉奶头上
d1d502f9f867104997f69437fe36ad8dce3604f8	15113164	1	万达酒店公寓偷拍结婚异地旅游的公务员小夫妻多次做爱
d2489ff94df8a77e95f108fabcd28062d3449207	252868218	3	AllBlackX.21.05.21.Destiny.Cruz.Dick.For.Destiny.XXX.SD.MP4-KLEENEX
d2615a8ad7c47e82051fea9776ef620fe77850a1	262287459	2	最新网红少女『恶犬』VIP私人定制唯美红玫瑰黑旗袍美乳肌肤振动器按摩嫩穴搔首弄姿浪叫高潮
d3497810ae40692e1c207e0ece61748b716b5c58	101938668	1	年轻情侣水手制服诱惑后入式站着打炮，女主奶子十分完美
d42a4b8d72db44c47f556a3a6e65037fd00f6775	31133814	1	稀有国产AV剧情演绎『玩屌识人』模仿岛国猜人AV式游戏 口交抽插识别 女主输了和几个猛男轮流啪啪 太刺激了
d4bea4c46fc86bae00fe7dd8367199bc39ab11e1	21194598	1	秦总探花高价约的皮衣超高颜值的小姐姐,穿上黑丝爆操,真为接盘的老实人担心
d50f9a3f6b82ef3e5d0a3af6d878fd89afe2e016	270891323	1	一男两女双飞秀其中一个美女奶子很白 很挺 两个美女一起舔JJ 轮流口交 啪啪大秀 非常精彩
d569b5a099796f7d50766f2041917d30ecbc53cf	25380611	1	年轻小情侣吸精小少女直播啪啪秀 妹子小穴很粉 激情啪啪
d646a53276bb8f387daef77f221a5b80d8222279	45364652	1	很风騒怀孕调情黑丝趴趴裸舞
d7a5850ea8e7ed4fcd394cf02abab64f323f8b21	48053342	1	多角度偷拍服装店极品网红直播卖衣服,众多漂亮换衣服场景
d7059189aeabc15cbfa35f323f2c037e4272acdc	273821304	2	刚毕业到外企实习的漂亮美女为了工作被大鸡巴上司潜规则,暴力抽插干的美女一脸痛苦样,最后还插嘴射颜！
d8ac474dbc8996abe98d1208cbf36babae911e08	103559426	1	湖南美女模特张茹出名前与男友啪啪自拍流出SM
d883f9449e0fa7c7af2aaf2efe58abd7ef763628	124545008	1	美妆达人网红林允Jelly与男友JoalOng性爱流出第二部
d8efb9b7d2798069b7c617785097c7f0226aba46	49224298	1	私人玩物极品嫩白大胸小萝莉大尺度诱惑抠逼自慰，粉嫩的小逼
d89146e2dc1254415050dec1969e9a9508b6cc66	35724182	1	金屋藏娇阁颜值不错美女羞羞国际章直播大秀 身材也好 洗澡自慰插穴
d835aa1781f03669b60abaa208a0f3b43a7083c7	21848537	1	【全国寻花】约了个颜值不错黑衣少妇，口交上位骑乘大力猛操
daddea06f026c2339ac8832945dab9303f1e954c	47906514	1	渣男搞孕妇，年轻貌美玩的开，怀孕8个月大晚上不睡觉又吃鸡巴又玩逼草逼还不轻点，直接无套内射不要错过
da36981666a6c8d62668a9085d71ff223de1c179	29110519	1	有钱才能玩得上的175CM长美腿G奶肉丝高级模特女神露脸被解锁多种姿势 看着鸡巴软不下来
dad1daf9bfd21dce03f8fada9d031836ed077dc4	1281697323	1	PPPD-800
dbea959802d4c0bb66b87c8b50164c9feea6900e	4370464768	82	TheSecretMasonicVictoryOfWorldWarTwo
dbb860545fab3624730556b8094c5537ab5f0489	11159995	1	眼镜男家外养情人漂亮少妇温柔体贴主动身材也好最主要是口活一流J8菊花舔个遍连肏2炮得此女性福啊
dbf3b3c3ceb5d7bd482c050cb74049f46b4509bb	77543154	1	国产女同疯狂性爱系列-挑战闺蜜做爱性技巧2 做爱像打仗一样疯狂 原来女人间也可以这样玩 高清无水印完整版
dc29df96cb64196f21d8780b31ee1bf79b038344	41169389	1	颜值不错妹子性感黑色网袜自慰秀 逼逼塞跳蛋自摸摆弄各种姿势非常诱人
dca1ee21f1c3de22c8151d51846b4846aeeab456	420678299	1	【老李探花】酒店高价外围妹上门啪啪，身材好胸大口活好颜值高，抠穴一手水做爱投入疯狂抽插
dc8005cccbb576992dade01f9ffa99d097a576c6	148945349931	115	Madonna(@JUL) FHD Pack x25(210522)@RUNBKK
dd817b86f6e667edc208cd7b5417fa2d0ba4e905	24570795	1	宅男打飞机福利微博美少女九尾狐狸M超可爱学生装 极品爆乳玩粉嫩美穴自慰 呻吟高潮20分钟 高清720P完整版
dee85a703e865f8dff32f6befff7ceb419bab27f	52827554	1	迷情骚货户外坐在地上AV棒刺激骚逼调情，公测内开始耍流氓了，站着尿尿草逼，楼梯安全出口门前后入刺激
df420ee6f769693201f45dad535bf6ec77509283	680066108	1	高颜值美女丑曦苗条身材诱惑秀 脱下内裤抖臀非常诱人掰开逼逼近距离特写
e0b3497c6d3073d8fc36c0e6d92b8b76e15b45da	4637229187	2	WildOnCam.21.05.17.Lindsay.Lee.Solo.XXX.1080p.MP4-WRB[XvX]
e05e10791e08aa79d83337c06f2c5917ffe4cee1	489989483	45	Black Sabbath 1980-11-18 Definitive Tokyo 1980 Soundboard (Zodiac)
e14b1e9db8775538f9702a6fae3aabe46a2316f9	27718189	1	【镇店之宝】露脸白富美与富豪男日常性爱自拍流出
e245e6a931a9388583b891b0b05b0d4081066582	18340664	1	眼角有颗美人痣的颜值美女主播 身材不错 跳蛋插穴自慰 很是诱人
e339f4818ee7b3e2e01351eb0bca1623bea5dd7a	25575821	1	高颜值胸前纹身妹子全裸自慰秀近距离特写 揉搓粉穴呻吟娇喘非常诱人
e3e2d3014e017df7b011ce40d1d8c4b6f93732ed	3078350977	2	Deep.2017.720p.WEB-DL.H264.AC3-EVO
e32350ab881d359e85723b3b5ad052868a377ef7	55204327	1	原创AV剧情【美女外送员引诱有妇之夫】经常给这家庭送餐暗恋男主这次再也忍不住了
e4918e199faace62b793093f7732a4c2224eb5de	11496924	20	(C77) [Homuraya (Homura Subaru)] Mian Banana Milk!! (DREAM C CLUB) [English]
e56c277eb30173e606f4762e794bbd7575f4da64	34489027	1	极品爆乳女神猫女王的日常黑丝爆乳多诱惑 超爆G乳 淫荡浪穴 极品骚货必须狠操 高清私拍56P 高清720P完整版
e602112b9f4522ff2eea3f1deeb2a0ae476f5e3e	43627155	1	美女主播我想静静啊 逼逼里塞跳蛋去吃肯德基 旁边都是人的时候发情了 马上回家肏到爽
e6a5a486828d709a6b2b7ebf248084eccbe08caf	80059357	1	抄底高跟长腿黑内妹子,男友不停偷摸美眉的大腿还伸进去摸BB也不怕人发现
e6d991d270f9eddb3d6412c49240125efc8e8fdf	51137740	1	黑丝无毛小骚逼勾引闺蜜的男友激情啪啪，样子真骚主动做在小哥哥的鸡巴上抽插，各种体位爆草叫声淫荡刺激
e7a29f31353f2d7e5139bbb05542f02e4532e1b5	14547759	4	Movavi Video Editor 16.15.0.1235+3650 (x86x64) + Crack
e9cddd02e1f979eb8a9619741d88b9a36bb18485	13355039	1	【秦总全国探花】酒店约操年轻嫩妹子上门，看着挺清纯肉肉型，胸大态度好，很是诱惑喜欢不要错过
e901828c836721da2b64a19a682282916caa1499	18230866	1	没窗帘的廉价出租房偷拍两姐妹一起脱光衣服洗澡
e940ddbece7f50ca2a5cc3a62fbd50feb7a372a4	416967202	2	Bang.Surprise.21.05.20.Siri.Dahl.XXX.720p.WEB.x264-GalaXXXy[XvX]
e9b3d143acd041b938b1993c5d8d3e46399cbdf5	234599128	1	又是她 好身材艺校妹子浴室洗澡自拍 全裸给你讲个故事 首次近景特写展示BB
ebf3d75d1db587a206337e8a30fb8621047952f5	37864258	1	宅男福利女人味十足高颜值女神主播菲菲蕾丝睡裙诱惑手指振动棒自慰搞出好多淫水淫语自述撸点很高对白清晰
ec2e455dbf589d8d1904da61bba29f8d50f61e01	96401046	1	颜值身材都很不错的金若熙露脸直播，坑货主播所谓的大奶毛毛秀，请你来鉴定
eceb5ed703c2a19dbdc5cf93d1ab130c23bce427	43921990	1	【鸭总神探】清纯小萝莉被大屌猛男沙发狂干，AV视角完美展示做爱细节，清晰镜头视觉盛宴
ec5c31433583c5520d5f25c8e3e869f99cec3a72	32109284	1	奥义 跟着美女后面偷偷掀开裙子偷拍
ec1dd398e5b4b8b1b3fb91e927a9cb5c86a0eb9e	146571247	1	学生妹露脸被操出卖男朋友，啪啪啪的撞击声不绝于耳，叫的也好骚爽看表情就知道了，也数不过来一共干了多少炮
ec5c355e5b73aa10ee39caca479d153ebd0e7ceb	20580378	1	露脸小少妇屁股白皙高挑大长腿高跟诱惑自己在家寂寞玩大黑牛瞎几把播陪狼友解闷，自慰呻吟精彩不要错过
ecb5e896be971700a384e49ebbafb1d69f8eb8f0	33285385	1	新一轮裸条借贷。美女大学生被迫自慰
ed61498fc66192f725c9135b9c7775e28f5e5940	160234225	1	91校长-挑战-肉偿还之吴妞妞剪辑版身材完美，婀娜多姿，长发飘飘，在床上上展示各种姿势!
eda434c05f0857c467431368b258357c2bbc6782	603332859	1	最新众筹流出推女郎巨乳模特松果儿揉奶揉穴淫语自述挑逗“快来J8操我用力干我骚逼”粉嫩嫩小穴都开门了1080P原版
ee4df20a35334754dbc21d09f6497b2c7cb5a82a	681103318	1	蓝灰圆床周末偷拍精选 全网最全的收藏精品 上帝视角，视野清楚，画面流畅，声音响亮，能完整看到表情和动作
efc9928212244f2f69970820196022b01006afcc	91915360	1	私人玩物—轻熟女play
f00169517a5b903b3559609d3dadfbfa2b7ed100	25401534	1	高端私密群内部福利7基本都露脸美女如云（上）
f07bd179254c8207c7f324dfe45ea2f89f906823	10376785967	47	情陷聊斋·倩女幽魂
f0b0f3dcb761d79e4c3c4b07e4a5c1217953b457	2006266410	29	Carib-052121-001-FHD
f160f44ecef8d8ca666a63800e0ca1b22006db02	33676952	1	露脸酒店搞个刚开包没多久的大奶漂亮小嫩妹
f1810bf20ce0946d6bcda24fcaacec51422cc3c9	73388044	1	太乱了大神约炮骚妹子一边搞一边让她给前男友通电话给他听做爱呻吟声又与一个女的视频通话对白淫荡刺激1080P原版
f12383bebdc31fece3ca7ea887992de39903aaf6	110787758	1	最新流出迪卡侬门事件女主角混血妹在挑战极限人来人往的床上用品商场露出拿假屌自慰高潮喷水来人迅速起身1080P原版
f2e9bd5dfed7e38cbc1b6186b388df420cb9ca61	60839020	1	非常嫩的仙女小甜甜还没开脱就内裤就湿了一片，圆润小奶子很是性感，自慰骚逼淫了一手好湿塞到嘴里舔
f309e2d197f2997c76262caf1d6f73e67faca519	82778741	1	酒足饭饱大款带你体验国际会所的休闲特殊服务现场点妃选个花季妹子口含水舔遍全身卖力吹箫边干边聊对白精彩
f32eb4a02e8ae8d1c3b5589a80b9cb7f953f9036	107082700	1	媳妇换上肉丝美脚超给力的 一阵狂搓怒喷好痛快
f30212218eeca240c31a5ce0764dcf064b626149	26306957	1	人送外号杨导调情清纯小妹，身材不错大奶子很诱人，羞涩的口交压在身下爆草揉捏大奶，呻吟可射
f36bcaaae20feef696b2193577c39eb6d9bf8664	33903010	1	骚人妻口活技术超棒 裹爽了手把J8引导进入美穴 后入猛操干真卖力 还是扛腿操过瘾 貌似最后内射 露脸完结版
f3a6d8bb8cfd6174897286991721a64ff3342eeb	1008388609	1	神探老金探花约了个白衣妹子，镜头前口交扣逼舔奶骑坐上下自己动，跪椅子上后入晃动奶子非常诱人
f31f6cb8ba782cb3cf3b93597635c3517e74edfe	131281474	1	高价网约身材超优性感的大长腿外围美女酒店啪啪,齐逼短裤,纤细小蛮腰都不忍心狠狠操她,稍微用点力就嗷嗷大叫!
f4b746e8d17edfe4cf32c8cb8b1c43d7ae4b560f	78461849	1	美女主播精品梦雪一多大秀，露脸情趣 舌头很诱人 自慰棒插穴自慰 骚逼特写呻吟不断 很是淫荡第四弹
f478b13153a97107457fbfbeb31fa5df33acfd3b	1318987215	13	www.IPTV.memorial - CumPerfection 20 01 02 Candice Demellza Santas Present XXX 1080
f5b46174f1e5f60903cf1bb087bee8f8887d01b3	67275768	1	专业操老外【东北探花】国产猛男约战俄罗斯豪乳网红美女 爆裂黑丝 扛腿抽插猛操 怒操粉穴 最后口爆 高清源码录制
f5cb94015dc6a65dae294a4cd72269bd1e5bd6e7	92856912	1	熊孩子上课打瞌睡被老师叫道讲台罚站,为报复老师偷拍老师裙底
f61317d44e65ca087d37ece630816c6d70cd94ca	1685647281	1	DJ哥国际酒店狂插三线影星高清多视角实录大战1小时女影星颜值超高1080P高清原版
f760c3bd403eefeeff5bd700887899d9ea77de85	23378495	1	还没有结婚的寂寞美乳小护士浴室湿身自摸扣逼 鲍鱼粉嫩
f73bc7ea25cfaab55a16c444d14c90ceeedd6fac	72033428	1	被网友评为奥斯卡影帝『人送外号杨导』约炮两个漂亮KTV公主妹子回家啪啪轮操 两个妹纸清纯懵懂 被杨导干懵逼了
f7327c667ad28e949f0e142c43744a52e27982e2	2168240128	1	KBLEGEND
f8c50dcb523d28c751c329c64da3132e6386d415	51048252	1	身材很好的马尾辫女友小骚逼，背对着女上骑马操逼，无套坐插很骚
f8dc86b4185e5a3b0160dcf11861d025299f1e58	24480149	1	极品小美女奶粉嫩逼紧毛稀少被男友操到哇哇叫无套内射又是一颗被猪糟蹋带好白菜
f8ca48b21ee2512a55365ec4e0d20db475e13859	40854587	1	大学女生宿舍玩的真开放,雪白大奶子好诱惑,晃动不停让人抓
f923fe29228e4508025f9abe0a9375808babff58	34609994	1	小奶猫戏精情侣精彩演绎大叔500块勾引穿得很潮的少妇上门钟点工提供性服务啪啪口爆吞精对白清晰
fa9bbf166b008e5aca254d1ffb20a0c931f8ce6c	433600462	1	91佐耳哥-无套操魔鬼身材小护士完整版
fb7e3090c4101102963f7894ede73d685856de40	56715841	1	听朋友说最近附近新开了个桑拿会所小肥哥亲自去找了个大眼妹体验一下680的全套服务
fb7c36bdc46b889421c8d070b54325889459d958	562839340	1	清明节重磅福利鸟站流出头条女神乔安和摄影师啪啪视频1080高清原版
fe90854be61db0aa5b9bfeacfd138f20665f1db0	51500281	1	勾搭老头系列续集『农村扶贫组』专门干老头
ffdc62c1d55251f29fa40856c6266182a0362206	287485960	1	[TeensLikeItBig] 2014-04-05 - Scarlet Red - Crime Pays In Pussy [MP4][854x480]
ffb39151ea3379d8dc5aab3d25a4236adaccaa16	34730337	1	红色情趣睡衣美少妇紫薇,各种呻吟浪叫,光听声音就硬了,喷了一沙发水,全湿了
ffaa9fbb10706444c2f4aa7aa36cfb1875b944ad	47926476	1	91康大神 酒店约啪包养的学院在读马尾辫大波肥臀学生妹穿上黑丝各种体位爆插疯狂淫叫操的叫老公好爽 无水印原版
