006cbfff6f62ec4030f9a796427204be29b06934	33797250	1	【萝莉和御姐姐妹花】两男三女多人群P,情趣女仆装互舔上位骑乘大力猛操
00835951ff15b0caa1b4b044695014de55ed85f0	65225785	1	被人包养的高颜值气质美女电视坏了请物业上来维修时穿着太暴露被男诱惑扑倒强操,说：用力操我,好爽,你好厉害!
01b7623998540e00846c47c3f0930f34a64e013c	21621063	1	某技校校花级性感美女为赚零花钱私下偶尔援交,酒店被憋了好久的中年男扒光衣服各种姿势拼命狂插.呻吟求饶.国语!
01a1ae0ddb47ab75b136745a90b6265b1fbec56b	23027760	1	社会小情侣开房打炮 女主很高 口活不错 在浴缸里直接干起来 又到床上打了一炮
01244ecc7a50730be6eec5fbc72ed862622c5c98	190565620	1	大学生女友芝芝的母狗露出驯化之路 14V+347P
01ceb8798137bd3493676f0cc9db3bc1018eabad	59749177	1	社会小青年男女蓝精灵美女团直播大秀 性爱派对 激情啪啪
01b47db089af010ffbb770f2b66a04f30cc107b9	32559939	1	爱爱琪琪扒下性感的小内裤，道具插入骚逼淫水很多，逼毛浓厚浪叫不断身材不错
01cd540f5820e2737655609875c1079932c23af1	240266740	2	大学城附近主题酒店摄像头偷拍学生情侣包了几天房的啪啪私密生活
02b2469227ebed19ea6dd4422ee7ccd81c2e4801	43454745	1	Twitter博客202名网爆红人整理超强套图热门视讯合集绝佳收藏版福利
026fb5d19bd2d8b91eab9e7b59e28b2f8ee1fd5b	51893610	1	露脸抄底黑色丁字裤超短裙和男友打情骂俏的妹子
023913801ec06be3a63ab9e348c62d313844a0b3	40902414	1	国内牛人-变态怪蜀黍欺骗非主流女女买丝袜偷拍内裤-高清无水印国语
036bf6596b1932ad3f57933874a05a3a3cc2251a	16830246	1	样子很淫骚的国人妹子到国外不好好读书和打扮得很文艺的大龄老外做爱
03ba6fd399f296610c428495d0e1ac8c10b34734	5178762899	3	22.05.2010.Bayern.vs.Inter.Final.[720p]
0317434723633d3a9c3a46e4444d14fb6c15fce0	25901000	1	胖哥网约白靴短裙长发美女酒店啪啪,身材颜值超一流,迫不及待在沙发上各种狂干,叫床又骚又浪,干完又干.国语!
040a2c5d12d3136ad0ca25726889be2103e199d1	68468143	1	网红嫩妹二次元狂热少女私拍套图视频合集
04508592f0be0e69e40ccb93ff0c3d00040505e8	28841958	1	【周末礼物】高端人妖TS妲己，边舔着鸡巴边说：姐姐你的鸡巴好骚啊，好美味。好吃吗迎来一顿猛操射淫液喂进嘴里吃！
055071bbbb06bbbcae9f8dc30ce24ba77bcde66d	75804204	1	国产AV剧情91原创出品婚内出轨出差约炮女同学老婆查岗遇危机素人杜若冰主演1080P高清版
05f3936b1e729cda18d6c9dc4aaf961fd21fbf83	99720091	1	91苍先生最新新版天堂系列-东方明珠下的黑丝女神 新女主美乳S级女神苏儿极致诱惑 高清1080P原版无水印
065f99ee8e4cd0db9eaee2ee4dfae501c82dfa05	49731255	1	千人斩探花第二场继续JK清纯萌妹子，骑在身上摩擦倒立6口交，站立后入深喉插嘴
07942fbf1caf43bfda49098e9b5b2403c0d8ad54	379469565	1	到四川玩闲来无事叫来一小鸡没想到还是个美女 大玩小骚逼摆好手机偷偷录下来回味
080e7ce97667f6b9dea8d92ae50167fa740ef202	42144182	1	女子超市偷东西被抓现场被保安抄身大奶子都露了出来
088e20456b71e420d7010e68b69d9127e526b349	43476503	1	小娜老师作品 俩位超靓美女肉丝陶醉征服小超人
0894f03f81be7f652e71ec4ba8cc092e5a33f4d0	3989985524	2	Wagner_Die_Walkure_Met_Opera_James_Levine_2011_optional_Eng_subs
09c1793f45fa4bf89eedb00c26348339e58f521f	19615736	1	娜依灵儿自拍扣逼摸穴,身材好奶子挺逼逼有点黑
0999525a11d3354d4b3d5fd596739c081ae22953	32846593	1	巨乳女友衣服来不及脱，按到床上输出，呻吟诱人叫声可射
0a58aa7d5e3e874bd7795df242ff24ace5704d62	63396882	1	【AI高清2K修复】步宾探花性感黑丝大长腿包臀裙少妇啪啪，肉肉身材近距离特写舔逼大力抽插猛操
0cdc7d855799cf736c7e1e37e7f83c5d39f6ab62	68739426	1	邻家有女初长成第二弹黑丝高跟，享受女友的精致口活服务淫语调教，直接射在了嘴里 高清完整版
0d941d922b6a2033b4a6684c3b643b442c763104	50495589	1	果贷新流出95年山西少妇徐江霞自拍全裸紫薇扣逼视频
0db4d49c02055bb961175770b8bc38b56c6e4b8d	60618211	1	【AI高清2K修复】鸭哥侦探约了个长相甜美性感黑衣妹子啪啪，穿上高跟鞋张开双腿猛操高潮多次喷水
0e37c5b6cb3c4fa3322b9ac9f9d6bd88d1c4811d	55951681	1	奶大肤白貌美的小骚猫深夜里的激情，跟大哥户外车震啪啪，大鸡巴撑爆她的小嘴，激情女上位抽插浪荡呻吟不止
0e852f6be660c7bbaa9773307ed2495bdf65d620	39329334	1	价值500元的微拍miss1885内部VIP视频15V整合1V免费分享
0e49366e1cbdb897daef39054fd9e4abce7b0d73	46519436	1	高颜值苗条妹子 【法拉女神】炮友不在自己在家自慰，手指抠逼呻吟娇喘
0e12aee9059d19387f6246340b5db31db624fc76	270675959	2	绝美精品佳作-重金双飞2位极品性感大美女,气质短发超甜美可爱,配合度高温柔型,2人轮流爆插,场面激烈震撼!
0ee9d745cc3a50dd86510c3bdc619dec241efe90	629742765	1	洗浴娱乐会所找个大胸技师享受一下特殊服务
0e27989736212988b45e0241e271e99635893597	90502010	1	91大神高级酒店约炮身材非常赞的小情人才干一会就射了 最后用二指禅把她送到了高潮 高清露脸
0f3c1b2ddedc0d40aee95271ea182fb23d5a0a27	500277130	5	Adobe Premiere Pro CC 2021 v17.1.1 + Crack (B4tman)
0f8fdf95ed5fb0b0710b7f5a1961d706b60b87a4	136024318	1	极品良家夏后各种自拍 表面清纯 背后放荡
1033af76bfbf0659a501647f52ad304f06d8250c	23754373	1	主题酒店360摄像头偷拍中年大叔和漂亮情人开房幽会啪啪啪
105cb77dc0d3127356713c5c77460a527f9c1f86	724350894	9	508-25
105ff4b546f4a3e89661edbdc4f5b535e5ca5f9c	16761167	1	第一坊贵妇气质美丽少妇露脸居家直播自慰秀 身材好皮肤雪白 高潮出水座垫湿一片太骚了 国语对白
109e0bdc9c08d5de73e50b5fcb386aaf0b2a6bb9	103439638	1	精选露脸抄底偷拍各种高颜值时尚妹子们
1118c76682429fb270dce0740b270bc51779ce73	23276989	1	精品推荐 长相很御姐范的漂亮的气质美女 大尺度诱惑 奶子好嫩
110a66ff18ec24f5cb61576c1a5a9c90900f4c83	33029884	1	销魂少妇就爱大鸡巴全程露脸与大哥啪啪，给鸡巴舔硬了直接草，各种抽插小骚妇很主动口爆吞精，无毛逼就是骚
121606640553e168e5aaaaed7f9b32ced4ae8c5d	649093590	23	Cicliste Per Caso - Grizzly Tour (2020) [720p] [WEBRip] [YTS.MX]
12d59974edbcf0fbcb7eb0fdf9607a3a1a0d1ca3	48380456	1	猛草狂日露脸骚货，一边被狂插一边跳蛋假屌一起上爽翻着骚逼
12f858c2ba97163ee4cecd360c7e7c69f994b1f0	7729989156	14	FBI.Most.Wanted.s02.WEBRip.XviD.Rus.BaibaKo.tv
14374a98ca76720a353b9106a033614f75a9df51	1228978500	1	大神呆哥约会大片-玩游戏认识的某航空178CM在职大长腿美女空姐,第一次见面难免扭扭捏捏被我强推内射,高清!
14b86e2ad5c1bd510417f8797d7c373ab93921f2	808337680	1	极品大奶妹 乔乔求宠爱绿播下海 大尺度 露逼诱惑
1526f5a00c2c1e7ddb5756050c46d0c675ef8359	47067274	1	最近给一个高中错学的学妹换了2000元网贷答应让我干她五次妹子下面又紧又多水
158b79456235357e14be74de80f6c0836f182d75	533754404	1	童顔娇小美少妇在线现场电击调教,被电到全身抽插不断高潮
165d6f2c4c1eac7824cdd0048095559ca6194fd2	292097976	1	性格狂野漂亮的美女小姐姐带夜店刚认识的猛男开房,边操还边拍淫叫：你喜欢操我吗,射我里面还不好,用力干啊!
1788ab305ab65c872bb7d5f73c72a1f8a3ef4001	22983802	1	颜值不错 身材苗条的少妇全裸漏奶露逼诱惑 茄子摩擦逼逼出水 插逼自慰 站着用茄子插 快速抽插 逼逼抽烟
17b9b1501fa44ced096075c44d9d403d3a0ef746	1349870488	6	Watching My Daughter Go Black Pack 6
179d12da5d11b0618156782893ea30c38d943b6c	980919751	1	超爱口交的极品淫女骚货小洁喜欢胯下被屌 舒服到直呻吟好爽
177958595fee0f6bafe0b29c7d60caa27ac7459f	17032365	1	小宝寻花约了个颜值不错LV包包妹子啪啪，近距离特写口交后入大力抽插猛操
1865f51970835310250a13624f1c51910d8fbf0e	19799111	1	无毛嫩逼骚主播骚穴被开发的很耐插 扩音器拳交 看着年纪不大却很会玩
18e36160a0387ef897c1fdf7b69428aeedeb42be	19433809	1	探花hanz新人探花约了个高颜值嫩妹，舔奶舔逼69口交近距离特写抽插猛操
19396ef2fc2b71212643d59118c1fec1c26d471f	45726433	1	很是苗条的国模小钰大尺度私拍 粉红的小穴微张还有点湿润
1b86e26c0d99fb4d4d7fbe7eab7f2f9ff0941436	1541834749	1	91新人操哥最新绝美精品原创佳作操遍欧洲系列第5部-乌克兰首都机场偶遇中国小骚货 -1080P高清完整版
1d60c9d80d47594eb1089520ea7dc048c4bf0ae8	7696062324	2	Port.Royale.4.Buccaneers-CODEX
1e830997761a55c75b3864ebf5e3adf7cde71e54	67189372	1	【颜射颜射女神】拿我的大鸡鸡塞进她的小菊花 兄弟 在下我在上 哥俩一起干妹妹
1f8632a1ee0540772e81427259228ae31c7bcdcc	15600946	1	千人斩星选黄发大奶少妇玩3P，口交舔菊一前一后近距离视角。骑乘位双洞齐插非常刺激
201e73911dc5e496ba51f567d6059d494474d598	18090926	1	长得像某女星脸蛋魔鬼身材的极品外围女和大款干爹啪啪呻吟刺激
2272d56cccaf3593c539d386731f9f4d6f926620	1297567874	3	The.Mosquito.Coast.S01E05.Elvis.Jesus.Coca-Cola.720p.WEB-DL.DDPA5.1.H264-NTb[TGx]
22c5e70cb7507e29292f6a312121728b7ea1a329	835328342	2	Recalled.2021.KOREAN.720p.WEBRip.800MB.x264-GalaxyRG[TGx]
2382089d3300ba6e769acfc0e2eb537cb75d3e58	13743190	1	极品美女主播，和眼镜男直播推油啪啪
232e9771a646187adfc8f871ee344309f6c99f77	35837194	1	终极调教骚货老婆，后入猛烈抽插白嫩大屁股，无套猛艹更爽更刺激，无限撞击BOOM，对白清晰 真实自拍完整版
242d8e42c8c9d51416f6cb09cd975678a5d2a42b	40857446	1	颜值不错妹子【超美韩】情趣装诱惑，露奶大黑牛震动肥逼呻吟娇喘非常诱人，
24df5d5c30cab5c9640a5cc12b6adc87392f035a	52649248	1	翅膀纹身挺嫩萌妹子和炮友激情啪啪，舔弄美乳抽插猛操后入骑乘多种姿势，快速抽插呻吟娇喘诱人
248a18e437ae64c8f53934b5b39ef30c8eb6f75b	63050541	1	最新推特网红小萝莉【来自喵星的岁酱】私人专属女仆，水晶仙女棒淫汁源源不断的流淌
2462cd6bfa70910023a6ed5569a83f920a8eaa77	14845668	1	清纯小萝莉直播大秀 无毛一线天粉木耳
25b8dbf6774c935420cd7cb5e28ef875c72c7870	28965991	1	抖音7.9W粉丝网红 玲玲7 一对一调教+大尺度福利合集！(34V)
26fce772a67e2779dae13871dfb9356df1dfa6c2	90171618	1	“好厉害好厉害”嗲叫声听了心痒痒的失恋美女约网友谈心被带到宾馆啪啪销魂的表情把所有欲望都释放了1080P原版
278c2220ae5bfcf755b0761d0153909ddbf47de7	26720781	1	锅盖头小青年与外表清纯眼镜妹开房造爱斯文眼镜妹身材真好皮肤光滑白嫩被操完了还偷看男友洗澡对白清晰
28e28dc3b7d6761fa9f630d05ddd2d4e5292db36	34921604	1	大宇宙国妹子颜值高 身材很好 插着自慰棒 随音乐摇摆身姿 十分诱惑
2846b05f8152d830a67451f2066c3dcc20fb03d3	167267388	1	【精品推荐】WENSE摄影很有肉感的模特妹子鱼鱼内裤里塞个遥控跳弹到宜家极限露出自慰
29a21364b1cd013acdf936471c592496b59c4357	358826814	1	丝袜女仆真会享受，撅着屁股让小哥给舔逼舔菊花，爽的浪叫给小哥把鸡巴舔起来玩爆菊，这草的也太激情了
29f3b3794b4f9c6e16e41e18f88b16063e59cb9b	63304947	1	我和一个不要脸的婊子的性生活 全程露脸国语对白
2ab417e7f9d2341d1d28c25ffc157ee27dbd2f3c	553067193	6	33
2ad2fa63c7a89f8c00f6a71115a2009810610dcd	2514089603	1	颜值不错骚熟女【四川波多】跳蛋塞逼开裆裤，拉扯自慰非常诱人
2abcec42f1e0cd2f2b24798d7f3f94ea18198ef0	41055895	1	女同学笔记本安装远程摄像头控制软件看她们宿舍妹子集体宽衣解带换衣服附寝室妹子合影
2b64dd714b13783aec32ac9f9a4fc1052ac73e14	33105906	1	勾搭约炮大神『户外阿力哥』勾搭身材不错黑丝美腿的表妹媚儿 表面清纯可爱 脱了衣服骚浪求操内射
2b30fd006595530b6577aed64bbb0c8307be262d	25929547	1	约清纯的学妹到宿舍玩游戏，来都来了干趣操了再说
2b65a8d812cf6e0ba81ad9d3f55dd83d2af6ec36	50929246	1	抓奸门~~~正在把小三日的时候很爽的时候被老婆抓奸，一不做二不休两个都绑起来，一起调教
2b665e4e043887492c995a144079f439f2c7a944	33339652	1	极品披肩女神和大鸡巴男朋友在家激情爱爱看女的很开心还用电脑录视频高清版
2b5d8aa8cff96418704b130b4c7b48337235c783	59194710	1	国产小青蛙系列第四部3P粉丝老婆淫妻偿还绿帽债 又一次肉偿拿利息 无水印完整版下集
2b0145a39b734efcedacbc4d1872422a4c542484	22902330	1	顔值还不错,气质美女打开双腿,摆出最诱人的M腿,掰开臊茓,黑森林相当茂盛
2cab0cd061666b49e558c07fd03ef691c91d9401	51113708	1	美女单挑2猛男玩3P,干的正起劲 突然射精到脸上
2c7e47216462c44a715e951446459a8d4bdefef0	1757818217	5	Chicago PD - Temporada 8 [HDTV 720p][Cap.813][AC3 5.1 Castellano][www.PCTmix.com]
2d1f8c9b895cd24f6e6c72fcdcc6eefc545e4516	128461364	1	“老板，我老婆都给你草了，你可要记住我的事儿啊！”老公在媳妇屁股打一针让肥猪领导操老婆 自己还得一直看着
2d0a01ababe51292eff0011e7c5ed39a9195ac77	83587128	1	太子探花极品包臀裙妹子换上制服啪啪，69舔逼上位骑乘性感翘臀自己动
2e6f376fc3ddc7b3a1260777579ccd8270415f1b	39163556	1	高颜值气质妹子露奶露逼诱惑 高跟鞋逼逼无毛翘着屁股挺粉嫩非常诱人
2e1f2884f801c996c25e1f18daeeab613d6179be	27970868	1	【越南寻花问柳】今天八点钟开始，越南18岁小嫩妹，乖巧听话逼又紧，怪不得号称采花圣地，不要错过
2fd387ed2306762a6dfb3b9ee604bbdd11731c82	22315883	1	我和极品长腿女神的性福生活.穿着性感粉红色丝袜非常诱惑 各种姿势快速抽插
2fc6ed170b93d2320722d77c50ce9959f0be48a8	41806417	1	棚户区站街女暗拍新脸孔长得不错的小姐抽着烟被大叔干
30f00dff9cb09f10e9ad676096afa53d32b85960	21873268	1	文艺范气质美女大尺度抠逼自慰，浴室洗澡，近距离特写粉嫩小穴很有撸点
316fc6ea40d0b7303b67592140d68e382228760a	261095486	10	TVBOXNOW 同事三分親
3111407477dd2756cb38930cd2685ed8ac0cc73f	66918495	1	“你老公干的爽吗 没有爽”酒店爆操极品淫荡少妇 超级会叫床 太骚了 苦了隔壁那些房客了
32a35e53f60854a80c9bd4d0773f28d53b240389	52667269	1	重磅福利最新自购价值1000块巨乳网红刘钰儿大尺度微信福利视频
32b2b4954171eb9436d750967bd8c02821df7cab	21070961	1	杨导撩妹直播大秀 双人激情啪啪大秀 木耳粉嫩
32e0671978d97eb9295568a6e835b30a6de1f9b7	47990249	1	91极品气质网红涵菱22部福利无水印 清纯的外表下隐藏着一颗骚动的心啊啊啊啊老公快艹我，流了好多淫水，超会叫床
3379e103fa68bde1e5641d01a4aee14636d6ab37	47170110837	22	FIFA 19 [FitGirl Repack]
33a5ee129078c7cfa4c9afd9f60aa0042e573a54	335694431	3	American.Dad.S18E05.1080p.AMZN.WEBRip.DDP5.1.x264-NTb[rarbg]
34bcd1cec20a7eacf460d259707979cb3513ac14	6873971626	24	[AniDub]_Mokke_TV
347937e222816f7fdaeec04ae3e7a7dd0853cccb	39128976	1	少妇馨馨背着老公去万达酒店援交，给了钱怎么搞都可以3p都可以，，胸推摸逼十八般武艺爽死你
36cc593c8e213dabc1f13d4ab5c40a7eeee3a8e4	77262763	1	【泄密资源】小情侣日常爱爱流出 十个眼镜九个骚 妹子身材苗条 奶子挺翘 完美露脸 1080P高清原版
3980d82d54c8e567c6808e347b0224cfbd674e43	28134248	1	开房让骚逼炮友穿上各种情趣装，狂插爆草干个爽
3940147db542b3bac74ded4a4c20cbae204fc759	38334845	1	很是漂亮脸颊粉粉的美女主播收费自慰大秀 颜值高身材不错 自慰插穴很是诱人
3a3cefb00d4478ed64b0d9acad7a8635148b8c07	22597962	1	极品美女寂寞难耐无毛粉嫩小穴
3ba606bdc145e7e27f903f344069f69aa7e7df72	33231488	1	小热巴超嫩高颜值妹子双女道具自慰炮友啪啪，连体网袜翘屁股骑坐猛操震动棒插入
3bbbabc476cefb450aad3ef43cf82aa9a05476e1	60173440	1	样子清纯的学院嫩模酒店制服大尺度私拍摄影师看着她的逼问她是不是很久没干过
3c2eb0901808a36b7571cbdc7c58c36b8d44b946	2032171276	4	We.Love.2018.JAPANESE.1080p.BluRay.H264.AAC-VXT
3d8a38f2e04f6f0dce39111c2a653da35a867c61	1494651692	35	SHKD669C
3d94f07cd9c3764d45f59e53662aa568ed84e9aa	31732376	1	最新秀人网极品女神嫩模『艾小青』勾引滴滴司机 车内极限挑逗引导摸浪穴车震 带到宾馆接着做爱 高清完整版
3f717a048430e8be9b12b76a03444805735c2863	378914137	1	外贸公司业务经理和老外白天大战操的是真猛 各种姿势猛操这女上位屁股扭的太欢真被操爽了
3fe1a1bf66258b148aac274cded5b0fb1e07d87b	33822524	1	极品丰满小妹妹小哈尼 一多秀 看上去年纪不大 BB超级粉嫩
3f24a57833f7a242692540da1e1a046a617d00d6	50879108	1	颜射朋友的微胖女友，对白超淫荡，全程国语，露脸超级真实
4042e17f8eb3560a55502b2f1f55091a1d764b4b	1256041941	1	宅男打飞机福利性感黑丝外围女兼职女主播给狼友介绍她的自拍小电影
40a340ce786181cf16d650c36eadd849b5ab8b6c	15540016	1	呆哥最新大作-高挑漂亮的22岁在校大学美女鸡巴在后面操着,男友不停发信息问她在哪,大叫：喜欢大叔操我!
40de02fd776887eace1cd91bdd3ffb340080cbcc	51887449	1	农村家庭摄像头破解偸拍夫妻午睡醒来后做爱老公全程没动骚妻仙女坐蜡自己动搞完还要握住鸡巴不放
42261dec02ac40a84c0be830968fdac1ac4c6922	53958398	1	成都车展旁商店露脸抄底来买吃喝的站台的美女裙底风光
4218a7d68248e9c5534f416e1120b9f6f7876e31	61036993	1	混血大眼小仙女舔脚指口交，大屁股一蹲一蹲地男主角贼爽
423f7e169aeea697c7bf819955ccd8b9b3d6079a	32101003	1	《横扫外围圈》渣导小徒猥琐四眼仔约炮逼逼粉嫩的童颜艺校兼职妹高清无水印版
43358140d6e0204f0413fe63ab6a224563d12bad	8350257797	6	iptd-563-C
44e22950d14391fae3611a044dff49342552c561	126455488	12	Lea Porcelain - Choirs to Heaven - 2021
447dd7556b0448d2b7d3c904a2b292593945d062	44943533	1	极品嫩模震撼群P【可甜可咸的模特】将性爱进行到底 群魔乱舞 两混血猛男乱操极品爆乳姐妹淫花
440fdbc859e98e6403b632c4fbf355ada4fd5a65	978854440	3	As nad asy
4414d3a8d2ff01a0a4ed960767e37fc628bb719f	267756449	1	Jessica Jaymes in My Friends Hot Mom (2012)
45442d85ceea9a60c0f40eec36909971040cd50f	50298309	1	最近很火的Twitter知名户外露出网红FSS蜂鸟箱任务全裸从23楼到一楼到指定蜂鸟箱拿自慰棒到小区游乐场自慰
457c649dc6d3343011265fa6988eb243cb34db50	84968195	1	露脸漂亮小骚逼有着一对傲人的巨乳，坐着自慰，随后被男的后入爆操好骚
45c14000fffcd333d327e538d0c2533e47faf6a9	3247633640	3	Manifest.S03E10.Compass.Calibration.1080p.AMZN.WEBRip.DDP5.1.x264-NTb[rarbg]
45e599053219fb459332f51bfe1391943c8548c4	17225781772	26	The Secret Life of the American Teenager 2008 Season 3 Complete 720p AMZN WEBRip x264 [i_c]
46aa70e26a2336c4e3ceeb79871752844751fe57	46403055	1	长屌哥广东洗浴会所800元选秀技术熟练的美女服务操的高潮2次淫叫：你是干我最狠的一个,再也不敢说要第3次了!
46753597d8462d8b9fd617a299ebc04fac152962	70797697	1	大学嫩妹开房自拍被男友粗暴抽插
4615cd0ba45631b7175519df1f30f3454053f799	18585097	1	高颜值气质美女主播收费直播秀 颜值高身材好 激情自慰不要错过
4601ef7be6fb2d8647ec4bf8ffafd22d91419aac	29663654	4	Dr. Farkas Ottóné, Dr. Nagy Géza-Tüzeléstan
478c438d93546233205dc498b457737dda02555a	23023899	1	大神丝雨单独穿着裤子操B作品 情趣裤裤金光闪闪单独和别的男人搞穴 少妇就是会玩
471a476268155ad40cf2d31d4199f25ee27209cb	62113216	1	霸气斗地主网红小美眉和3个老铁玩裸体斗地主输了要被拔毛毛
48dfb7f49451d353675488c5e1b8e4ab974c4e76	838367264	2	3DMGAME-The.Wild.at.Heart-DOGE
4821a47ba74594f54696591c1adb5acecff48eaa	25977859	1	美女主播为涨粉户外勾搭小哥，帮小哥撸 掰开嫩穴供大家品鉴
4928653875a344fb87475d588b7d0bd3d7246386	47663162	1	疫情期间高素质年轻美少妇学人直播家中和老公按照网友要求各种操逼,干的越狠打赏越多,操的美女快站不起来了.国语!
4aabaac1360d50eed74d3d17cd60b2796ed04966	17866924	1	网约了位性感漂亮的韩国美女啪啪,皮肤雪白,活泼开朗,干逼很配合,扶着美臀狠狠后入,叫床声都不一样.
4af120396321c1124c9ea45b89b477ef0705ab97	28477309	1	肥哥高档会所嫖妓偷拍选秀1200元的旗袍女技师一条龙服务这妞口活真好
4ababd071d87f1b8fcd9dfd754c005339b1865c9	56563043	1	老肥出品野外高铁桥下偷情屁股被被蚊子咬的都是包+回到家里继续草
4bb575d976ed73b5c07955acd085b12da36246cb	150980905	3	ALSScan.21.05.22.Payton.Avery.Yogini.XXX.SD.MP4-KLEENEX
4b3a84b6a6b22b765ebea097728783707428f6fd	14021402	1	台湾SWAG爆乳明星『吴梦梦』面试女演员被老板要求亲身示范 无套抽插干的求饶
4c2629593074175dfc9f806c2901b9212d439771	427421595	1	极品身材众多女神级模特大尺度面试高清视频流出 丰臀美乳 不知其中有多少被潜规则高层操过
4c4cdd86b5ecad5d96415a45cb9983241f9203c4	85233456	1	厂里上班多年关系比较暧昧的漂亮美女准备回老家结婚,临行前约我酒店啪啪,看不出来妹子平时腼腆床上真淫荡!
4c67d839301e7b1afc123575d2370fb5bafeabf2	39765764	1	玩逼女王精彩单人秀，自虐狂奶子逼逼都上夹子，道具炮击双插骚逼和菊花，各种蹂躏骚逼表情骚叫声淫荡非常刺激
4d5a1ace24899d8f2ecc9540cac0d92dfe629be9	901008358	4	Leśniczówka (2020) [399-402] [480p] [WEB-DL] [PL] [H1]
4dde53bf985387eba863681731890fc8d58e1af9	73065629	1	骚气少妇双人啪啪秀情趣装蒙上眼 后入抽插大屁股多种姿势换着玩 深喉口交道具插B很是诱惑
4eadf05a63ca83ff3d4060df46b86a551e8fb209	1211196433	29	28
4f160a34b7c2ea9ac8d683e04bf85d420dc2480b	22261290	1	最新极品御姐波霸水母乳优优喷入魅惑私拍 骑乘顶操边干边喷乳汁 爆乳诱惑喷射乳汁 爆乳喷汁 高清720P完整版
4f9769290ab48ed25744619584ce9bdc8baab657	23457499	1	高颜值苗条身材妹子丑曦全裸诱惑秀 扭动屁股呻吟娇喘掰开逼逼还挺嫩
50e1e251805b60d50f8de144bd0dfdc3a77bf085	36970620	1	约了个小主播出来感觉小姑娘有点害羞啊 调戏下还会脸红放不开 好玩
50e734a02abe67085c9bbeb7ff4403a866165d96	26253773	1	最新重磅福利，掀翻韩国娱乐圈的《Bigbang胜利门性丑闻》最新完整版视频终于流出到中国了，大饱眼福来了
51f1506d41dd835f569c16db14be05dd81536005	45847991	1	极品爆乳尤物微博网红美少女你们的小秋秋VIP会员版之我的黄瓜男朋友 揉爆乳 淫双插 高清私拍28P 高清720P版
514a82030c69cbee1de27fd7a3749df3e0bb5cc6	18906729	1	CB站眼镜哥夫妻第2季13女神老婆精油涂身电击打炮被狠干（上）
52a39731849d0f6d43f47c9f3808c41f5fa8bd9d	49917826	1	年轻小学妹非常乖露脸很可爱，床上的温柔，掰开骚逼让我拿电动玩弄阴蒂，高潮喷水抠她骚逼呻吟可射
52c4c86f4ffe5cd70cd43deecdc2b57856bcabb4	59710805	1	露脸制服桶袜女学妹，皮肤白皙颜值很高，口活非常熘，躺在床上任我蹂躏玩耍，非常乖巧听话呻吟不断
54aff4c573ec1874489247de4635247e3c79114e	8406760311	29	CJOD-296
556072df23865c110bdb568789f666d2c867aa40	501465051	1	中年男酒店约了位清纯水嫩的年轻妹子啪啪,肤白貌美,爱不释手,各种体位疯狂爆干,淫叫不断.国语!
55c861629c506b32840557cbca3ecbf4cba5ef56	975476166	1	千人斩星选极品美乳长相甜美衬衣妹子，舌吻揉奶翘起屁股手指插逼，骑乘侧入猛操晃动奶子
58c9d94c740ee2dfccc8d33a82d8b96e32a20623	44578760	1	无套操出差同事 换着姿势操 欲仙欲死
5894626542845f780cd3dd91f474111b56cc542e	5704253440	164	el-zorro
581963b53fcbaba79a8ab8dd60f7405795309736	3597166029	2	Sons.of.Ndrangheta.2019.ITALIAN.1080p.NF.WEBRip.DDP5.1.x264-SymBiOTes
5806e0e1ec791376c0f6a343a48fa27042bc886d	49959724	1	我在约炮学生模样F奶大波妹欠了不少网贷酒店豪华套房卖逼还债一边含着屌一边和闺蜜通电话
58febf05b2b54823e40919072087c348125642c7	71886803	1	微博性感女神美女嫩妹子完具酱空姐制服道具插骚穴
58d7e32ff176d0c260fa9ad80074f5489f21a4ed	683769753	3	Taskmaster.S07E08.720p.WEB.h264-DiRT[TGx]
5938654857c2d9c74da1199ce10ac4d885a8c594	30064835	1	中专生在家自拍
5997626c7f6325718bb7ead149a3cbd07c81d7b7	34709296	1	91沈先生约了个00后汉服萌妹子啪啪穿着衣服足交后入，抬腿抽插搞完休息换上JK装再第二炮
5ac5db23ac0ea3ff268f8f8bff52454c8f13705b	443868253	1	看着很清纯的小女人露脸直播大秀，逼毛很性感这么小的逼玩这么大的鸡巴，插进去就开始叫看着真骚
5a05001fb29b763c21558c8cc81f07c58fd20478	114721484	1	颜值不错漂亮美女主播收费直播秀 自慰插穴 喜欢别错过
5a3a654eb22f17395cb69381fa0b73b8762b7bbc	51186462	1	皮肤白皙妹子牛仔短裤黑丝诱惑 床上跳蛋震动棒自慰呻吟娇喘
5bb44e761106ec5cfa89e694b9ddff7aa1423739	203475588	1	美乳女神版小鸟酱之星奈奈系列 大尺度唯美浴室透明制服 深喉口交玩裹冰屌 原版私拍53P 超清2160P原版
5b2625b3412195c3cc255710088a1d7dace00159	29870356	1	私人定制2000元一部的娜依灵儿剧情挑逗，舞蹈诱惑，自慰流白浆
5b426df8219ef1ae789e1e91ca9c2470e6bba6a2	21235686	6	1959_20210519
