02952d291411bfbef4b31c0fdee2a48e61606b4c	499380339	1	青岛幼儿师范的94学生妹成功约操 ，这个妹子长的嫩，但是性经历很多，操的时候电话还一直响，说是别的炮友约她
073832b3c42e455053533b45022990c0241a2589	249233027	1	酒店迷奸青春痘还未退去的小学妹各种姿势玩弄都搞不醒视频
08e301cddf602b8e2197fab519f108dbd7adb2b4	17184306443	2	SnowRunner by Igruha
0a06bce73d08eb37b2002a5943fb0aea1e02bd7c	71651105	1	超可爱丸子头黑丝小妹妹_和男友操逼吞精，男友的长鸡巴捅到子宫口了，淫荡的小母狗 长大迷死人！
0b687c88a45a5833790ef3f67fe5bafb3ecef2dc	130383159	1	高质量美巨乳特辑-帅哥换场大保健全脱口爆完事后还拍技师的各种淫态
1216571b2f96a27f25a67bbf640487e8bce59c69	2064976759	1	原生态纯真00后小嫩妹，【小杰撩妹】跟男友没羞没臊的同居性生活，粉嫩可口青春气息扑面而来，超清1080P修复版
13c39abe11201f5286bb8efd1848128cb17b8d21	1270941696	17	ATID-102
19d884ebc9cf83dd2db52a508a67ffb58bc11d34	56968600	1	最新流出网红酱mikic与土豪胖粉丝约炮 足交啪啪大尺度完美露脸
1d4f6892072fdcc2a373650d5c48f3484a636080	5387653022	10	Machete Kills (2013) [BluRay 720p X264 MKV][AC3 5.1 Castellano][www.maxitorrent.com]
20db78eccf93ba6d140edc837bbce7c573bd54f6	42136312	1	【91沈先生】金导AV大制作，什么国行桃谷里绘香？野外商城WC啪啪户外车震调教，老金现在有钱开四个轮子了
27cb5b4fa4474e3f9d152514ebf5033d46bc6253	22290729	1	丰满女老师露脸业余时间搞点副业，丝袜情趣大奶子道具自慰骚逼呻吟，躺在床上听狼友指挥揉奶子自慰呻吟
29ec75fab77ea987ffd0544992a1892eca094c1b	35956070	1	私密淫妻群最新福利 个个都是身材正点颜值上佳的辣妹风情万种欠
31c2c3e892d64ea0a2bb2e5e68845b698b3bb24c	8525631978	3	The.Mosquito.Coast.S01.1080p.Kerob
33f50e4f784a5f06473a379c2ace1bbec5e7d13a	40087696	1	偷藏摄像头暗拍韵味少妇洗澡
332ae2227c48cf60ab8717299cad8ea3c0c185fc	33647798	1	长腿新人辣模『Yuri』高颜值110公分长腿诱惑 敏感嫩穴无套中出高潮抽搐
36656e677c6e2278c9cca786df3d58feea716a8e	26346831	1	颜值不错现代金莲直播大秀 身材也好 激情自慰
394dc86675a1e72d5113b88176716734f6d12e58	35858993	1	居家夫妻造爱直播,空气刘海小少妇很有味道,吃J8吃了一嘴毛
3cf8473ee1a9b0fd0b39149b2698ad500d0fde61	2068476539	1	HHKL-011
48acc3400ef32911477e8959973b9c4a2619a537	841167178	4	Lady.Sonia.14.05.17.Red.The.MILF.Pussy.Stretcher.XXX.720p.MP4.OHRLY
4ef0045fedd5a01d11656d5d8ddbe3302141e721	34122626	1	夫妻健身室啪啪开播,躺在健身凳上插入跳蛋,爽的情不自禁双腿发抖,喷不少水
56165c387dcb9dfe69016e9e03625de3d2cded8e	24618857	1	高颜值主播洗澡艳舞勾引啪黑丝自扣妩媚妖娆
56f6e92713e0fa0ee75a6bfdf525306e18b87095	33958971	1	颜值不错骚气妹子各种道具自慰，荔枝胡萝卜高跟鞋炮击轮流换着玩，双洞齐插滴风油精非常淫荡
57f1aabcf08202d6fea6769c47fd1fc6d01df4e6	363463614	1	最新流出家庭摄像头偷拍小情侣沙发上变着花样超多姿势操逼
597420b3b48ebb24ec7213ed77983d9c8b3f9a9f	24918121	1	极品清纯主播【思思不约】童颜巨乳，收费房大尺度洗澡，大黑牛自慰秀，让你看看仙女是如何洗澡自慰的！
61076fe76465f0b5eabb10cb00a3a25bb517ce2c	7038479875	3	A.Stranger.In.Paradise.2013.1080p.BluRay.x264-SONiDO
655207df8f3ca349b054ad59c0c97f91ec937bf7	27787447	1	北京约炮长发苗条小美女口交爆草再内射 挺和谐小骚货坐在上面动还问“我的力道还好吧”
6e033ac7422c568f3245581c6fca85256553c1f0	26326867	1	探花创新走向国际【日本男优探花】现场直击东京热知名男优爆操漂亮女优 国产帅哥乱入3P轮操 高清源码录制
7bc05714227ec287adaf79db79bdd8eb0534bf23	48156921	1	带哥们的骚货老婆偷情开房 抱美臀使劲干 爆操抽插 操的白浆沾满逼
818ebe272dac0f8ebad0d28e97895778df4d4287	44796466	1	微博网络红人少女鱼丸要吃素面 黑色性感小蕾丝内衣裤掰穴露出 胸不算大却很挺 最养眼的身材之一
831b08744053cd61b66aeb403515b95c4e8a34bf	37070667	1	【自购情侣私拍流出】酒店内小情侣激情啪啪，自慰鲍鱼出了好多淫水，身材极品平时都在健身，大鸡巴高频率冲刺得爽翻了，高清720P
862c5f6dd7954ddcb8e22a8c2dce4807cd294e44	82864739	8	Godhead Lizard - 2021 - V838
86f09a3c18a10ce428ee91f02589972cb00c2090	5170739398	6	MXGS1179
904534c546e842b5ee2d56b8af66ab1a4ba453ce	48092818	1	极品人妻在家里偷人尻逼，谁知道老公偷偷在客厅安了个监控，这下呈现出了老婆的淫荡
95c8ecb2bb8f0d2cb004737c1a7622fce25dc8e5	67028315	1	亲妹妹的98年闺蜜，穿着丝袜高跟给我操，身材一级棒，丝袜没脱叫着要大鸡巴插，被搞喷水，高颜值
99ddb7af1c3cc640ec8061afe07164710dea3da2	41902400	1	勾搭酒店里的服务员，躺床上扒光玩她骚逼激情口交活很不错，性起了非常主动上位抽插，后入干她骚屁股浪叫
a6c09adc459e295f3dc814b5fb36334cc2767606	1679305095	1	超可爱少女〖酸猫妹妹〗最新作品绳缚调教 全裸捆绑各式玩具速插浪穴 淫叫潮喷 高清私拍86P 高清1080P版
a72c2f9e3e0d5c82a3be4a49e80e0eea1f6c2926	53475988	1	东莞某高级酒店床战95年技术了得的湖南美女,据说平时想点她钟都要排队,连续搞了她2炮,战斗力真强!
a94119fbda7b982c89520380821e4422502d6b99	36304210	1	裤子还没来得及脱就让我操
b5779f8b7df8b985061cb27f8dd801e668f6331a	26790605	1	性感长腿妹子连体开裆网袜自慰秀 穿着红色高跟鞋床上各种姿势摆弄自摸
b5261f39ea23d4bc26902edfffa5e309fa9aaf65	301117913	28	Al Stewart - Year Of The Cat (1976) 45th Anniversary 3-CD Deluxe Edition (2021) 320Kbps #DrBN
b8bc8f45fd8a0dd4c5bb08dca01c55a46df28668	39297319	1	射了好多哦别动 初恋哥VS E罩杯的大胸湖师大艺术系花逼逼嫩的想让人吹一下 那对馒头发育得真让人无语 720P无水印
bcdf1103034de38966b15596601dc7f6806fefca	28536099437	9	Mayans.M.C.s03.HD1080p.WEBRip.Rus.BaibaKo.tv
c3df36db453752f5571e85e0c8669d1a8ca68d6c	22623979	1	台湾美少女『萌儿』情趣口交教学私拍流出 制服美乳女神跪舔J8 舔玩奶油大屌
c50eb7a7f24c728659e3de2480e233798950100f	170491221	2	Dynaglide 91-05 Repair Manuals
cc61418b3f2825d0d6bf176c2cd7ce84ae11b3a1	13631282	1	壹屌探花深夜场太子上场约了个苗条长腿妹子啪啪，后入撞击上位骑坐单腿站立抽插猛
cf7bf0cb75ec44eab47b8cda5c2d75d000206e1a	158222919	1	商场里跟拍修长腿齐逼裙粉高跟白领尤物,蕾丝透明内全裹到屁股沟里了
d97f3de93e8a476bbd8b0842f4dcb59d89539963	24932792	1	极品女神『前台颜值小sao货』上班桌下偷摸+卫生间大秀
da610d82b38d1c9216aa6b8b8cf0e2451b0296fe	189212188145	231	Farscape (1999) S01-S04 + The Peacekeeper Wars + Extras (1080p BluRay x265 HEVC 10bit AAC 5.1 Vertag)
dffc0fcdc7b8acef1cddb3b14c998c28bde9e9ec	186662303	1	黑超大屌猛男留学生A1D先生与X大漂亮女伴读性爱私拍流出 落地窗前疯狂爆操 无套虐插粉穴内射 高清1080P原版无水印
e2e0fcadb31590ac4f2933813cceb0bc378c5083	625532023	1	深圳高中小嫩妹假期在家睡房中果聊直播,小嫩穴粉嘟嘟的,超可爱
e8b7434be02b1039de030b98dea4cd81b7f16c49	86894624	1	土豪有钱挥霍重金约战高颜值外围美少女奶大腰细臀肥亮点是呻吟声超诱人又嗲又骚还玩COS扮演各种爆操撸点很高
ef198b9b34a254cb1c91d04be08f44ca33a7cfaf	26935082	1	神山满月高颜值气质美女全裸自摸诱惑，带上面罩脱光揉奶近距离特写摩擦阴蒂
f0a9b5689bfe3948e236de8d8bf070d385068ce3	29538443	1	年轻粉嫩小萝莉直播大秀 木耳十分粉嫩
f1f75ccdbea62868fcae6fa4f3b9beb60971f19c	35191553	1	最新众筹高价购得推女郎嫩模艾栗栗疯狂5P乱操内部流出 轮操骚逼 淫荡浪叫 近景冲击篇 高清720P原版无水印
f2c23b0fb803bc450e0f8eca564bf393193567a2	41444229	1	蓝颜你就像第二个我收费大秀 颜值不错身材也好
f3793577d5a543128d263c65a4d2f3f6a2669a9e	39876491	1	窗外TP隔壁出租房小美眉洗香香 拍的好辛苦不停变换 这身材这颜值没说的 天然美乳 值了
f4011ade9a6fe64e4ae791a469e2c221e03f071f	50331712	1	苗条大奶风尘骚女出租房迎战大洋屌胸毛猛男暴力深喉干呕大肉棒肏的嗷嗷大叫都翻白眼要休克了1080P原版
f6409f51c692cf42e0b61794c8069b57368510cd	28175731	1	Ktv疯狂的3p事件太精彩了，三十多岁的少妇被3男按在沙发抽插淫穴，一大哥还在旁边唱歌
f958e313c2a718f84a62e4f244ae9a02510c6123	31624452	1	美女主播精品梦雪9.2一多大秀 舌头很诱人 自慰棒插穴自慰 很是淫荡
fcdbcee784ce550a6b913b856ed18e0d8c238a99	62538479	1	酒店公寓网约上门服务小姐姐属于耐操败火型的颜值一般般但一对超级吊钟八字大奶很给力狠狠肏看着大奶乱抖很刺激
