019da09f161e94b9b26da3bb47726b77817a1cc9	42373336	1	〖勾搭那些事〗勾引按摩技师应聘女郎 上岗之前先验验工作能力和服务质量 活儿不错 逼紧直接内射粉穴 高清源码录制
02ccc60a5f4d1685947d3d963d9365ef75e40309	320133900	19	(2021) Peter Frampton Band - Peter Frampton Forgets the Words [FLAC]
0257805f02548bbf73eb7efd2ab68282ca2e500f	80663950	1	小骚妇饥渴难耐居家自慰，不料被快递小哥发现，镜子窗户前一顿羞辱,操的一直叫爸爸,，射胸
0280081d908c6ba49236f1209b73c77626eb0e73	16009489	1	高颜值美女主播收费直播大秀 身材也不错 自慰插穴
021a3d71497d8535c663e88ac1e676b4ee0106ab	510650466	4	Inside.No.9.S06E01.Wuthering.Heist.720p.HDTV.x264-KETTLE[rarbg]
024406654e4a6a137e66c191acdb908cdb8900b5	12657444	1	珍藏—电脑肉鸡偷开摄像头远程私密录象第16部-露脸夫妻做爱口交，真实性生活大曝光
0301f499aa3126bd159dde30ced9ae9a5b6dcc76	122924780	1	【真实灌醉】【国内精品原创】美女姐姐被灌醉后脱衣服翻眼死猪般随意把玩
03496ba943ab3735ae9b0d0ba0f2b0ca2ac25ec0	43116968	1	91大奶控佛爷最新作品人瘦奶大的学妹第三次约炮 妹子的身材绝对是极品，狼友战斗力不错 干到叫不出声
04bcda60d7705bf82cc3089914787827e309d851	32733440	1	不老女神网红主播美女瞳孔大胆约粉丝网友回家直播啪啪,操得兴奋说：我的老公很厉害
04ca08c0601bc80fe60034530158f811500ae7d3	34923165	1	出差 操的00后童颜巨臀 喜欢后入 完整版
059208a2e0022037a808765342e77aa445a9e221	34160390	1	91呆哥系列022-宾馆双飞姐妹花其中一个来月经了高清无水版
05c5fc29197517ca36c274b27137ef6168ce22f6	56449034	1	好淫荡的小骚逼，穿着高跟鞋，开档的情趣内衣，各种花招操，好骚
0878b33d5ce48dc737ea24b95dcf41408a6a9971	612372292	1	最新泄密《高质量美女自拍之护士裸拍给男友剃毛啪啪+情侣日常道具啪啪》年龄很小的妹子被男友跳蛋玩弄，大尺度拍逼
09a05fb47d2db18ed849b80b6a28e90b6b4b34be	47775404	1	【东京男优探花】极品女神 两男两女4P大乱斗 粉嫩软萌娇喘动听
09577f06840a2cebab99f14cefcb38291d5b03f4	40808061	1	完美身材巨乳健身妹子漏奶漏逼 难得极品美乳又大又圆绳子摩擦逼逼 很是诱惑不要错过
0a10ae2f75b255050db75606604b267e893d3597	24316162	1	丰满白嫩38G吊瓜奶主播 如果能草一次能爽一年
0c89e68e2dac9a3adbb807158f885c94a770d264	12841786	1	邻居家两姐妹洗澡被我全拍下,好白嫩的玉体,真乃人间珍品,附学校照片
0f8bd429087647cbaf6d8efbbc36127d07494782	43526030	1	富家公子哥有钱喜好特殊恋丝癖星级酒店约啪学院派极品女神学生妹肉丝足交小穴一摸就出水插入激情啪啪啪
10e33692f342f18832f96c1dc69697736a138ebd	36412203	1	漂亮眼镜校花 为赚钱直播自慰 小穴嫩嫩的很可口 淫水多到都拉丝了
1106d80bf73d131507094a0d2ab7d480cb05f520	23279332	1	高颜值气质美女主播 穿着学生制服 一多自慰大秀
1394f11d7098b03877a3aff09c54acd9f61a2153	5016136313	13	iZombie Season 1 Ep. 1-6 1080p HDTV
14969d4151a28fa14aed9f610da55e6e18b456b5	409706648	1	网红丝袜女神小魔女大尺度私拍啪啪视频合集第一弹
19990b4661e602303c56fa816a49ff8ff0f2f2d4	19253696	1	扶贫站街女胖表弟路边按摩找了韩国脸孔美女打飞机热身再到另一家有啪啪服务的按摩店玩双飞
1a6669d5be79fe44bbe94899ea684b266826c5bf	25981276	1	年轻小夫妻 在家里啪啪大秀 先把跳蛋放在逼逼里 炮友帮忙自慰 口交 各种姿势操逼大秀 非常精彩
1d787c56cc7a25b4033c38131443a61310489e88	47040457	1	极品御姐AVO女神天生尤物完美身材 爆裂黑丝高跟 极品骚货卫生间勾引激情啪啪 连操两炮内射 高清源码录制
1d6fa628d4aca597d9cc0ce04b632c2dae97adab	1103572045	3	Trashy.Lady.1985.720p.BluRay.H264.AAC-RARBG
1ed4ebd37f77a3ec9ba0f4982f03cac59eb21782	71260363	1	极品洛丽塔眼睛妹兔牙喵喵全套VIP套图视频流出
1e569dad2007929083272abe10cd35ee5b92819b	39523121	1	超卡哇伊网红美少女三寸萝莉之浴缸女仆 假鸡巴快速抽插粉嫩浪穴 淫水白浆流 高潮呻吟 高清1080P原版无水印
22850be82eca6a2ad75c7361f33178a2a69d1587	74561524	1	网红萝莉柚木最新作品 首爆性爱私拍
222d30ab867218b13865fd58fb76e7a828885f8e	618806546	1	91沈先生第二场约了个非常廋妹子，洗完澡口交骑坐抽插后入猛操，搞完按摩一番踩背
2435a1b905356c0dece7bfe945489f1ba8edc451	22746209	1	【步宾探花】3000网约高端外围小姐姐，甜美温柔沙发啪啪全程偷拍直播，风情万种淫荡尤物，高清源码录制
27b2bfac99a2e5fe5af7e047b54de7791ba0517c	114371187	1	小学妹无内肉丝捆绑调教高潮失禁喷水,好此口的绝对不能错过
28811be2cbbef2a744666e7d954dbad6ccc21bfb	435803197	4	The.Good.Doctor.S04E16.WEBRip.x264-ION10
2ae165db5f2df113e32fbae270d766afe4859b51	25853117	1	韩国演艺圈卖淫偷拍悲惨事件 Vol.01 超漂亮的美女
2bc0df771128ff1b4893b9006a06c173a0478613	839071792	14	30 风月寻欢约了个颜值不错蓝衣妹子啪啪，性感吊带网袜跪着口交大力抽插猛操
2cec38f09ac555efadffdbfbf7a2c50fc6813994	715382982	1	长相清纯的女大学生唯美小可爱露脸洗澡秀，身材不错奶子有点小腿很长，一边洗澡一边不忘陪哥哥们聊天
2d966ac8aa29c1056a56708aa57979e56600756b	32934519	1	跟风骚的表嫂出来偷情，车上就脱了激情深喉口交大鸡巴水多的骚逼无套插入，车上干了树林干就喜欢玩刺激的
2feba362a5f7cee117b56b4fbfc20840ea15760c	30009482	1	声音好听身材不错台湾大奶美女第三季 漏奶漏逼自摸美乳肥逼
30924836b36d671985c37ee1d79eed2a1bea66fa	31914188	1	猥琐小哥宾馆与白肤人妻风骚美少妇偷情还没干呢J8就硬梆梆了女上位翘臀前后运动扭的太性感了
314cc0ae655e6b963f4a9c8019a4f5714d5bf9a1	38559571	1	午夜探花 气质漂亮的极品大奶平面模特被大鸡巴多姿势爆草
32b5c707bc56e0c0d6cde6ecee743f63e8119ae0	31182353	1	国内夫妻宾馆玩3P 肛交 高清 全程普通话
34d8b0f602cec05e542f737b4e78e1c8a6abc0ea	36447839	1	颜值不错肉肉身材【咪咪蜜蜜】大奶妹，揉搓奶子特写掰穴无毛肥逼手指扣弄
3502405e78217e1d76ec1722f74bc46d70b7bf42	35977137	1	美女的身材很好很给力丰满肉多看了就要硬想搞作品《性欲的邂逅高清版》激情佳作 紧身衣丝袜高跟冲动操啊
39ec9109b210f8213ee3c85c16cc300e60891b48	28708877	1	【千寻探花魁】约操兼职少妇，良家初下海没有风尘味，白皙温柔口活技术过硬
390cf5d61a74408dab8b86293bf7bb379342269b	976984338	1	高颜值大白美乳白虎妹子单人道具自慰 全裸椅子上手指扣逼跳蛋震动塞入呻吟
3a67b2db63a050748a42bb26d97e0e85d9c521d1	37077340	1	【全国探花】再约颜值不错粉衣妹子，调情一番口交大力猛操非常诱人
3b7eed30c3790474b7b7db4bc0f3a04c3cff18e0	887847158	3	Those.Who.Wish.Me.Dead.2021.HDCAM.850MB.x264-SUNSCREEN[TGx]
3cff48c5a2c02a6b59df1841aa9c505b5207c5cd	363345821	1	丝袜风骚少妇被我按到床上狠操 女猪脚腿型很漂亮，难忘的是那一声声的低吟 这女的干的爽呀，声音很大
3d4af6e16be739d25bd091cd710d0489a2c64107	41395798	1	超淫荡制服御姐家庭父女乱伦骚浪小贱人勾引干爹沙发上激情三飞无套换着肏谁也不闲着干爹J8要废的节奏
3d9e8efe97314808c4113f2b1c91bfc86c44ee07	33939998	1	清纯漂亮小萝莉新人双人啪啪秀 穿着制服口交啪啪
3d95ce25d8e9d959388fed4fe6bd383b5bf0ddef	516885909	37	Joey Long - Collection [WEB-flac]
3ff4e21b02264bb6a013d7e009ea9ad9de487de4	15076335	1	最近很火的家庭摄像头,来自VN的30岁少妇风情,最全收集47V
458b674b668ba2fe5b7d03994040eb072b257457	70237136	1	露脸嫩妹口交，表情真骚，乳房嫩嫩的
462be06c6bed90909df6c8dce279fb3fd00ed72a	85223001	1	邓晶(S+T)大尺度无水印精品私拍套图加视频
46843306aeeca2596826e247fc65e0de340cd5be	30102016	1	【手机直播精品福利】女神级主播【阿姨洗铁路2】露脸极品大奶子漏出，完美翘臀极品诱惑
47631b1678126b769c65371229eceb98c6916c32	41117980	1	私藏裸贷系列30：裸条借贷钟海月
48db9d51039be3c02a8ae8c455be23e9a73a50ba	23316827	1	颜值还可以的白嫩主播出脸与炮友直播做爱吹箫一流有小姐潜质还是一个无毛逼无套干一会舔一会体位还多对白淫荡
4a8d64e7d55972e439aabfad3184221cf5eba7ce	1381376727	1	超美巨乳主播黛蜜儿 在泳池随机色诱路人 上钩之后直接去酒店直播交配
4b6fb56a6490b5e895619d02bfc990840bcd4b94	33546914	1	师范大学漂亮女友拿嘴当逼洞插到爆,插得妹一直干呕
4d927169c3a49bd5c94b7ef132b6279b711dcf5f	24484671	1	极品骚女晚上打野炮，先口交在啪
4f589266510bedd175b3b134ec0734646ca3df40	317861448	2	【剧情之王】约操金发情趣黑丝外围美女服务真不错口活一级棒浪穴菊花全操干的直翻白眼高清10
519bba80f32bb39190695913264e3cb69831f999	51300097	1	洛丽塔人前露出系列第六部 把维修工大叔叫到家里当面玩跳蛋
52e88d7e21fc384634438b5e746a42b18da749db	273416254	10	TVBOXNOW ViuTV 擊戰
5422248d92af1bc1d0d830ea34b2a0db7634b495	19022987	1	星星丫头 新人高颜值的恩爱小夫妻 全裸 口交添B 操B大秀 身材很棒
543ae45b9ab0b49d09368818013cf5fd29e1a69c	20981799	1	广东哥疫情期间压抑太久冒险酒店2500元网约颜值一流性感的年轻美女发泄,操太猛,女说：你太厉害了,早知就不来了!
58c4c267fb28ca800ecaa12a8b939ed4d8e03545	28488051	1	一对情侣主播 激情口交啪啪大秀
583a600364c438052896c88dc9e3a8ea1a2b3fa0	26243801	1	非常粉嫩没怎么开发嫩妹子道具自慰 苗条身材全裸椅子上跳蛋震动逼逼非常诱人
5be5aa9aec686e013a94e3e3fa09b9e99b857197	28492200	1	很是漂亮的美女主播凛音灬一多自慰大秀 穿着情趣内衣揉穴自慰很诱人
5e8830850746ba8596c8722b6bdf55dbc14d1021	67797072	1	【AI唯美画风滤镜】超高颜值兔美眉大尺度性爱私拍流出 极品粉嫩美乳 白虎嫩穴激战爆操 无套爆操射一身 高清720P版
60899c164136f42cbb975ef639b42ffa29ea4ded	63601569	1	最新网红美少女『恶犬』大尺度唯美VIP版-毛衣刮毛 完美身材 极品粉穴嫩鲍好想操她 原版私拍29P 高清720P版
621ebb1a6eb72e1294b09dfca22630d8c9f04102	448361687	5	9-1-1.Lone.Star.S02E12.WEBRip.x264-ION10
63cb0738320af2557149ec856301b187a2054719	19937132	1	漂亮小姐姐 全裸洗澡发骚诱惑 极品身材 超可爱
6425be127306fef70e620e8200451f5270e7ca13	47097547	1	苗条妖艳美少妇啪啪,男友干多了,口了半天还软趴趴的,估计喂不饱这臊货
66672a68181f6ba0359d9b7ee172a7c34f88bdd3	28806172	1	91康先生约网友深圳酒店干97年刚破处的嫩妹,美女害羞不同意3P说：你让他进厕所,不要,好痛啊！你不要拿手机拍!2个人轮流操了她！
680fcf75928cb598941ed7ca923e88e8fa4cd998	22446365	1	破解监控，睡大厅的男人，漂亮情妇主动送怀上抱，情妇饥渴如荒泉，屡翻骑乘到男人上面翻云覆雨，舌吻，女人三十如豺狼 饥渴得要命！
6ad2f99675dd0cd27ba97740290ab43d289cafbd	411720833	1	男孩鸡巴不好使只好用酒瓶帮漂亮长发女友解决，浪费个好逼
6afa1a1b795ff6972a59f5e64f1e8b482d603dd6	35699803	1	面白唇红一看就是个美人 粗长震动棒插逼自慰
6b8a01e0f16fcd041b7afbc6e35ad7d9d8b5e852	46150349	1	我的绝世极品粉鲍小女友，夹的我鸡巴好舒服！
6c5cdf0abcc3243293ad129af230ff6bc2684800	27975379	1	皮肤白嫩的双马尾极品骚妹子小黄瓜插穴，妹子人超可爱小肉瓣也挺粉
6c25a60f4542fcbd20fabbd49b3c73738647e62a	278333311	6	表哥不在勾搭嫂子，全程露脸颜值很高，69玩弄深喉口交，被小哥舔的神魂颠倒，各种体位被小哥蹂躏抽插爆草
70ba316a22f5181f6e5402c90051c005a92c79e5	1914588408	3	Taboo.III.1984.1080p.BluRay.H264.AAC-RARBG
71afa5cab6c18bd992e95a5dc10e64d3d3ba9ecf	16299500885	2	Vaiana.2016.PLDUB.DUAL.2160p.UHD.BluRay.x265-FLAME
75289b15b2776d286a0fc46a58a406f6eda4aae3	62688570	1	KK哥 土豪大神2000元包下总统套房大战94年168CM极品黑丝气质网红女神主播,风骚无比,高潮叫床声真好听,不停爆操!
764b1e4f9d74c8800df924d8d561fa3bb75021d7	26922210	1	风骚漂亮姐妹花 一起双人直播大秀 揉奶插穴自慰
7772f171e8df73d2b6ea33865ae0e16db0e4575a	32989105	1	拆二代强哥豪宅用大鸡巴啪啪黑丝酒吧啤酒妹720P高清无水印
7984fb40c142c097d538dfbc54c44ad469195890	82408273	1	小情侣太大胆了，超市家具城随地随时就掏出性器官搞，这对美乳简直不能再美了 全身的皮肤都是我喜欢的，艹射嘴里！
7b106e34b9ccaf677c544887903a41eb54358b63	72699495	1	火爆网红美女软萌萝莉小仙之SS猫耳白网袜 丁裤小炮机振动嗨上天 流出好多白浆 喷水到桌上 高清720P豪华版
808fc188c1057a27a6410f35446c1bcbc6250130	68506409	1	【真实MJ作品】26岁未婚水嫩大姨子被下药迷玩，抠逼吸奶插入时有反应反抗，贵在真实，1080P完整版，附图47P
80d4631da7742bbb3e093b10ab87405ea0c203b3	27226148	1	最新流出〖私人会所女技师〗男人天堂专享 黑丝女技师超绝口技 吹拉弹唱推油大保健一条龙服务 高清源码录制
821084874511a83af9eba954fcc6833c4a1d6c6b	386188492	1	最新价值258元恋足届着名团队私人订制作品-粉色指甲女仆装小姐姐裸足足交玩到射
833f2e07096ac584ca7239d1b86811e199a0c2f4	39254909	1	城中村巷内足浴按摩小店在会所干过的美女技师出来单干服务一流这全套看着是真爽死人居然还是无毛的小BB很有撸点
86be4243e0c66d2135888d838aa7f9cd5c357a17	23104761	1	骚货少妇主播 户外和大肚子男人车震 女上位 后入操逼 在车外面啪啪了一会 非常精彩
86323835081e5b7e4794db41314b4297ab7b7c9b	337176841	1	最新高质量美巨乳特辑-极品大奶牛女技师口爆出精
89314ecfacabe610d337900c2dade5382c237676	446101073	1	【雀儿满天飞】今晚约了两个高质量妹子一起玩双飞，边口交边摸奶骑乘操完一个再换另一个
8c2dc5e73b779bb85545a20fa6ade29799ca4c0e	471714285	1	生活不易居家小夫妻婚后卧室卖力造爱值播兼职赚奶粉钱,胖妞还在哺乳期
8e0a80e87de2dc0487a1eb488360e3966636c831	18162322	1	颜值不错美女主播蓝莓酱酱直播大秀 木耳粉嫩 自慰口交啪啪
8f25260da02248149c9414682ba5606b103a4724	87468269	1	极品网红小萝莉【桃小沫沫酱】白皙稚嫩胴体白虎一线天，铃铛夹逼震动棒淫液泛滥如饥似渴90P2V1
9038613dc7d6b11885d370b6f19d80277426b1f5	37353831	1	丰满大奶主播和炮友双人啪啪大秀 口交啪啪 然后洗澡
91276519d24356707cbf29b5eddf39abd3b1b620	17168278	1	【千人斩探花】约了个粉衣黑裙萌妹子，镜头前掰穴特写口交骑乘抱起来猛操
9468d439b4c866b0249203edb087f8a770a1e81b	16312564	1	帅小伙网约36F极品美乳白嫩性感美女,沙发上各种玩弄嫩穴后疯狂操逼,敢玩一次美女还没休息过来又狠狠爆插.国语!
989162a926528db780e8ff517e06472df11b8203	1485197690	1	极品骚货主播【贝贝】三女露出道具玩逼
9a92bc4ed0d0d28e5bdcc2a103c740995de39e00	17739279	1	青春的肉体-还在慢慢长大
9ce3afd58eb11c9a3cad870931db63cb504c5410	322172302	1	美女主播黑丝美脚撩骚诱惑狼友
9cf5a632a4f6bf08652412c8bbd30c0e66cdb67d	1513404659	21	Bob Dylan - Tempest (2012) [Vinyl]
9da7a50388ff13a9e5f72b27bbdfc332b05564e5	16288896	1	约操美容院超棒身材极品骚浪老板娘 操的太爽白浆肆溢 老板娘上位超带劲 各式姿势随便操 娇喘呻吟我给满分
9f3578da8f4167f2286b1e5516a6e79fb47f327e	2012507	2	A Master of Djinn by P Djèlí Clark EPUB
a0adfcbe5f3cf9f229978506ec17d44c1076e60a	33112086	1	少妇主播超粗电动炮机快速抽插淫B,不过瘾接着炮击插屁眼，这菊花承载能力真强
a3a2c1a2635d89b464df136ba683b727e70b39f5	49272997	1	91有钱大神重金约啪极品高素质外围女神白肤娇嫩典雅穿着连衣裙被啪啪啪床上干到洗手间娇喘呻吟口活一级棒
a7cd789b711bb08ada9b8e70cb895bc126866668	38470747	1	酷似X女星的美女与男友性爱视频流出 值得下手一看
ab62fdd20138a48c6942c2fdac610712a485e250	52514023	1	双阴道的板凳新人扎着两个辫子萌妹子自慰，黑色网袜展示双阴道跳蛋假吊抽插
ac8426658de7488dbea278148fd79d7e30c8cd5b	768629225	69	kpxvs.com-STP20069
ad11c4578357f6f073c77a4f63c29f761c9ec678	357452903	2	SexMex.21.05.10.Teresa.Ferrer.Double.Penetration.XXX.720p.WEB.x264-GalaXXXy[XvX]
ad9a15d260ce7f2dcfdb17e965df23b53132ffa0	47731333	1	新人漂亮美女嫩妹主播阿花酱 一多自慰大秀 身材高挑自慰抠穴很是诱人
afd77634430154ef0245de1b47c2f5822da189da	23402761	1	知名推特博主【小艾老师】大尺度性爱私拍流出 极品淫荡小母狗 肆意调教 三穴全开随便操 高清私拍71P 高清720P原版
b00b63f1ebdd60c68987e9f385a56bf28c1ea08f	88104958	1	嫩模瑶瑶最新贺岁自拍梦幻海滩 唯美自慰潮喷写真红樱桃720高清无水印原版
b1a4b9685a0cde48ce35f553e07dd2d4da50f375	37826955	1	最新流出留学生『苏琪』极度发骚双洞全开 有肉感的妹子果然后入才是最爽的姿势
b1f7a94d530336dc3cff8fa88ffcdfc9614402ed	14657482	1	酒店的上帝视角！上了年纪的大叔够厉害的竟然能搞三炮，草一半不知咋回事说疼估记这妹子是饱了
b3f83ff24c8c539d3169a92e7539383cad8cbd40	53249410	1	推特绿帽大神YQ-K贡献自己的老婆 找来几个单男酒店爆操骚逼媳妇，老公在一旁拍摄
b412bc723eef251f953c869b8247830aa581e915	27271210	1	颜值不错美女主播爱夜直播大秀 身材也不错 激情自慰
b4cd6223f085d46c58139035094a3f4b0a9fbc99	10020861	1	小哥第三次约啪女神级高挑性感气质大美女啪啪,性感情趣服艳舞表演,抠逼,口交,侧入,后插,各种狂干.国语!
b5189cd26e05b11ac96cd480482656281fa95f8d	60446305	1	【人间水蜜桃鸭】姐姐天天特寂寞 大黑牛和胶皮鸡 解决寂寞就开心 哗哗流水很舒服
b5a86c409f57d87cd4623abfbeb386e449f224bd	488674006	1	身材苗条 大红唇子美女主播 床上道具插逼自慰秀 假JJ骑乘 跳蛋塞进逼自慰 震动阴蒂 非常诱人
b839694d2ea23c780ba0bd38fb746bd429834cb5	1028662142	1	高颜值长相甜美妹子九儿自慰秀 按摩器震动逼逼高潮出水呻吟娇喘诱人 很是诱惑
b9ba0f6bcb0f3840bd2b992697b95c8bc60449c5	38308093	1	高收费王牌女主播精品兔子露脸一多大秀，情趣内衣诱惑，奶子漂亮逼很肥，淫语互动狼友呻吟让你射第三弹
c1d52806da91b7493aee48433c023c9e17088271	33320891	1	这对狗男女真会玩情趣古装浴盆尻逼后再去床上接着尻，尻的女的直喊爹 尻死我 干我
c23456123aedd0f34debd786169cc936070cddfc	4644562944	14	Rock For Asia - Das Charity-Konzert Open Air 2005 (2006)
c431afb7d23858c2f7e9d4cd4f86b2e0aaf92d7f	47868206	1	苗条身材红色内衣口罩妹子自摸秀 慢慢脱光道具JJ摩擦逼逼呻吟娇喘 很是诱惑不要错过
c56fd79b29b3a0e433a59140e3078755f761a501	48741057	1	台湾SWAG明星『邦妮』与群众演员路人甲试镜动作片各种姿势口爆颜射非常淫骚
c99f0d65a59fb150579bcbb487a48429f9b43b5b	45007650	1	妹子在37分10秒开始来高潮，我好了要来了，两手疯狂抓被单脚趾紧缩，高潮后身体颤抖
cbdfc93d459af2b1bed975df791521e41310900c	3111112844	3	HD_MUDR-147
cff62d9e2b56e6e6de6b9250b5f43875d2da7787	42161129	1	极品00后大胸小母狗与男友做爱自拍流出
d253e87e43f812c7101ad39b46a61f81eaf3f9b5	26427049	1	人间水蜜桃高颜值妖艳妹子道具自慰，豹纹内衣拨开丁字裤假吊抽插粉穴
d3fe891252cf1f20b8c0f0aaec75a92aadbcc678	224143723	1	小鸟酱
d478115d9cf4a3c12d5de6c56dfbb861cebea94b	17776362	1	旅游景区的极品母女天天拉游客来住宿附加服务就是免费和驴友尻逼上床，女儿的身材真是魔鬼
d6af0db7f3566e357443af32e97eca851ba501af	57737610	1	91沈先生约了个妹子吃饱喝足开干，穿情趣女仆装近距离特写肥逼口交猛操
d7c1741d7f5d1b3bafc23403d63c96c4f66d82f6	37047068	1	『vivibabe』巨乳女神露脸露点内射视频外流看她的面部表情洋溢着痛而快乐着
ddee03b90a4c5b16e1e999b24f0c4d5dbe95785b	551326462	1	模仿内裤哥找个小姐回家穿着丝袜高跟制服在沙发床上玩几百块的货色身材样貌稍逊
df5e0cfbd3b9aef0c0c1cedacd249f86e47141b2	30119779	1	和网上认识的夫妻在4星酒店壹起子 陶醉的叫声好诱人
e4097843cfcbe0acda666ad358659b36c4317913	25164828	1	颜值不错美少妇双女自慰 性感黑丝大黑牛震动手指快速抠逼高潮喷水浴室洗澡
e5cd3207b3a522a484460726b7acb38220a79897	35322730	1	平台最狠大姐没有之一，全程露脸各种玩逼，鸡蛋香烟高跟鞋，道具双插都是大家伙，拳交无所不能不要错过
e6db635d18e08f127c0aa8d31b1379230d13d95d	1920522292	6	051021-001-carib
e8f23d56c7ad2e1fd8dc9e4e7d7c1b4fa88d411c	102921415	1	Video Copilot Element 3d 1 6 Win 32 64 Bit
eae506310d5701e0b1e918f37b3ace0229f6da41	24555290	1	98年性感美女在某豪华网吧勾引外卖小哥到厕所啪啪,门忘保险了刚准备干被人看见,吓得2人偷到杂物房操!国语
ea7399f2e14ace643a56b768bf35b72d2d380db4	45168159	1	3p大电影,真实经历.与朋友把刚结婚2个月的漂亮老婆一前一后狠狠操到高潮
ec21da1e787f42fbf1843918069d5924ec2aa8e5	67360422	1	P站专搞亚裔女生的黑人up主『SirBAO』爆干娇羞嫩白小妹 口交毒龙很是享受
ed8e61deeb6b2ba5ffd641064fc4832ddce05ac0	82979127	1	离异的大奶熟女姐姐 喜欢文爱,满嘴淫话
efbadbaf9c27261072954a17cfae47b5283e7c34	1212133005	1	SNIPER ELITE 4 DELUXE EDITION-STEAMPUNKS [Mac OSX]
ef3a8c71ed067365aaea772470cc704abe6b1896	17668479	1	“你还敢再漂亮性感点吗？”宝哥高价约 了位极品高颜值大美女,扒衣抽插,各种体位干完又干,叫床淫荡.国语!
f1e5f8bbbf3222dfe2ef6e9f7ae4d32fdad72d09	9355034624	15	Bull.S05.400p.Ultradox
f1fc29af363e8aadaf2d31c874dc83721c81ee46	39104791	1	性感小鸟酱手脚并用温柔压榨 细皮嫩肉摩擦到最高点
f37a58d56a2bc87e41f20a664f0943cd5c3b42f6	24150305	1	最新三月出品破解家庭网络摄像头偷拍出租屋农民工大叔睡前和正在玩手机媳妇来一炮
f4e6c36b4cac71a259bc60581031cb779bb8a1b1	33468957	1	对白淫荡离异少妇微信找猛男啪啪从来没有那么性福
f67d384d96674402fb644326db62c34ceac927ba	44232890	1	身材超棒的卡哇伊妹子，喝了五瓶啤酒醉了吐了一地，发酒疯狂哭狂闹，情绪稳定一点了就哄着她干一炮
f6bf5708da682b66ebb130686f97c958c83d4de9	160524918	1	北京离婚小淫妇老师非常的骚 干两下就大声浪叫不停
f7daa0e7f2c7b3835422b7ace5986272dbf65414	37475283	1	91-boss0698-宝马女系列最新-酒店玩弄爆插96年富二代宝马女,正干着接到闺蜜电话,被听出来声音不对,骗说：吃辣条辣到了
