00f2e62de26f72b8f64c3baf1aa7ab713f85f402	26181286	1	年轻小嫩妹直播 双人激情啪啪大秀 很是诱人
00f65c6615b0a55a73437371d51366a97d5fe0ad	2277118438	1	91大神呆哥最新火爆精品佳作高端约会系列-朋友妻不客气终章篇，去人妻家里偷情，趁老公去出差，迫不及待的喊我去她家，中间干着干着还来了电话～1080P高清完整版！
00beda48dfdf13a3a6bc8d5ce59d54276ca570ff	23388674	1	此妹子撸点高啊 制服学生妹小骚货 皮肤非常白皙 紧致的身材 很美的翘臀手感肯定不错 用手指插搞到高潮喷水
01bffe4c5bc81219c784e4070fb7f195ca7f8936	24245502	1	天然白虎骚气妹子带面罩性感黑丝扭动诱惑慢慢脱光 床上道具自慰双洞齐插高潮喷水不要错过
018aa8d22c5199cc7bc58e96c4329556cabf4e60	21713719	1	各式姿势爆操96年白嫩小萌妹 骚气十足 很乖很听话 背着男友被屌操 淫声浪叫 露脸 口爆篇+内射篇 完整版推荐
0231abc2c30c6b2bd5426fe88a09c6c288bd563e	22788500	1	91sex哥最新高端大片第十部-番号010：肥臀黑丝制服年轻美少妇，强力掰B撕破丝袜全力抽插超清完整版
02d1532e9cc4c55a975875792c735420242b8b6a	34755201	1	超人气御姐美女主播【魔仙】极品美乳白嫩身体粉红小穴让你情不自禁撸个不停
058e9dab9f358aa6e6cf3123c6a827625b9d0442	35334673	1	小胖妹带表弟直播表弟鸡巴刚发育不错，可惜一下就软了
05fc7b28a2e68f6463f128b3d9e4d6231f3efee9	28263422	1	【丘哥探花】良家人妻，老公不在约出来偷情，聊天调情连干两炮，骚货性欲强一直索取无度空虚太久了
065ae4db468c3ac99a07433c222e5d353a15cba6	1406788015	9	504-36
07960385a2ecb9614f7c2472d63989b5b11cb317	65499048	1	武藤幽兰—校园露出 白嫩奶子大屁股丰臀丝袜美腿极致诱惑
07806492afe629a4d9f64e9dcd90c2a215382654	33600263	1	胸大性感的长裙美女背着男友和情人啪啪,男的真猛干的美女淫叫：好硬,好厉害,不能射里面,我要上厕所,你放了我!
08fbaf9b5bcfe3771aa78807f44be70f3097a08e	41283675	1	【绿帽专家肏逼达人】午夜探花私密龙凤会所找个长腿美女扛腿抽操泻火 大拉大拽爆操 贵在真实
099ca69d9b68e7877ccd0ee502296f544b4d3705	23990301	1	魔都极品身材美少女被男朋友操到无力还击 扒开内裤无套直插无毛浪穴激情沙发震
09c64d2dc74864c64d55a4739a0d6b150ef85b6f	59819615	1	91富二代邀老铁3P高挑职业装公关女模特长发飘飘气质佳上下洞齐开让两个小伙子操崩溃了720P高清
09f3f880412c2feaf40268882752b504346b77bb	48974590	1	高颜值长相甜美亚籍萌妹子白色网袜跳蛋塞逼逼无毛自摸掰开特写非常诱人
0af5eb4ec9a244f88f708ba002e70f030a89f11f	30630450	1	漂亮妹子KIKI手机直播手指扣逼出白浆喜欢的不要错过
0aefba1909d9f23924999b8530ca2116e3ea2d8e	43882900	1	被几顿宵夜搞定的厂妹与大屌男酒店打炮啪啪
0b779e0bdbe0ddc36bf58eb67a8a782eb9ddbb60	74052783	1	魔鬼身材网红少女私人玩物邻家小姐姐的蜜桃臀
0b60c7c3a0eb8653348d61c17d046ae82864e09c	550081321	1	FTVMilfs.21.05.18.Jessica.Ryan.Truck.Loving.Beauty.XXX.480p.MP4-XXX
0b32c02e3cf5a740c6ffde7baa618e32580b18a7	688026345	2	Bunker Palace Hotel
0b8a66bc8021368ab42a13d7211d674a90a6f2af	74668550	1	只有几根阴毛的性感女友，宝贝 这样插你爽么
0c5fc6d0c9282c8f056e7165a1e8dcf5982e62ea	64028679	1	驾考女学员与教练的爱情故事，要想学得会先跟师傅睡，驾校简易房内的激情，直接在地上开干，小少妇为本献身
0d8385b5de6609dc446e8d782b408f536fcd29c0	62951399	1	颜值不错女主播户外勾搭了个炮友 在深山野林里激情啪啪
100956adb28dcf9a98d078635782a2ff009a3e86	31292671	1	颜值不错身材也很好的美女主播q朴妮唛 直播大秀 和房东从车里干到屋里
1352db6ca04af70f0d0fd524a34d157ad7ec9c88	1663815856	1	猥琐眼镜摄影师KK哥私人工作室与身材高挑性感美女模特伊伊各种SM道具拍摄完事老规矩裹屌对白真搞笑
13d22fd1cdc59af1dac66a1b63cd7cb4ef45adb2	20247162	1	妹妹是魔鬼苗条身材萌妹和炮友啪啪，掰穴口交上位骑乘自己动大力猛操
1496b047f34b06e314bf8cd40a3bff06b477153d	23367445	1	前几天刚操过的KTV漂亮点歌公主,趁她休息约到宾馆啪啪,身材匀称性感,用尽全力狠狠抽插,干完逼绝对痛.国语!
148a6e80c7159b441f860f76a828f031d834b84e	173740159	1	PR社翘臀美乳萝莉我是你可爱的小猫 青瓜插入自慰后在自家窗前诱惑 肥美臀部和木瓜胸部太诱人
1464ad5ea85ec5629cae5f35c2a2776d98960ead	37669462	1	高颜值美女主播果果直播大秀 身材也好 极品粉木耳
15e3f1d0bdf7553f2350c0e5ad0f9126c2ccc79d	241315739	2	90后短发女友情趣酒店正面对着尻逼，就是一直的硬顶着尻
15bf7e747231fcd6dded6c006e0cdc3154cf20a1	37851919	1	小区的按摩馆暗拍卖淫女推拿几下就做大活国语对白
160a8167450f3735e073a46f091588434af55565	72638326	1	露脸抄底漂亮可爱薄纱丁内学生裙小妹子,这么小就会穿骚
168127e379d19238eb465bb4bb0a4e53aabc82d6	21261916	1	牛逼老汉强势插逼双飞风韵犹存的两个熟妇 黑丝那位身材保养的真是不错 逼逼也好看
166969bcc8f88708cc6daa13610d9524ebe5fbd8	79325114	1	露脸淫荡少妇娜宝姐高价售卖作品 给老公吃鸡巴后入激烈的操骚逼 大阴唇被干的翻出来
17b57ea2382b1375e5133fe7c2a53d44e5355b0c	1969659271	1	户外勾搭爆乳一姐退隐前最后的疯狂 勾搭路人回家啪啪 非常时期讲究卫生 做爱都要戴着手套 高清源码录制
18a6530ba8c77b7162414efa699a28a1587deb04	453103668	1	酒店与小情人做爱她跟老公电话我也照干你太刺激了国语精彩对白
18bac6d033dacf0981be891ec06dee9e62189840	38888841	1	台湾SWAG『朵拉』酒后乱性一夜情 遭渣男提枪猛干 无套中出超爽
1968874780f18f22c9783b6ccb17dea86b275e0e	32281491	1	吐痰推荐说话很嗲声音听了让人心痒痒的漂亮可爱小女神洗澡直播身材匀称饱满奶子不大不小正合适对白清晰
1993cb2d02e94954bff71c845174ebcbd2c5b495	26838667	1	淫荡大奶少妇车边与粉丝野战 后入猛冲一边捏着她的大奶子一边肏着她喧软肥臀干得她淫叫连连
19e8e081d45feb5b1583cc876420840295b89ba5	65645005	1	路边店花200元找到一个身材好高颜值的小姐而且是个馒头B毛很少720P高清无水印
1bc85c5dbf95f3fe50d41ebac0fe2ebbaf782e94	33977879	1	【养生打炮一条龙】胖男大保健按摩完来一炮，大奶熟女乳推舔菊骑乘猛操呻吟娇喘
1b1e12b4118a05a802127f1030d72284572b51a1	32971230	1	女神！大眼睛非常漂亮，一定好好看精彩不断，经典对白，高清
1cf04748d5ad00f1b36d94a2419e0f5df376dc0b	51459763	1	女神的沦陷，大眼睛高颜值黑丝袜，超有感的口交舔鸡巴吸蛋蛋近距离给你看舔屁眼，被大哥捏着奶子爆草调教潮喷
1cc5c2afde41e5225735e904eb36e069040d5e75	38305192	1	橙橙小萝莉夜晚户外露出马路上全裸自慰，跳蛋塞菊花假吊快速抽插裸奔
1cf04bc0c4d7e1ad06695ccb704841e838597d80	2536024866	8	Miłosna rozgrywka - Something to Talk About 1995 [10Bit] [1080p.BluRay.H265.DTS.5.1-AC3.5.1-NoNaNo-NitroTeam] [Napisy ENG-PL] [ENG]
1c901c3775d2f334d31d255e331479b36dae08f7	33177128	1	害羞的小少妇露脸宾馆里教她吃鸡巴，压在身下干她骚逼好诱人
1dbe9e5437e64c1e32796eb21dda2fa1f1ff0b07	91311736	1	重口味主播露脸骚话不断白丝情趣，做在椅子上自慰插逼，双手拿着大粗黄瓜往逼璃捅，表情骚浪狰狞，道具双插高潮不断
1d841e7d4b6f1c06401f174213deec964459cee4	38502239	1	个性主播晶晶带闺蜜勾搭路人宾馆3P各种挑逗套路大哥很无奈不过最后还是操得很爽
1ea429cecb1584cfa6e40bfa587583b18a918c00	49976774	1	超强推荐 新人白虎露露最新大作 美好的假期被带去酒店调教3P
1e55f779e409d1ff5c2ed78dde80403f6b8c85d8	32683264	1	手机直播挺骚的妹子漏逼漏奶秀逼逼看着挺紧的
1f136b7bed13e0e62b5a55a1712348afb0d27183	38380508	1	台湾SWAG『Umina』无毛小肉女 前门后面都被填满操到无法自拔
1f9d35dabce5b05f80b16cbff59c047c0312d0e4	61853662	1	蜜桃影像传媒出品最新国产AV佳作 PMS001 性爱公寓EP02 第二集 高清精彩推荐
2020ea085e9a42c16f6673eb08cdec82f2f1e7bd	15793060	1	利哥探花约了个颜值不错白皙美少妇啪啪，张开腿舔逼口交舔弄上位骑坐大力猛操
2032f3c4a6b354cfec3f6017c479e3b7347aaec8	20013878	1	高颜值美女主播 椅子自慰 自己养的哈士奇也来吃豆腐
21634c0148c9fe10e3c3ae72a300d66e0c51e516	35444415	1	里应外合超级大奶老熟女小旅店包个房间卖肉屋外有人帮忙偸拍大爷很猛的卖力啪啪把老鸡操疼急眼了对话乐死人
2101dbc11449f39f12b333dfa846edd208392a2a	78554809	1	酒店开房和包养的大学生情人开房自拍妹子有点不好意思挡着镜头让不要拍
21a4120d746c76e0d0e07295545567512430d4b4	127979348	1	【网曝门事件】美国MMA选手性爱战斗机JAY性爱私拍流出 横扫操遍亚洲美女 玩操香港豪乳网红妹内射 高清1080P原版
22a70457782afd3eeb64d2c5fb789e4c7e128634	96614827	1	大陆经典网络探头盗摄 各年龄段夫妻居家日常性爱生活（第一部）
22c7dda3c3200e024b261f16a450f606c0862947	408898852	1	黑丝女仆爆乳女友和男友情趣诱惑激情啪啪 多姿势无套爆插 抱着架起来操很带感 淫叫爆乳乱颤 高清720P完整版
229df8cc68195fd2e254cdbd1aed95b5cd4df67c	17339916	1	丰满巨乳女主播性感豹纹连体情l趣装床上道具自慰大秀呻吟诱惑
23c0011e7b0847760c74ec941e7c67ce7f4794dd	83948863	1	城中村底层嫖妓刚出来混的小村姑财不离手被草也紧紧拿着钱包
24481aee4f617d4ce7f191288f29cdeb98c9cd0f	7182419183	3	CJOD-297
245870584a58ea5672b30ce7024b62c770b58ab9	28151874	1	霸道魔鬼身材的极品微博网红巨乳女神未晚与炮友公厕啪啪自拍
25d1b99caeb10646387b709a869f9c217ee016b5	21667130	1	看着年龄不大新人萌妹子裸秀 脱光光床上自摸奶子逼逼挺诱人
2655133d22025e89bd959c997cdcc630f919b102	27317194	1	无毛白虎清纯女主播你的心动女生茜茜酱 粉嫩小穴插跳蛋激情自慰 清纯与淫荡的完美结合
263bc178ef8ee9901c1e0af22861c0b68bb6b020	70366049	1	御姐马路边等出租被过路司机搭讪坐顺风车 喝下被下迷药拉到偏僻处车震
26780afe74e1a11af513b9ba88b93a2696b44068	3031439553	1	颜值不错眼镜纹身妹大黑牛自慰，情趣装黑丝大黑牛插逼震动近距离特写
282abc0961e43c1ea3c9cf773a0b46b73081f503	46557603	1	屌哥全国探花酒店约炮偷拍给徒弟小胖约的模特身材牛仔裤兼职白领美眉沙发调情干到床上
2894e1ec32bb1be48969be699fcc6a7337d8887a	50740496	1	00草了草 高颜值极品身材的漂亮小姐姐和男友户外漏出美妙的翘臀，去公厕口交啪啪大秀
287e278c95c293b76a765e227d9f4878346c24c8	36630877	1	昔日大神高价约啪高挑大长腿连体黑丝大高跟外围女模各种体位抱起来肏浴室干到地板很生猛1080P原版
2c1549219043972023b83ca7d80e817d560187e2	4182620	3	StartIsBack++ 2.9.13 (2.9.1 for 1607) StartIsBack+ 1.7.6 StartIsBack 2.1.2 RePack by elchupacabra [MultiRu]
2d6f558481189fb69c1e1a826cc5990f36342117	63232867	1	最新高价众筹购买JVID精品大作成人限定18禁【罗颖-女子校生的秘密】原版套图109P+视频1V
2ee92d646c5e817131c95af7e996252967ffdc24	17829478	1	乱伦结晶！风韵犹存 吊钟大奶老女人 剧情演绎母子秀 口交 女上位操逼 舌吻 吃奶子 吃逼 跳蛋塞进逼里震动
2ef031ed520c7f7feac5f306cc54b61e347c4cfb	7099536	4	Strix v1.1.0 Premium Mod Apk {CracksHash}
2f3ea110964f5d12bc026d3feaf83f16539db018	26374055	1	美女集中营〖群女战火〗美女们都在玩手机 粗屌哥性欲高涨随便拉过一个无套就开操 内射玩再干另一个 高清源码录制
2f0a269dd441f19ffa52f2594d612f77eb16e198	228001703	3	SexArt.19.06.16.Alexa.Flexy.Gentleman.XXX.1080p.HEVC.x265.PRT
31ad9f4692749b428e253fd3b359a4480003a43d	46157156	1	小伙灌醉女友偷拍，极品罕见莲花嫩穴【只为刺激00寻欢】粉嫩鲍鱼，坚挺美乳，艳福不浅遇到这种尤物
314e3b5b7d15e3c8c52f56940294170e1a2c7541	118125656	13	Emperors & Angels - 2021 - Emperors & Angels
3132dc1107e6817eed48679c1285a22f2332c970	1677683608	4	Adobe InDesign CC 2019 16.0.0 (x64x86) Multilingual + Medic
31100ba4aec82874fcc22d39bb59431df106f593	42928309	1	2男高价众筹魔鬼身材性感漂亮的外围美女,夜晚约到酒店扒光衣服2人轮流啪啪,各种姿势玩个遍,狠狠爆插.国语!
320f4f11638f6429673d1e21ffeb04fa7fa40931	59114725	1	真实夫妻找刺激酒店约单男一起玩群P，骚逼老婆先口交再被两男轮流抽插骚逼都快被干肿了
340831aedb0634c6802e5d218c5f288222027b69	59442484	1	“快快接着操我你好大从来没被这么大J8草过”91大肥哥酒店窗前爆操青春靓丽美乳学院派美女对白淫荡刺激1080P超清
3408331eebbb2dbe4a62844639272cae667bdc91	98977497	1	东北小骚妮胆子真大医院厕所大秀，露脸皮肤白奶子大屁股肥，脱光了揉捏大奶子道具插逼自己舔淫水
35ef775314fba0b8a350a61031be4040a1f82742	53852362	1	台湾swag最淫荡主播『飞飞』喜欢各式口爆中出颜射拿精液润滑奶子也有大家最爱的抽插嫩穴
356837b55a52895136c2ec637b105da5639c574c	18599832	1	碎花连衣裙少妇户外勾引帅哥河边凉亭抱坐式啪啪口爆精液太浓要抽口烟缓缓
35e1652eeaae333dfc01956ed61d6e3dc6d6e34d	38312663	1	精品小旅馆偷拍身材不错的貌似大学生情侣白天开房啪啪搞完马上撤退
368818e422604303db5e9907e97aa6d211821c3d	76628942	1	趁她老公不在家 在婚房干了个刚结婚不久的大奶少妇 拽着马尾一顿猛操还要内射
37011abc92820ec090248459b9814a6a12b5b7ad	59697639	1	【首尔男买春打炮】怒肏大奶人妻双飞时还有些害羞 姿势繁多（第四部）
370baf7e38e63dcf417e78812860c015b88d76b3	11239363563	29	MCSR-439
38dc4294fc38eb8f8db5b8a2a4b652a7c339afe1	1963127547	6	DNJR050C
392e6ef1c8c620fd06c4aa75301f37b8f92b38b9	209415435	1	177cm学舞蹈操不黑的女友。虽然我知道她被很多人操过，但是我就是舍不得她那双长腿淫脚，怎么办？
3ab368460692e6c8415b011478bed4acdd11617c	2764050954	1	SDJS-041
3b215940a3d7e9484259b8474b49e3986693d011	68259257	1	身材苗条骚气眼镜妹子性感黑丝双人啪啪秀 深喉口交上位骑乘后入大力抽插 呻吟诱惑
3ba1888d78fec298398b9a8eed5ffa69d8a90d3f	45269610	1	年轻颜值情侣宾馆开房，几把好小，但是也想吃，看小美女吃得多仔细多认真，好幸福哦！
3cc4b44fc89b881b85202e5cf82ed797105b40d1	16919062	1	华先生-高考后的放纵 身穿学生装玩弄 呻吟很清脆
3ee50eaccd986a9ab726f4cc41f45e708e952e26	23459631	1	千人斩星选深夜第二场花臂纹身妹子，穿上黑丝沙发上操口交上位骑乘，性感大屁股上下套弄
3e509b2aa8c8a0de20177e2207fe05bc91887252	4234801152	6	Спасти Веру.s01.(2021).WEBRip.by.Nicodem.Files-x
3fdedd388cf395c5c6d44cda41206689aadd185a	972113355	1	蚊帐房精选-颜值不错的小情侣早晚各一炮精神好
3f51bde4e85bc3f4d5afd77f2851fb728aeb3dda	53815617	1	天气热了出租房内各种美女放纵的动作被拍下
4080bb9b556c0ee7a8c5022a4875ccc265941c68	41817720	1	胸大性感的美女剧情演绎性感秘书办公室勾引领导办公桌上被狂操,淫叫：太长了,从后面操鸡巴好粗啊,快,舒服
40d151007aba7defe7ca9852d51398ee27ea36c0	823530883	5	Adobe Acrobat Pro DC v2021.021.211203 + Patch
4093d3cd2a72e3e96057d321709b63b4ac9d06d8	394728823	1	SexArt.21.05.21.Eve.Sweet.And.Ivy.Rein.Girly.Talk.XXX.720p.MP4-XXX
402c832701681a70b7dde210568925958a6bd3e8	776848563	1	一步裙高素质性感外围女上衣都被扒光了钱还没付,男的还要扒她内裤,不给钱不让碰了,操的想淫叫,又年轻又漂亮.国语!
4103410839abb6ebc7cc97001d4dd231beb2e132	26130669	1	高颜值美乳白虎妹子兔女郎SM情趣装双人啪 口交上位骑乘抽插淫语骚话呻吟
42388223657565a7bd6aa2e95d9f5958d9574c04	13152159	1	91秦先生(小鲜肉)第七部最新发表-公寓爆操黑丝空姐装琪琪,被调教的越来越骚了,干完后说：干的我叫那么大声,隔壁全都听到了.国语完整版
42fc3a8eca5ffe5f79d5a39a3deae4d2029c5259	24082420	1	清新甜美可人的泰国女神KK，泰国难得白皙又高挑的美女，超棒的身材 双极品笔直的大长腿，胆大妄为在风景迷人在酒店阳台对着海边打炮
442e332fdccb170db52f8c2de5cc5ad22db2475d	23868538	1	上海外企骚货跟黑人男友疯狂性爱自拍被大鸡黑老外狂插这回被干爽了吧完整加长版
443fe8c3284b7e570230baadf2b4378273717485	2212888192	6	The.Me.You.Cant.See.S01.COMPLETE.720p.ATVP.WEBRip.x264-GalaxyTV[TGx]
46cd214d4f1f769ba7ca7d4b48e915cdbf621d5a	34621915	1	年轻嫩妹学生灵儿直播大秀 双人激情啪啪大秀
473f0a0d6fe8a1dd31d6e9b20db6dbaf72af7444	3694545783	4	FC2-PPV-1829435
4757e068f6d31451d83cc03492811df0b6100a4b	21930145	1	国产良家夫妻居家自拍，【太平公主】极品小少妇，肤白貌美，家中跟老公睡意朦胧中来一炮，娇喘悦耳
4795d028bf0378431dc1c5c7596fe970083bc363	17423002	1	身材高挑的美腿黑丝少妇 在丝袜上拔个洞 小哥性冲动狂干着她 后入可能太深入了 顶到了G点少妇狂叫爽啊
47c710279b905202e2104fd6be37e7a297f294d9	30080821	1	【全国寻花】青春00后小萝莉，苗条粉嫩鲍鱼看着好干净，大屌深喉后入啪啪战况激烈，高清源码录制
470f93b0d9705eedc458cd5557ab74d83f4374e5	78118883	1	720P高清国产剧情在办公室操嫂子吃精丰满身材欲求不满
47bc59da62a8ab223ec31d40b6671c85b501d2f7	39287407	1	高颜值苗条身材骚气妹子自慰大秀 高跟鞋震动炮机快速抽插呻吟娇喘
4985b14bf88b05d772fd38c927a542218e0c8e11	27083749	1	短发女神长得这么清纯，胸部还这么大，约吗老板，丰满的身材没有一块肉是多余的，特别是那一对奶子，能舔一个晚上啊
4aa74f964900b2bacfcb922eaca3bdd0bc137c1e	95461399	1	让人羡慕的屌丝男啪啪啪大学生妹纸乖巧清纯动作温柔细腻口活很棒高高撅起大白屁股操的说疼对白淫荡
4ac948eacba2b8a9b82c30cb304d7f75deea4845	69972184	1	身材非常标准的小骚逼，穿着很有气质，酒店搔首弄资漏奶摇臀极品诱惑淫语不断
4a920bdcbd3e9d28a6ef05da7ba3c597790f259e	2486097324	34	Army.of.the.Dead.2021.1080p.WEBRip.x265-NF
4bff983f2d72830584cf20bb2fd297232ec7e834	54923913	1	广东约约哥健身球少妇第三季健身器上完美的69口活后入激情爆草浪叫呻吟720P高清无水印
4bf3085a02207152d8b23a8515258930d8963d54	180887128	120	FemJoy.com_21.04.26.Rona.Talin.Tempt.XXX.IMAGESET-FuGLi[rarbg]
4b34f28ffc3c58be8fe1d41e86666c901f905583	695167940	4	Three.the.Hard.Way.1974.DVDRIP.X264-WATCHABLE[TGx]
4b52208eadfc905ca5c078fff444d9519d57ffd7	243484546	1	推特极品白虎嫩鲍福利姬希希酱VIP福利9G合集
4d8a6d30ea59c46fec4934fef5cfe5e0d6ef3ab4	85480275912	108	Metro.Exodus.Enhanced.Edition.GOG.Rip-InsaneRamZes
4e51e7da15e2105408bca1c983949a3c9d10e202	23853233	1	漂亮小姐姐蓝莓酱双人啪啪秀 身材苗条 激情啪啪 很是诱人
4e6322f12321b6ef310787ebbc05c46758eb58eb	30851763	1	年轻战斗力就是强大飞哥宾馆开房连续约了两个好身材漂亮妹子啪啪强哥负责偷拍收门票
4e632333d4131d60de6a12a8065e1713acff7cf1	47511364	1	170CM长腿肥臀网红脸外围美女酒店上门服务包臀连体裙下连内裤都没穿,看见客户大鸡鸡激动的拿起就舔,求肏!
4f677261bab4041d451483e3575046f2533d6a20	202486025	1	对白淫荡东北素质炮哥幽会保养的不错的鲜花店老板娘插到她受不了720P高清无水印
4f328f023123272c68a41fcf8dfc618585bf6288	106109587	1	麻酥酥哟—黑丝play玉奶爆乳翘臀唯美极致诱惑高清
503c86cdd96d8414db3e3c504e74cfa6b196ae3e	304270675	1	狗爷雪夜城中村嫖妓赶上小姐们在吃宵夜花多眼乱不知选哪个有小姐调侃他双飞四飞
50bca97ea860dabc78faeaa052409ebb323b4957	38251842	1	JK制服学妹性瘾难耐课间和男友开房激情啪啪 无套直接插入 多姿势操的小骚货浪叫 高清私拍48P 高清1080P版
50cf2e67641f556827011ac7baf1c931d5901962	609155038	1	超嗲超可爱小女奴翘美臀挨操 边抽烟边享受小骚货口活刺激，无套抽插各式爆操
5098a0c3cb65536008fbd6f19e1be23e861ef4cf	801110356	1	白丝高跟寂寞佳人做在椅子道具自慰，把自己搞得喷水浪叫，期待大哥哥的几把草精彩不要错过
51523a176f420d7f667e796f397460ae317adf1e	1621022913	13	VGD-153 卑猥なマドンナ 篠田あゆみ 旅へ
51dd6ad4c14fbf5f44807806a26d205460d2b2d9	70191841	1	火爆精品大片-公司签约的36E美乳模特,178CM性感身材既是腿模又是胸膜,高颜值旗袍诱惑,站着后入爽要死.原版!
521becc24d1a1123198ef916990986cca8191bfc	38211236762	23	Holostiak.S11.2021.IPTVRip.MegaPeer
535ab845f66e7fda3ff3cb32067969b62390d557	21859817	1	长发气质美少妇酒店被大屌男操的销魂浪叫,快速抽插越叫越大：用你大鸡巴干我,好涨啊,老公都快被你干翻了!
53ca5da61bda959025b9435c519b6f7ee0c075b4	53654093	1	漂亮韵味美少妇和炮友双人啪啪大秀 身材丰满 激情啪啪自慰 很是淫荡
5531f2c508b55cb96235739d7a1de4b280c0f815	249510713	1	【家庭偷窥第二季】最新破解家庭摄像头 偷窥啪啪啪（第二十三部）
550f7bb6cf91c38c724574fd7992b4f5310e02a8	97321513	10	Lud-2019-Yellow House
57f4c4a9b3fbf2a16d4ed93db051f55cddfb61a2	20998782	1	早期东莞ISO桑拿系列50部合集 带你一起体验传说中男人的天堂 桑拿系列 (36)
581b281f818fb041b719113e1dfa29640453375d	136090281	1	全网91唐哥目前最全视频合集全是美少女17V大放送
5817745f118a5edfcab408432d0e61c61346fa96	221315757	2	PornMegaLoad.21.05.21.Ally.Rayz.Huge-Boobed.Scream.Queen.XXX.720p.WEB.x264-GalaXXXy[XvX]
59401a0bb8b3503f3a088e7429a7936a7475d3a3	36348000	1	猥琐眼镜摄影师捆绑调教高挑E奶车模小迪 观音坐莲啪啪
5a217528da53d5d1c3b78687cdc693bcc7a69358	48646872	1	裸贷裸条事件-身份证档案丢失的花名“水哥“果然自蔚像射精似的
5aa68cf58c5783e23ad7d8fbe584fae259b68a7f	47903727	1	酒店和白净情人口交颜射讯意外流出，叫声很给力
5bf6036fae1cf6e84888f76f0663b4d41f81211b	60135761	1	校友说比她国内男朋友厉害直接就让内射了
5c19fc9ffa6f6d6b780956f93712c8bc5babd169	16688674	1	白衣黑裙长发气质大波美女与男友开房造爱很有情趣特意穿上古风红肚兜T裤战斗力增加啪啪啪打了好几炮
5c00ed0925123cfecd99874b0c2e5ef48b64c3a3	251380978	1	漂亮白嫩美女和中年男网友酒店偷情啪啪,在浴缸洗澡时就迫不及待开操
5d6d9eee484ed9ee9687f72fc737e4a2910e4bf7	30199950	1	一群男女双飞啪啪直播大秀 狂操双马尾美女 激情啪啪
5e1bd9b1d4c1a747fe106c5b5e991c92758b0c7d	75766159	1	国产自制AV片【一箭双雕，3P天堂！新手男优被榨干了】
5f6d6174c6d1c88eeb3e725d4d979b08318f9217	20478505	1	大鸡鸡操我操我骚逼情趣酒店360TP偷情男女激情淫女最后上位高潮抽搐流了一床淫水
5fc454837a86faffea0dd53ade46c1cefaefbc8c	49609046	1	另类重口主播先给逼吃个橘子再用电钻捣烂抠出来，纯牛奶洗阴道黄瓜配鸡蛋塞逼，什么样的鸡巴能满足她
61e94aa4aa6b65657ef83f74735c71798337ba10	38151917	1	宅男福利网红PR社极品小嫩妹隔壁小姐姐之客厅刮毛小嫩穴刮完之后用手在自摸阴蒂2V2
61c89fdc4d97ed2c6bafd55a463a1344424f1016	36414616	1	颜值不错黑衣少妇【黑大屌干姐姐】倒立69深喉口交，骑乘抱起来大力猛操，
61727cc4b11bbbc2bcd07be6efd706da1ce67f4d	287237118	1	极品良家大尺度视频流出合集 新买的丝袜制服
61f2cf23f0aaa35ddea2dcac44a77e916ba0f794	31436154	1	酒店偷拍美女坐在男友身上磨硬鸡巴扒掉内裤坐上去操
626bffddd281349a165bb545f566a727cfc4770f	19776355	1	【约操邻家少妇】爆操娇羞的熟女骚妈J8无情 压抑的呻吟 忍不住的高潮 黑丝丰臀 极品骚货韵味十足 高清源码录制
62bbf7ffcba218f855420607e177cb4ddbd4dc25	347993154	1	高清国语白沙发系列毒龙上位爆艹黑丝开档高跟外围女
627d8900344c5e099274fea7177c38d0b2b97643	1129224273	1	极品骚货浪女【AVOVE】爆射无毛黑丝开裆御姐，淫水超多牡丹花下S做鬼也风流
628f0b0ac26ca1515e294133ed9079771ad33c59	743015467	1	清纯嫩妹一排排最少7个妞，全裸互相调教一个大哥草得过来吗，场面淫乱刺激口交大鸡巴，沙发旁激情大战
62711ab04f6838fbe0ca584e226a6ac5adb4ada4	32340846	1	吐血推荐网络红人女神思瑞和土豪啪啪神情销魂大叫老公不要停
62d1468a0aa9303fb6bb7097a378cfece1901aba	277456549	6	www.SceneTime.com - Pride S01E06 480p x264-mSD
63c006210a123bf71edc1f5aeb3caa3babeeff14	18978496	1	精品资源，全网最全的蜘蛛侠大圆床房偷拍，中青年夫妻情侣居多，也有年轻的学生情侣
649061e29d667250eac46fb0cff3de73a5245508	46652580	1	汤不热各种小母狗调教视频合集
64972ce618997e27e3d7a9f300d242dd34b57154	1053983318	1	情侣开房 女友深喉口交吞吐肉棒 丰臀后入抽插 呻吟浪叫
6500f5dc58dee56f06a874056a45078fcaef8757	2219722951	1	C仔原创系列作品之胸射童颜巨乳明日香 被操得直叫别停 捅进去 快点 要死了 我要 不要停 精彩对白(0)
65215d8c9502e7173d353468563399eb603b329b	46468044997	13	Taxi.Driver.s01.HD1080p.WEBRip.Rus.BaibaKo.tv
650dbd216753bebf082bfd1743d8a94a0ec9c6bd	59563863	1	91大爷重金约啪高素质风骚气质外围女模有点像是混血妹奶子又白又大黑丝大美腿啪啪娇嫩呻吟1080P无水印高清
