cae843cc4513a4090fad561441c113ffb487d52f	1705065369	4	Memories.of.Murder.2003.KOREAN.REMASTERED.720p.BluRay.H264.AAC-VXT
ca8f03b9585d23e2dc01c0c24cf53840279bb1e8	34224102	1	极品神添高中学妹，装灵巧舌头悉心舔舐鸡巴真厉害比干B，女孩接电话说“妈我在同学家玩等会就回去”真心下火刺激
cb3230b13f28281d2c3f65ff05de34bb1396ab26	347937623	1	夫妻喝醉老婆主动上位骑操 陨友一旁观战拍摄
cb27910af6b97bfd00321574916f745f718ed1d6	50200358	1	长相甜美的美女主播 穿着黑色丝袜 漏奶露逼诱惑 道具摩擦阴蒂呻吟 非常诱人
cc6614633c1c9f1a6dc38f43f1e3fe5fe4f2c328	9473591	1	绿叶主题精选] 年轻情侣开房肆意放纵 骚气破浪的妹妹饥渴主动 被窝里舔屌真刺激 高清720P版
ccb6008ec9d71379cc9688e0ac9b15d8543003bf	23017311	1	主题酒店基层领导大叔开房啪啪啪豪乳良家情人平时大叔肯定没少补肾这床操到另一个床很生猛
cd16caee944a47bcd3dcec43fd2b448c2e148817	52814344	1	极品推特网红生物老师『闵儿』微露脸 婚纱装带着口球用自慰棒把淫荡的小穴捅的水汪汪
cd70f5fbef7ab2e13ab441eb4f33005a9844a917	928084965	1	NetVideoGirls.21.05.18.Gianna.XXX.720p.MP4-XXX
cd5552f7b8869cea83d674f376dae95ddd826652	49815529	1	中国式近亲相奸，触摸到成熟已婚姐姐裸体的处男弟弟兴奋不已姐姐一直叫弟弟慢点草 今天可以草一下午
cd051c15af05f4daab785c7f26b9e36d1281b974	1992333288	2	Drunk Bus (2020) [1080p] [WEBRip] [5.1] [YTS.MX]
cd2235c71ddc97b4577c0a6d1e7998e93269e3d3	26714400	1	公司新来的前台一顿勐追终于到手 声音真嗲浪叫的真好听没忍住直接内射了
ce4ce67ca28d1bc9992cd4b64cf5be76330c2a15	24532248	1	颜值不错平面模特妹子，极品美乳翘臀白虎嫩逼，口交啪啪 洗澡 情趣丝袜极度诱惑
ce3336976963c6dd367b73d6bbef9fd45e6fc25b	41722078	1	无良按摩师，会所技师偷拍顾客享受服务全程直播，黑丝诱惑活真不错全身推油按摩，毒龙口交大鸡巴不要错过
cf7fd48c9952999e6338ef2f9d847c6eb671e562	226414064	1	迷晕来自不同推销部门的4个销售人员，身材棒，插入良家的肉穴真实刺激，高清1080P，附现场原版劲爆图207P
cf4d5fa8a67abbaac4080b9e7f8bc16855164d80	236031316	1	老哥探花玩完双飞不够爽再留下一个漂亮妹子继续来一发大力猛操非常诱人
d0377de1f4d6e5ea6f33b167308131c4befe1e21	36742826	1	91大款王老板带你体验高级会所全套服务现场点小姐开始直接叫了两个颜值身材不错的姐妹花轮着爆操对白精彩720P高清
d0cddc868d69111173eb315d6ac73c09b901ba4d	82037865	12	Aeronaut V (2020 - 2021)
d073955a46f8cda3ba7b9c6b607561b3f7de2763	9832777549	19	Stellaris - GOG Linux
d1db8139f1cab8e4019011a0e565d926f833e74d	30356679	1	微信附近的人约了一个骚逼成熟阿姨，帮我口得真舒服，‘你胸罩不脱呀’，‘要脱呀？’，脱呀，脱了继续口！
d1e6026c3963c2e1c2a7432e4082defd4c1e80fc	1338668206	5	Adobe Photoshop CS6 13.0.3 Final Multilanguage (cracked dll)
d273e4a8d01d95c26e3150dbe9a121a2e9e8df0b	1518295192	36	Army.of.the.Dead.2021.WEBRip.x264-ION10
d235c8ae82d166c7b1d581c65ffec1475c1cb328	21484992	1	新人梦夏极品诱惑，露脸女神级凌晨末班车极品翘臀，自慰淫语我见犹怜第六弹撸管推荐
d2005234319c23daa5a504cc64e0f1aa427b259f	531103806	10	TVBOXNOW 太陽系末日
d36d9fca9acb52e51ab656184cffe98f3811503d	122025907	1	大奶子媚娘胸上还有纹身，很激情的舔小哥哥几把，主动上位求草，激情抽插浪荡呻吟，自己抠尿高潮不断非常刺激
d39c85de79258290fd83e3b17c2896e2450a1857	113865028	1	火爆淫乱KTV包厢身材完美性感房公主裸身站在桌子上扭臀晃腰跳艳舞顾客伸手摸上一把
d4d6860e44ed3d7f81ff555bb0f6f7e357b87b9b	63578667	1	最新91冰神约炮新作-约操人骚水多外配人妻 感受小浪穴温度后电臀加速抖动快速抽插 中文字幕 高清720P原版
d595fa902a60c6923c3817bdc1e80f4acf4fed63	56625223	1	颜值不错的妹子 床上穿着开裆黑丝 全程露脸 假JJ骑乘 撅着屁股后入式插逼 特写BB 快速抽插呻吟 非常诱人
d50e21d4f08ac7f0f7676f999b8f732611e8ca8d	35471658	1	情趣学生装妹子居家和男友各种姿势花样啪啪 好像满足不了
d6bcd979222f66dd8971d956357f8cd17c9e3b0c	31034630	1	情趣白丝网袜卡哇伊小美女道具玩爆美穴 边爆菊插道具边大屌快速抽插 所有骚穴都操个遍 爆精射嘴里太刺激了
d6ba17c03a9a7cb8c44d48e397ebd80ddf1e9c67	1385432964	1	【七天高端外围】极品00后小萝莉奶声奶气，苗条清新沙发啪啪激情无限，高清源码录制
d8816450ac024c48d5fa0b026bd90961a6049065	61498331	1	东北话对白搞笑淫荡有钱公子哥宾馆约啪父母离异生活堕落技校大学生妹子援交挣钱经验不多但是很乖草出好多水
d88d54c8bd5d631fd89fc4d4e835764ec12f53c2	45561520	1	【吃伟哥干小骚逼】刚毕业大学生小情侣家中啪啪，极品身材美乳翘臀难得一见，粉嫩白恰到好处真乃人间极品尤物
d90dbeea8536c02b62bd3735400de75252acc918	107556722	1	广东出差会所嫖妓找了个口活不错的丰满少妇躺在情趣圆床快活似神仙
d95473b6715e3088b5e7afe4c4f25ca199f3966e	7683044482	101	Kirill Klevanski - Dragon Heart
d9994077c1ebc1775d1457b12e78c80ba17f159b	222440761	2	帅小伙和好友一起酒店同时约了2位高素质性感长腿外围美女啪啪,各自操完后又交换着干,淫声浪语,销魂淫叫,国
d9a093959866ca29972060c91915c7b4b383a6bc	31608247	1	苗条萌妹子【可爱灵】驾车户外车震，口交副驾上位骑乘大力猛操
d93483e6a08b944ec1adead44b3b8753ac5ba2df	18563590	1	国产TS系列东北美妖王二信勾引路边胆小的老铁摸奶子 旁边有人经过也不怕被看到对白有趣
da620c87442401dff6d675bbc9102e559990b10c	17750781	1	清纯漂亮小嫩妹快插我BB直播勾搭按摩小哥 按摩给他口 然后开啪
da29c484c16372858e61706f45afca631c824b5a	27554383	1	全国探花嫖老王约了个大奶外国少妇啪啪，口交口交沙发上后入大力猛操
db416401d6995d6734f2ca0a255e32f7b8e99af6	1234380548	1	最近很屌的豪乳女主播和司机佬走到哪干到哪大白天在小区的草地啪啪直播
dc6b70c0654ae87bbf3855908118afed7d2f3e43	824851166	4	Manifest.S03E10.720p.WEB.H264-PLZPROPER[rarbg]
dcf32134dfb2e61cb8c7258ee729ae55d110facb	2950574009	1	高颜值气质网红美女熊宝酒店与狼粉土豪老板啪啪啪叫的又嗲又骚叫老公又叫爸爸对白淫荡
dce0f94cec5db063b01ce77161224e8435f484ff	41369004	1	公司加夜班吃完宵夜和刚离异的少妇女同事去酒店开房喜欢来点刺激的绑起做爱普通话对白
ddaba2a8f9f160577f910a69b001c43555ccc22a	13820269	1	9总全国探花第二次黄先生代班，甜美白裙妹子舌吻摸逼透视装口交，上位骑乘后入猛操呻吟
dd07777190651deebc9ab7cd2572635180e79654	123908204	1	两男一女户外调情勾搭专往没人的小树林里走，两骚男把小少妇扒光激情口交，渣男后入爆草骚穴叫的好骚啊
dd5a3febab5dc80aab50f045cafcf4dc4ff724f0	62657487	1	大闸蟹 豪华精品大作-江景房重金约操翻版“小黄圣依”22岁学生妹兼职丝袜美女主播,狂刷礼物约出来足交,口交,操逼!
de163eb3b317b39101f6bcb524d289617bfc470a	8304898060	3	CJOD-296
de810af6c81d4fa28d9f920ceee51d9dfdfb5057	977611247	1	VENU-905
de59365d1a4fd95daf9c0dbddcf4b04bbf4f629f	49449419	1	短发妹子和颜值不错美女裸秀 脱光光自摸逼逼毛毛比较多摩擦阴蒂 很是诱惑不要错过
de81515ab79877c4d7eada34a75533b9e64cabb6	13616163725	6	Inside.Evil.With.Chris.Cuomo.S01.1080p.WEBRip.DD2.0.x264-BLTZR[rartv]
df9510a754943ba5d56dc67825ba22f093b7c74b	34934344	1	打扮得挺洋气的野鸡把年轻嫖哥召到古墓前的圆台不戴套草逼普通话对白
dff1bf5e196d062dafb9ac06267d52bdaeca65cc	33904614	1	颜值不错骚女道具自慰秀 情趣装张开双腿按摩器震动逼逼插入呻吟诱人
dfab2a25d13634064b7e6c0b9fd5cad97c371ef7	49817719	1	受不了高跟情趣白丝小骚货诱惑 胯下跪舔鸡巴 门前后入开操 站炮啪啪 直顶花芯淫叫不止完美露脸 高清720P版
df9a3c300306d7465de752b5bde34b3302f14eff	48881277	1	91新人Dr哥顶级大片原创-约啪附近院校166CM极品高跟大长腿制服美女,高挑极品身材,这是妹子初尝约炮的滋味!
e03ffc4105b927bc033dbb4c7ffc5e0fd38ef021	29702295	1	【战狼行动】极品白嫩00后兼职小萝莉，粉雕玉琢白皙胴体，青春气息扑面而来脱光玩弄啪啪真过瘾
e0bcdf4bd62dc45fe7e00bc2fec4f841c0798f3a	945452938	1	颜值不错肉肉身材大奶妹【臀宝】跳蛋塞逼逼自慰秀，快速拉扯翘起大屁股
e087614ff93f90cf192f7303301833e28a8a418b	181487820	1	民间脱衣舞秀场表演精湛的肉体秀 引来掌声陈陈
e1d5760d2442ea16756df8917bc6e793f3b9f560	29351619	1	颜值不错90后小少妇直播 粉嫩木耳插穴自慰
e13a7d1d291de285921ee2d198fecad74aea4890	47769832	1	情趣女仆装小嫩妹身材前凸后翘 被男友大机吧后入猛草
e1aa002728c151afff48fa9a6d4452a46f47bed2	18190553	1	【国产夫妻论坛流出】居家卧室，交换聚会，情人拍摄，有漏，有生活照，都是原版高清（第三部）
e15c49e9cca9f75e820b5bc93c180bd661c870de	18769734	1	丰满大X奶可爱妹子约粉丝宾馆啪啪,观音坐莲扭屁股快速骑行,像是男的被艹了
e349446ca91e7a772bbe56bd972d2b3d64cf2300	21410778	1	年轻漂亮嫩妹高潮昏迷了0404收费秀 和炮友口交啪啪
e36e1e5a61e990317fd54b8af497f2bd95842c26	40557799	1	首次醉酒后啪啪，一炮收入132983金币，【Avove】微醺的小骚货，异样的风情，大屌无套插入，娇嗔不断瘫软在地任君发泄
e3faaadb82870106909da57231d961900f614ee7	36054474	1	情趣酒店浴室激情性战隔壁骚货纹身人妻 后入怼着操翘嫩美臀 小骚货敏感体质高潮浪叫 还想玩3P求刺激
e4f89fa6c3faca305a49d03baac991a82e6f4777	258458609	1	抄底又一位极品超骚窄内丁字裤高颜值女神的裙底风光,高跟鞋气质完美
e4a1cf49e9b6f16e98280b7f7460d5024a891bf6	22995059	1	颜值不错御姐美女主播叶子直播大秀 勾搭男人激情啪啪
e59e3832b8d20ac76c32889e640587e8e444e02e	2198805873	3	Boese Maedchen schlucken alles
e5613c92f84fe39c4ce0a88d9be0e55b4c739d67	27860876	1	丁总全国探花约了个马尾妹子啪啪，沙发上操口交扣逼抽插猛操呻吟娇喘
e5b5e1e4496177eabe86d12c36b0e970ae62f5ca	25212906	1	风骚御姐少妇 穿着开档丝袜激情口交啪啪大秀 十分淫荡
e6a8014c6117fb332d47c69f19b84440a1a5f564	27285130	1	戴着面具 身材苗条的妹子和炮友啪啪大秀 吃逼逼 口交 女上位各种姿势操逼 内射完 又自慰了一会
e731689d9583b383e86305fd37ee31f88b6879c8	1308487356	1	样子猥琐有恋发癖的土豪包养洗发水女模特露脸啪啪啪第二波玩发玩逼然后边拍边草还玩发交
e72bcf7b9422c55f086b571e0699cb95eb8688ff	20848334	1	【白嫖探花&技术博主】第二场继续干爽她 博学多才 化身周易大师 跟喜欢研究星座命运的大奶妹聊得热火朝天来一炮
eac6aa3cdbf36bad3db4515c90894aba0f335c70	1185670706	1	苗条漂亮的年轻小美女一束鲜花就被小伙骗到酒店床上,想干白色情趣服爆操,干趴后又骑屁股上后插.国语!
eaba3ed9f325c25855a0dd0db309e757e5babf81	32391889	1	如此淫乱的KTV 两位小姐姐打一炮每人要500块 居然可无套 唱着歌谁想干就到卫生间搞 其中一位小美女很极品
ea2344b7baf58ae13881dd536a5ff82e775817fb	95900538	1	小宝寻花第二场极品颜值苗条长腿美女，舔弄上位骑乘抽插猛操呻吟
eb02a7867638707a799bbdec7f7f9309f17f7bc5	37003390	1	颜值不错少妇夫妻双人啪啪 口交逼逼无毛大力猛操舔奶头呻吟娇喘
ec79dd6f9ac1e445ebf914c082b60ace42c462ed	48816789	1	最美白虎逼，太嫩太美了，看一眼就受不了了，高清精品
edf2324e7edd7ef10d074e2e4a3689a7034faaff	39492457	1	大长腿模特身材美女 白丝袜啪啪 炮友心急猛地舔逼插穴 两连炮输出
eee6e07bf1cd74dec923bcad39efd46521d9f641	18581793	1	极品99年嫩妹子和网友玩3P大秀 轮着操 场面淫乱 一边被干一边帮人打飞机
ee3b248e3c601b1e0034b5552305fe2836ac9f4c	43665311	1	熟女人妻翘臂小丸子 双道具露脸紫薇秀
ee0bc4d60310fb5ced0bdca4d5adaba22572f192	152755416	62	kpxvs.com_[原創] 干就完了
ef6199fdb4d7bb7edeac0ae6f7206e3181b94a12	55716914	1	蕾丝爆乳佳人（此为主播名字），露脸情趣兔女郎灌肠玩耍，道具摩擦骚逼爽的不要不要的，呻吟可射不要错过
ef6e0d783e82258fc38ed0a2461f8f0625abe4a9	31420020	1	【泰国红灯区】眼镜男约了个大奶泰国妹子，口交后入大力猛操呻吟娇喘
f0bef341e61bc2bc83a02d1c4981eb9e3c79f44f	37752638	1	骚气面罩少妇和炮友小弟双人秀全裸舔JJ振动棒玩BB 上位骑乘啪啪喜欢法人不要错过
f0550007b1d81014cea811507298fa77c9c5bce6	26463887	1	对白刺激自然主题房中年光头男约会丰满情妇她说草不了大叔软磨硬泡又抠又舔各种挑逗终于成功肏进去了
f264c9ec612921b574f5d8684e48345c14958461	1954439598	1	A.Thousand.Times.Good.Night.2013.BluRay.x264-BulIT
f2db57fb66a5feb8507898809a22207de77a7f65	191108287	9	Dan Romer & Benh Zeitlin - Beasts of the Southern Wild (WV, 2012)
f352db9db3bbb53d10817501123556e60a555210	82640407	1	萝莉精品：夏茉果果套图之电影院+汉服白丝+花边袜+15V
f47946a87ab390a6822448bd89f8a413d441bd10	252154230	29	Danakil - Live à la Maison (2021) Mp3 320kbps [PMEDIA] ⭐️
f4622b0cac3f5420c8844f4dbbb8c4ea4f5ac238	1409335930	1	Omnispere 5.1 Complete v5121 (The Pirate)
f435b1afb7dad9826296fd606a443d987028537b	4712125067	3	Bloodshot.2020.720p.BluRay.x264.DTS-HUD
f4b77e1b6618ac3d2ba34768e68a02a97734fbe4	58710584	1	身材苗条长发美女主播第二部 情趣制服开档丝袜高跟鞋自慰抠逼秀 逼逼很小粉嫩很是诱惑不要错过
f43b982625d815672ed45cca875fb74b30111ce9	32901414	1	身材高挑御姐主播收费一多自慰大秀 蝴蝶骚穴淫水超多 激情自慰十分淫荡
f4b9cf0aa7dbe64984b5abbab73a1589a40d43eb	15580035	2	Corel DRAW Graphics Suite X 9.2 2018
f678256c0e2149a23f631ea2c74cd8bce0191f42	115029802	1	骚女孩不穿内裤逛超市，还撩起黑丝裙露出，买了一个家具，上了车迫不及待拿出来自慰，爽喷很多淫水 好诱惑啊！
f6acd7df1b39098ec43239856ed41c5abc68d89f	76295498	1	最新爆出天博集团准新娘刘彦杰宿舍和领导玩人肉三文治
f7ae755cd38b6696c246f0d508f3504aa592e65a	70451672	1	无毛一线天馒头逼模特小妮被几个摄影师摸奶掰穴
f777aefcaa377fac831d26ba181c8be87fe1f5be	21226253	1	豪华酒店TP漂亮销售美女为了业绩单为客户提供福利,有点不好意思趴在床上看手机被男的慢慢脱掉衣服爆操!
f879d00b2053a37c86315b0c24225858aff5f050	208164887	1	精选裸贷特别档A罩杯主角，漂亮年轻妹子闺房内脱去可爱睡衣，掰穴揉搓阴蒂自慰阴毛真多
fa88a02f33a07cd70dc24407b9cba9048473a4d4	26400147	1	小七小天探花高颜值性感包臀裙眼镜妹子，穿上女仆装黑丝自摸特写口交猛操搞了两炮
fb7938a72987c11a3bacc5f4bfd4d4060b243808	27872187	1	小姐姐S穿黑丝帆布鞋白色板鞋调教蹂躏男友 强制吐奶
fb1b9dd9111f5e6cdf4e265a709b3a2db23a3852	883235591	4	A.Time.to.Kill.S03E06.Undoing.Behavior.720p.WEBRip.x264-KOMPOST[rarbg]
fb63af25481f26af0a428de17aeefe324d4d4187	32031117	1	火辣人妻两场连播露脸哺乳期挤奶给你喝，道具自慰骚逼高潮，大哥看的受不了舔逼压在身下爆草，直接内射，吃淫水的样子好骚
fb5b045796477166eb8a2f03814b526df5d3a0f3	99237620	1	【网曝门事件】纹身少女姐妹花Holly&Lila与长屌外教老师疯狂双飞不雅视图曝光流出 高清私拍1V+95P 高清1080P版
fc35605c41ed9c8227292d5166a977cd9faa695d	33202358	1	【全国探花】探花元老出山，约战深圳大圈外围，近景掰穴特写展示，氛围拉满调情高手
fc77a9258fb13bcfe11b147ace0c3dcb1c379d93	20308676	1	漂亮美女主播先是被炮友舔穴插穴 然后两人开始激情啪啪 姿势多多 很是淫荡
fd1f4dc27afb0a4a91a682f4e0729fd2e446b412	35692622	1	[推特] 极品推特女神【JessicaFxxk】跟同事单位宿舍大尺度啪啪特写
fd4a020b2f5288b59b99170edccd10f861018330	135471566	1	长时间跟拍抄底牛仔蓝色透明内,这个真心赞,完美的后入姿势,清晰鲍鱼痕迹,大PP怼到脸前的刺激
fde92ee98fed03e105af03c22b371435f975a44f	314167146	1	BrazzersExxtra.21.05.21.Adriana.Chechik.Splooge.On.Me.And.Ill.Squirt.You.Back.XXX.480p.MP4-XXX
fd90862c122fd26210594391b075156e3553efab	31637296	1	精选裸贷特别档女神级别主角五，为1800元漂亮大学生妹子在宿舍脱光，裸体展示粉嫩小穴
fd850903845499effa8a76c33df9c99a1d9d22e6	160843101	1	Xfer Records - Serum v1.04b4 (Windows 32-bit & 64-bit)
ffd0c3d7dc4b62476b7a2af1be6e61e1ed7423e4	732818553	2	Kirari.Vol.3.Ameri.Ichinose.JAV.Uncensored
