78f0dd6204c798905b18dde03f4741f36b8e508c	19286484	1	中文译名：知名嫩模周妍希大尺度拍摄现场完整版
78f223267ecebcd2d0bf3ade83ea0f0e4cd19a8c	23219575	1	高颜值挺嫩苗条妹子全裸诱惑和男友啪啪，毛毛浓密掰穴男友扣逼上位骑乘猛操
7998b4e6c151d4fcc12e2a0fc20638d3d5460517	26899422	1	别再往上放了别把鸡巴废了乖女儿吃冰棒要和爸爸玩冰火结果草完被爸爸用大黄瓜插插 对白超级搞笑很有趣
7a9e36a7bf07088ba081c210eeb7d1b3ab008f51	18314560913	9	The.Sinking.City.Necronomicon.Edition.elamigos-games.com
7b5716eae3f61a57a13163ac3c825600df781a1d	30300439	1	小宝寻花约了个高颜值白衣马尾妹子，舌吻口交翘屁股后人床边大力猛操
7b1113790ec91c39ffce58708efe07c8ffe14bb0	23670424	1	眼镜小哥剧情演绎偷草正在给少妇做全身推油的美容师
7cbde248baf1716160019a037baa919a947a562d	29494722	1	新来的小夫妻首秀，清纯女友被渣男带到宾馆直播啪啪，无毛逼逼洗干净开搞，全程露脸口活多体位啪啪，射嘴里
7d3471cda70cf61c61703c7b0f5c695305788c23	3402525663	8	MotoGP 2021 - Round 05 - FrenchGP - FP3 (1080p50 DornaRip HEVC AAC x265-deef)
7dae5c657db1ea483f013c25c674d5c846378cb1	57399087	1	国产美妖被直男用高跟鞋玩弄长腿黑丝伪娘，高跟鞋搞得伪娘害羞温柔了 想要吃鸡鸡！
7e6d19874391adc02dd3bac7120ce2ab8fe24916	53774897	1	酒吧艳遇爆乳极品身材白富美骚妹纸 酒后兴奋无套多姿势爆操内射中出 骚货竟喜欢肛交 国语对白 高清无水印
7ed911dbccada09a8b8959bc3842448d87f1352a	62141269	1	91王老板高价约啪外表素雅长发气质苗条美女公关说王哥做爱是奇葩要求花样太多美女不愿意了对白搞笑1080P原版
7ee688834ce8fa63c7ed3cb1aed524e37c4baafa	33549235	1	无名美女嫩妹打炮机自慰
83e9dfb82b6da2d60e1829e0a7c6bc97e7a19eba	1973604838	3	DEVOUR v1.3.2 by Pioneer
8326ecfaeb41c76307f698718ecb59b2ec1080ce	41401290	1	武汉奔驰哥花了几万泡来的年轻小妹子，疫情出不去在家操爽了，身材极品颜值高，可惜身体不行没能让妹子满足
83e61dc8a2f9e7ff9df90ad6fbe2055803c477fc	1523118665	7	32
833c71ef6394d3c9d94d0cec62460dbe28f074fd	33699878	1	91大神9198K新作-暴力淫操白丝短袜蓝白比基尼情人 阴毛密性欲强不停要大J8狠插 爆操内射 高清720P完整版
85151cecd1375536c00a8d1d31cb4d3ab5739745	14292230	1	MD0071秦可欣变身情色业务员 私下接案 色诱激干
85668ab58cacd11e7333fb59f8ba87cd7c1162a8	40197335	1	性感漂亮模特Lena Anderson牛仔风格楼梯上自摸诱惑
87baef1154108c70effb77e598a7bc4cfb65af27	3647381976	1	FC2-PPV-1800271-HD
8753ea3460ae5d9e98c09f938f2d46bd7700c276	41084470	1	风骚有韵味的少妇 椅子上大茄子插逼自慰秀 超大炮机插逼快速抽插 享受快感 道具双插 非常精彩
895499079a1a50a2968a4768441c25bfa276dc61	88002686	1	九十年代清纯极品少女倾情奉献演绎命运坎坷和两个渣男之间的B惨故事！！
8a14b4e952700e29665f18ec0695c8b24d59145e	44367865	1	SWAG国产AV剧情美女菲菲到姐姐家吃晚饭酒醉床边偷情已婚表姐夫做爱口爆吞精1080P高清版
8b737af6b3a3007c2f4ee4fda9e1fc889f8cc80b	41963536	1	【萝莉和御姐姐妹花】高颜值妹子四女两男，情趣装女女互舔性感翘臀上位骑乘，
8b6bb8fa8a773cd7796f7efa24a22a7c07f1e22f	1275999164	1	(無修正) FC2 PPV 980330 (UNCENSORED 720p) 個人撮影 - ゆかり35歳 フェラ大好き従順ムチムチ巨乳奥様に大量中出し
8b4678101469a31ccca4d3f8722067335bac6539	27343536	1	丰满身材双马尾巨乳妹子双人啪啪 口交后入猛操性感大屁股
8b5b5337dca2b36a4cd724f267381241da686a62	28632201	1	私企小老板中年大叔宾馆约会漂亮气质人妻少妇情人连抠带舔69多体位啪啪玩的相当激情不输年轻人1080P原版
8c8d3ef5af0cd6774c105fe83a1b74f69c2ab443	52734132	1	新来的同事很积极，每天都超认真工作，就连假日也会主动一个人进公司加班，美艳的女总监默默观察一阵子之后，决定要给新人爱的鼓励
8c834527553621745c72f5b0692f8ca399c01187	26329070	1	【精彩泄露】湖州护士董某某高潮紫薇尿尿等精彩自录
8ceb377976ffc2ccf6057152d416a5982bca5ce4	23037648	1	小骚逼和男友吵架了，出去约炮给男友戴绿帽子，各种姿势配合骚的一逼
8db1e605def39db78980f59c0aded5bd5d4e8bd4	45113167	1	推特32位极品福利账号视频
8e95796425bc55e91c90d9ab5a2d679c535b9763	78850075	1	【护士制服系列】性感小骚妞护士装玩制服诱惑 深喉裹屌舔蛋非常给力 裹爽了无套骑坐大屌上抱着腿开操 特淫荡
9050aece65d7b230409481694a26eef05a77ed68	46261482	1	最新微博网红美少妇『柠檬喵酱』520高级VIP会员新作-条纹过膝袜后入速插内射 线下约啪女上男下 高清720P版
9027c23ed19f770a55d51ed10a682cad57089279	556941636	1	年纪轻轻奶子却超大嫩妹美女巨乳婉儿 一多自慰大秀 丰满双胸激情自慰很淫荡
91341ecf55f8a952d4f24549172f5e1e41afb332	44087801	1	高颜值不错大白美乳妹子双人啪啪 深喉口交上位骑乘抽插最后内射浴室洗澡
93e26e481d3b88bb6b841637dcdc777eb599ff5f	64228703	1	露脸才是王道大庆哥工厂楼道爆艹银行职员副经理真骚，干的骚货直叫好爽720P高清无水印
93eee7bc680fa7f4a3fcce33bba176be4e433069	39044267	1	身材纤细性感高颜值艺校年轻美女家中全裸跳抖音短视频热门舞曲又可爱又性感真想把她按倒啪啪啪
936c39b1f9917a3b04e147c2dd9e2f9a617088b0	87464199	1	台湾最新自拍！骚气学生妹爱吃大棒苗条诱人后入爆捅!
93ebd4cdacee1f72af3d436e4ef6bdf9d6242bf6	61386396	1	官方认证良心主播大萌萌猎艳城中村扫街选逼卖肉的是真多70豆带活儿干一个会说骚话的小姐完事又肏一个呻吟声一流的皮裙鸡
94e1d21a19bae15579b07e21178190c25f6d7e0b	114324717	1	国内某商场女士试衣间TP 却拍到妹子直接把衣服塞进裤裆就走人让人无语 身材不错还挺漂亮的妹子
943b8bbcdc4ed41b1948cd136af8418ea9427a23	51791116	1	专操学妹探花大神【龙哥探花】和老铁3P轮操巨乳黑丝学妹 爆操抽插 无套骑乘顶操穴特写 爽得呻吟娇喘
94733f44ba23ceb22a1eb24fa0cfbbbe4e707b24	71123247	1	91混血哥超火爆顶级巨作-双飞上海177CM制服诱惑极品高颜值姐妹花 叫床淫荡 完美露脸 高清1080P原版无水印
95292fbc9182785435a9c1f28c8afd334276761e	20196328	1	精品酒店电视房偷拍说方言的男女开房啪啪前手机自拍一下这房间的屋顶貌似能看夜空
957b53bf9947d6d441f4fce377dc73f5c7321645	20587696	1	酒店最新偷拍合集,360终于发力爱好偷拍的狼友有福了
9591d7c2edc1fcb4fba859e89f670c2fc0320a73	12471755	1	乔总全国外围约了个网红脸妹子TP啪啪，椅子上调情一番洗完澡开干，口交猛操上位骑坐抽插
96e3d68e828b14463da3f6e3a9f811636e2a7354	79083827	1	漂亮留学生周末在家与洋男友享受性爱时光 各种体位疯狂操逼 高潮连连
9798eeb45f4ebcc427e45c9aa62130c4d9581eac	68089766	9	Lustans Lakejer - En Plats I Solen (Vinyl Rip)
979ffee8aab95a5bc559e9aac3933b91476e32d1	994456955	1	91沈先生探花约了个两个妹子双飞，屌太大一个妹子走了口交骑乘站立侧入猛操
976d25137d127f270841bb7459a23e04c9341fd3	11263994	10	NCH VideoPad VideoEditor Pro 10.43 [En-Multi][WithKeygen]
97dcaab78116456902c917e7646668bd657d52e3	1897599178	38	MIAD516 AVI
98d77919f449c2650b4705dfbbac8e505ba95af7	18779672	1	气质极佳高顔值大奶性感御姐诱惑紫薇,自摸黑沐洱,娇喘呻吟非常诱人
9a8565272c088643a6bae9bf74e7be66a556ec1a	127472198	6	Plants vs. Zombies
9ac2a0070193168256e397cddec66771d7093665	828561010	1	灰丝高跟骚主管勾搭来应聘的小弟弟啪啪做爱 刚还说还很羞涩 后来提枪上阵一顿猛操
9bbc53fd49815414a1520517325462b4d8c5e6f4	21640181	1	很是水嫩清纯漂亮小嫩妹和炮友双人啪啪大秀 无套女上啪啪
9c3c74e7f8c02ad08f2a403e8f18209d6a880519	26964683	1	早期东莞ISO桑拿系列5 胸大臀圆的技师艳舞诱惑过后口交上位被艹的欲罢不能
9c65fee7ee857bc695fb9ed050733d28fdbedd29	65302668	1	98年艺术院校漂亮小美女周末和帅气学长酒店偷尝禁果,鲍鱼粉嫩干净,应该没周末被干过,稍微用力就受不了大叫!
9d187a084a305564653b0a732a7920f526477017	32870034	1	某航空漂亮气质空乘小姐与男友滚床单小伙很会调情终于把妹子降服给口交打炮多体位抱起来狠操国语1080P原版
9d58665c349e122bdc2a8241eb678307ba96da20	1060637579	1	颜值女神级别还抽着烟的霸气小姐姐和炮友来一炮 还嚷嚷着你会不会摸啊 奈何猥琐男小鸡鸡太短 没有满足她
9d1d8582b71c5ff3e8f6a0b948e330b36c42c0c9	39471859	1	【年度盛宴】最新台湾SWAG年终性爱聚会私拍流出 一小时激战轮操众性感女神 黑丝爆乳淫叫
9ea75ec4c62f2258620f0e3d2320cf24ae052c29	25987766	1	颜值不错美女直播大秀 自慰洗澡极品无毛粉木耳
9ee20884e6db8cd379b5442725abd86928189fd6	42259787	1	虎牙TV正恒 花岛主（斗鱼TV唐曼）视频及土豪定制44V
9fcb2e857443fdc2ce4f47513141a4d520d39fee	979667146	1	村长探花酒店嫖妓偷拍招嫖小卡片上门服务的年轻大奶卖淫女4K高清画质无水印版
a1e9f331f3b195dc61095fd98f32f34920630b41	47098035	1	爆草巨乳纹身妹 这凹凸有致的身材紧致的小逼逼 真是完美
a1fec15121f62b33b2af412e243801eb9047e9fa	65235306	1	极品美乳娇俏小情人空姐制服装 等不急了让我干 这丰臀美乳操起来真爽呀 妩媚挑逗 后入猛操 叫床呻吟
a315073fa228afd3207a26c7719ee06f9ad18e06	5538187077	21	Олег
a3a17e152010ecf18e4d8efd787d7ddfe782fca1	2815132073	13	www.xBay.me - MrLuckyPOV 19 08 30 Jill Kassidy Fucks The Cum Out XXX 1080p MP
a4dd821a6b2298f5ba2e2796b86a2a56ab20ec71	56996754	1	精致小美女这样纯骚玩起来很刺激挡不住冲动想插作品 妹子白衣苗条娇小玲珑逼逼却挺饱满操穴性奋硬了720P高清
a4d7c1958b6de664e1ef9999a6977fc77bb778e3	44068476	1	专攻校花守护者〖校花探草〗约炮高颜值校花妹纸啪啪 各种角度猛操极品嫩穴特写 无套抽插 逼紧人骚
a5698effc3d35e6ed13d93f555759fb11c861928	685359290	2	Black Widow 2021.1080p.WEB.x264-gooz.avi
a5af607b4b6cbd169bae367318f97e1282fa68e2	33562255	1	苗条大长腿少妇开裆黑丝高跟鞋啪啪，口交足交后入骑乘大力猛操非常诱人，
a5eb35fab8e94e355f518f4e032f81293efc04fa	51750200	1	EboArt原创第2季：八个技师各有千秋爆乳制服诱惑 骚穴摩屌情到深处舌吻
a6ce19b60b09243ee9f5c6596f35bf1e3d2ad845	71549755	1	大神享受俩妹子一起给打灰机 一个负责撸一个旁边调情好爽
a64d5f9587f4de44ad4089ed5eb2d216625e52c5	15007275644	12	Muzykalnaya.Intuiciya.XviD.2021.SATRip.7turza
a751a5d0fd4d4bea193f603544f8b698fcf901e6	173681894	1	推特极品白虎嫩鲍福利姬希希酱VIP福利9G合集
a86f10f049e4d72004195fb0f4a4b1159ebf8b8b	343480528	28	It's Your Music Vol 4
a9043a0b188c791bf5bd0b6f0e5911a575c84368	43506067	1	14位星恋主播，颜值超高，性感妩媚收费视频流出
a9973c8fecc3b7f526d99ea9f6e989fdf3e3926b	1004189484	1	VAGU-223
aadca6efa656ee7db76957fe128dc61c7c237c61	2608388917	1	逼逼无毛苗条身材妹子自慰秀 情趣女仆装白丝跳蛋塞摩擦沙发上道具JJ抽插
abc6fc2b204bb5f75e6aa046ab93c2aa343dc6d4	101189917	1	最新推特知名博主〖萝莉淫妻〗大尺度性爱私拍流出 后入抽插漂亮丰臀 镜前后入 高清私拍106P 高清720P原版无水印
ac0e45feca13bdcc54e094f69cd01e2ea48ffa60	67445881	1	绝美留学生李天宜与男友大尺度私密照外泄,便宜我们这些吃瓜狼友150P+19V
aef5f8126373dac5898128c460221ab326ef4ba8	53150349	1	【高质量难得的精品】黑丝御姐
af1f16aee40e3e899348b2fa6a17999a4f9b560b	17033001	1	汗流浃背的狂插可爱长发女友
af4d8a94f082510f0148157c02070c72d4ff39bc	4359202003	35	JUFE-289.HD
af465f7b7e307799acdf3ce2d5b66595ae588bd3	41366415	1	苗条骚气的粉红护士小姐姐和土豪哥直播激情爱爱！努射一脸精液
b19c79983f642c632a97cfb521a26c68a6b08b62	96132134	1	一箭双雕闺蜜两个一起洗澡一个浴缸里面泡着一个坐着洗
b1fc42df18037ead063198a32f3973b1269f71ea	23781351	1	颜值还不错的清纯美女和3网友相约群交啪啪,在车上嘴里被迫一直吃着鸡巴,到家后扒光衣服同时伺候3个插逼,国语!
b21eb5f5d25687901129ad4fb668fdd534a65259	46484838	1	城中村嫖妓妞年纪不大技术还可以先口活再打炮
b36243bb5f0775a10433ef868cd5e7945754cd05	605706908	1	微博红人 兔牙萌萌VIP付费视频 高清原版 第一部
b3f7794c6ef8464224af36e4c578bfd700bd9fbe	139188907	1	漂亮美乳淫荡嫂子爱露出 各种乱交放肆抽插浪叫 性爱啪啪露出3P群P淫乱爆操 轰趴派对篇 高清1080P版
b389d9c8621db7c1675f15dcfebf48c5be4acad4	28646592	1	网吧里的小骚货全程露脸跑到公共卫生间里自慰，直接骑在马桶刷手柄上玩逼，嘴里叼着内裤坐插假阳具呻吟
b43591e65de8d14e84b46841b017c9e9d41f71bb	47355995	1	美女镜头前自慰，跳蛋假阳具都用上，插得淫水直流
b56261287d8ea59073bc0aca765072001acaf591	82994522	1	90后留学白富美，插的太深，开始壹直喊疼,后期主动上位一直摇，玩的太疯狂了
b661f69949393a66d388c39f6e2b8ad4144a0baf	416199078	50	VA - 10's Radio Gold (2021)
b7f3942bdfedb1243781befef1f27a2f2ba0ef4d	38016196	1	最新流出视图骚到没朋友的私圈大二气质美女吴X晶宿舍旗袍脱光自慰样子淫骚很有撸点
b7fa9a3b8d3c10abcd33879ec38cfb8592544e55	711326014	1	大学城酒店风情★高颜值白嫩美乳翘臀学妹会战男友 无套后入丰臀最后爆精内射 叫声好听
b7e2d20c50beca04bc4f25c8040217020d015194	1469321095	6	Dirty.-.Blo.n.d.e.s.avi
b925ba0091e3bcfdbdd438db970cbff97264930b	19520959	1	刺激战场小哥享受会所女技师的全套服务，胸推漫游毒龙舔脚，深喉大鸡巴主动上位被小哥各种抽插轮草真刺激
ba54aa16d58fc0f53c2f048dac804e08b12ef132	32161125	1	颜值不错 身材很是丰满御姐主播直播秀 跳蛋震动棒自慰喷水 十分淫荡
baada60a9e62e91265fdca2a05a35c7a6d677068	35220168	1	魔鬼身材网络红人鹿少女无码露脸制服啪啪自拍视频
ba1f7ed6f2ac285c90a1c1d6b39593de954302a2	90794353	1	摄影大师风吟鸟唱潜规则气质美女模特身材匀称啪啪啪表情呻吟销魂非常投入把大师爽坏了都出呻吟声了
bae6a7405c75bd6b7b91914c3e08c2d49517e6b1	535907430	1	黄发气质白嫩美乳性感靓妹开始有点害羞,被强壮男在沙发上扒掉衣服玩的想高潮后主动在床上求操,太激烈干流血了.国语!
bb002e23c8eeb597e65f370de5c717d85cce6b8a	29989289	1	颜值不错大白美乳妹子吊带装诱惑 脱光光道具JJ抽插自慰非常诱人
bb110b8bc81df2bbf60dbb2b82ab1b106a5a9acb	68472247	9	Voxengo.Elephant.v3.10-R2R
bd6b2d97c1c659ed7ae5dce602652a763807ee29	389169566	1	百度云泄密流出某电报收费群推特大神joker被捕前最后作品毒龙口爆啪啪极品纹身妹
bd4e40f393f0c3f669cd2cc20e4793d850884b51	40268046	1	极品骚浪美少女【颜射颜射女神】小美女和闺蜜炮友偷情啪啪 无套抽插大屌速插浪穴直怼子宫 口爆吞精
bef92a681407d41c6d34c7acfb76f7eb45797a8f	23246449	1	超嫩眼镜学生妹『可爱的小骚』大黑牛自慰喷潮两米多 撅着白雪屁股后入啪啪响 娇喘声超带感
bf359381eab0a05149c640f041d0919632c707db	21453877	1	清纯可爱女神美女 家中与男友家中爱爱 被干的睡眼迷离
bffdc50ae811592c55810f3e5d5fcec142fa3fe3	43069676	1	激情小野猫户外车震颜值高奶子大又圆皮肤白皙，与小哥激情车震自慰呻吟勾引，被大哥吃奶玩逼多体位爆草玩两炮
c033d3eb3226e806881f736842c312db9b93d828	54740237	1	国产经典极品美少妇肉肉韵味挡不住气质尤物操穴虚了作品《狼心不轨高清字幕版》激情佳作 有颜值有身材硬啊
c06c8aeb7eb0443cbdde8a47307e719b73b966cd	14277518086	7	Call of Duty Modern Warfare 2
c119f401a30aa2c54413b9dd54c8ec097788a68e	665696077	1	甜美的美腿御姐露脸搞3P 边干她还边给人舔鸡巴 像极了岛国爱情片 美腿穿丝袜扒开个洞就猛操她 仙仙欲死
c2339bcda840feb5a8c7b6656ce6a384c0673425	1865188550	3	Table Manners (2018) [1080p] [WEBRip] [YTS.MX]
c256ad6945f8756115c0e8cd0ffd5f61d6ddb8a4	2177671793	3	Battle.of.the.Asses.2009.720p.BluRay.H264.AAC-RARBG
c2890a192720645556bb225284122a34935ec9af	553554064	1	最新富二代高端约炮极品外围女模清纯可人身材一流气质好相貌出众站位肏沙发上肏内射中出白虎嫩穴2V
c49172409dd1d0112ca137744e72406016e3a277	1489022839	1	精品酒店偷拍气质美乳长发白领下班后与公司领导酒店偷情,美女进屋就想要被男的操了4次终于彻底征服了!
c696ffab2d54d621a9d31845adc08526309b9876	86199335	1	甜甜的小美人一个眼神就能电倒你，露脸清纯可爱奶子很正屁股翘憋在家里做直播，逼逼很粉特写诱惑骚浪呻吟
c7d79b83cefcc25ed62e0458ae0f8be92a64d670	20873674	1	身材苗条骚情主播夫妻啪啪收费大秀 做爱的姿势用了不少 鸡巴在穴内进进出出看得很是诱惑
c7081877668c9dace312129626d36655bec61a87	33024907	1	极品尤物完具 —空姐制服收费福利视图制服高跟黑丝ZW
c8ab021b94c5b3c27d11d1db7dedaaa23afc1440	15434777	1	【顾陌探花】小幼师背着男友做兼职，漂亮清纯乖巧，美乳翘臀肤白如玉，水多穴紧这一炮值得，高清源码录制
c800a92ef1b1702d05f10aaf9b51f3e8a647efdf	1914656299	3	SSIS-072
c9bd7831f200ed070b815f9f8507c526817a1b5b	54471481	1	最新国产剧情A片漂亮美女叫外卖外面下雨送餐小哥被淋湿拉进屋里帮忙擦身体挑逗小哥J8硬了掏出就吃被爆操对白淫荡
c91f7b3972420f6178f1e35e7afec6dd83621d9e	1686183628	1	SPA会所男人的天堂偷拍猥琐光头佬大叔做大保健毒龙吹箫一边抽水女技师
ca0e9d28feb1044b7c57c68452b554a815e8c749	37919031	1	极品网红美乳女神麻酥酥哟会员版之性感大扫除 谁说美女只能干而不能干活 高清私拍26P 高清720P原版无水印
ca19a5af81f77026577b3596c613a256a0d5f86c	31266905	1	身材苗条 皮肤白皙的长发美女主播 穿着白衬衫在公厕里面露奶露逼诱惑 手指插逼呻吟自慰秀
ca3a7be1cb95ec76d8814ef9e2b94402d00e65da	34654351	1	《稀缺房源（红帐房）精选极品让你身临其境！》日系打扮的丰满少女
d00854bdc292575f181e049b57c6013d9116b0cb	54586218	1	桑拿日记之山东潍坊妹，高颜值 服务好，第一炮射快了按摩一下结结实实又来一炮，舒服
d1844089c915a3a784193b3f23c5001a00add96b	25823180	1	搭讪身材性感的齐逼短裙大白腿美女,美女貌似喝多了大哥出租车带到住所啪啪
d1e5f324201b599d04c20c18292d0d7013929783	3785734613	11	Great Race, The (1965).720p.BluRay.x264.AC3.RiPSaLoT
d2752962387c903995be7e1cac09b5d394727e50	16153430	1	91沈先生换换口味上门寻找炮楼，选了小姐做服务穿上黑丝乳推舔菊
d2b50d4ac30b09e5d45aef58c94413cad2881f95	49243815	1	最美2020极品爆乳女神『麻酥酥』新版定制私拍新作-樱桃诱惑短裙 豪乳女神的极致诱惑 喷血美乳超挑逗 高清720P原版
d30718b934fed6e554693c0dc61b2ddcbabeddaf	34287752	1	你的小丫头 白嫩漂亮的美女瑜伽老师 全裸发骚 特写BB 道具自慰大秀
d491c71510986f92f7391b435bfb7fec2e13e01d	45634914	1	昔日恋人大学(老师)N.Linh 奥黛年 女上顶操蜂腰美臀学生妹 恋爱激情做爱自拍流出
d4d6c48e5b7caf2f3f4312601aaf05f2185ffd9d	142622299	1	【真实灌醉】国内原创巨作！美女姐姐被灌醉后死猪随意玩无知觉第二部！
d46c16702a3f5f798b270d6727171325f9e85abc	91447458	2	[A.I.R.nesSub][Recorder_and_Randsell_Mi][tvrip]
d4724831622237a9329d8f5ed323fa4ac3f129dd	138274233	1	【真实灌醉】【国内精品原创】气质丰满美女在车里被灌醉后带回酒店随意玩
d55892550e1567caf2a5a87967bd79a0651d8b72	41541541	1	超正萝莉体型高颜值女主播（你的宝贝）直播全系列
d524e089c8a4115cefb22ee351b2aa6a9aa7ec83	90220425	1	露脸大操风骚少妇,这次开发了她的菊花,都把她弄疼了
d50ffb5ecb895b57f61976c3234cf6a5dad7eed8	494537936	1	美容院老板娘搞上瘾了再次约炮这次吃了颗伟哥一晚干了她四次说她没体力了
d715db443bdd9db7f907215caa667d976e965efc	108948640	1	精东影业出品国产AV剧情新作JD008-那些年一起追过的女孩 户外野战车震酒店各种操 高清1080P原版首发
d8c706df856d5a682bbdfae4b083118ff035e54d	18272160	3	윤주 (YJ) - 흔적 [싱글]
daf1e213752e99fff1655a106ce8e8b71a4d813f	20684005	1	高颜值嫩妹十七雨季道具自慰 性感短裙翘着屁股逼逼塞跳蛋地上震动拉扯
db9fc94b0ec5efa670a5471252d932d5f2c3521e	195183974	1	最新流出门事件飞行员与漂亮女友的私密视频13V啪啪合集
db5d6c0624dc616f146f8d3c1c1edb4ff6017285	58545153	1	【百度云泄密系列】泄密3部曲良家少妇大尺度视频照片流出（第三部）
db7b89431dd22ef11f0c77143645811bf43ac29e	63567667	22	Funkaphonix - Volume 4
db424f28fbe7cfde9680a21a52fa52f6deb741b2	39022408	1	麦家琪林雅诗两个妹子精品肉欲看的受不了鸡动啪啪作品《女淫极乐酷刑字幕版》激情佳作 性爱很会玩极品啊
dcc46f9114677b805369127d2c62573b9bf6763d	28892555	1	中年大叔酒店网约在足浴按摩会所上班的良家少妇会玩冰火两重天活儿太好了抱起来狠狠肏她
e33698ce2b19fe5d1c06b71a85d8c48426ce90cd	20298305	1	土豪高级桑拿会所体验店内头牌女技师颜值高气质佳服务到位好多花活超级爽各种体位使劲操她
e5e7dc1b0541a0cf3a79f7b118e8316815f66b58	3887932040	35	JUFE-290.HD
e562579f82bee57f5bea6f54423937f919c63eae	14997640	1	【全国探花】老哥约了个高颜值大长腿妹子，第二炮口交大力猛操呻吟
e57b1ca88f1112b07f3a21be019c45362a554feb	1231541206	1	OMT-012
e6ac65b648fd1cd940cb173604303de9b261b327	50331074	1	大学生情侣镜头前赚外快，颜值高身材好小哥又很骚，舔逼真淫荡，玩着奶子草着逼无套抽插，浪荡呻吟好骚内射
e76efe722089909690355b8a3cb30e9ef3193c55	22198091	1	“包夜可以让你多来2次,还是先给钱吧”,漂亮美女小姐谈好价钱后就被中年男扒光衣服掰开双腿狠狠抽插,阴毛又黑又旺,国语!
e7ebfc41c1bf839105fd06db2cb64cb73fd27b88	27633868	1	情感主博李寻欢探花高颜值甜美大奶妹第二场，舔奶调情口交到时间妹子走人
e80c0e59ea4ef4982bd9b2d03facc996b02a99f1	25490857	1	全网最全收集抓打小三的场面拳打脚辱骂脚踢扒衣,女人何必为难女人呢_
e9badc044101a0feb5d545c295d145e0da8587d4	893660060	2	MVP Most Valuable Primate (2000) [720p] [WEBRip] [YTS.MX]
eb2af009e5f35698aeca5a1cbc384aa279abcfec	49563381	1	“爸爸我嘴都累了，你插插下面吧!”父女晚上长期在家中乱伦多年母亲居然从来都没发现
ec9c6fc91fe6d20ef94f901eac75e71349517c39	20399264	1	超卡哇伊小萝莉『三寸萝莉』血小板cos 足交黑胶大棒入穴 流白浆喷潮 出水惊人 感觉逼在流泪 高清无水印
ec3b44852f23e504d1e8851e97b27409e8512f57	27161652	1	极品大学生妹纸怕被看见不愿到窗前被后入有些抗拒
ecc8329f5cacf76ed05b0a45672b98815639cfea	82585182	1	出来的找的小姐全脱给1000块，不要包夜3000块，口暴给800块，对白超级刺激
edeb05a52f19a2c93cdd0329b00b8bc4bf0f98e1	57921658	1	最新爆乳女神Sexy闫盼盼5月大尺度视频第二季《国航空姐》 性感制服黑丝骑枕头模拟做爱浪叫 高清1080P完整版
f0a708e3da2da29f0aca0928e2d33f5ad230fa65	75586589	1	91大神hddchen168最近认识的舞蹈女神 屁股大人也骚 完美露脸
f09aff57cf5a84c7c28c439d1d04e882d565dae4	595904047	1	眼镜哥第2季19老婆瑜伽表演勾引土豪送道具礼物,高难度动作一般人做不出来！
f32af5def1c2ce56306283fc63a170a1ba839438	343027406	2	吐血推荐白虎女神嫩模外围女大尺度刮毛写真
f4b3accd1452282798a53b6548c1bf9b337d5808	24744762	1	高颜值气质美女主播收费直播秀 颜值高身材好 激情自慰不要错过
f4d3719088f2ecc291fd2bb36106682852ef0c65	20627463	1	经典香艳打真军刺激操穴啪啪作品《倩女性花开》字幕佳作 妹子颜值不错性爱插入激烈这种风格喜欢啊鸡动了
f4ba909bc6ad9f2622dd5f3216df98d23bff03ad	2207925908	1	36E美乳性感的气质大奶秘书夜晚加班太晚领导送她回去后趁机威逼利诱干了她,开始害羞不睁眼,干爽后呻吟浪叫!
f5ea9f70dca9ddd2c53b372364c261704aeecd06	33960116	1	大一巨乳小臊妹,寝室躺在上铺偸偸果聊值播,给你展现女生寝室的秘密
f55bb711aa432532ccb4939048fb0671d3701344	194291324	4	Batushka - Raskol (2020)
f9383f315b77625655da9c0f1a9171b4efb4dd48	28051279	1	音乐学院清纯校花主播妮妮 童颜巨乳薄纱情趣内衣诱惑 露点激情自摸粉嫩逼逼
f9befc8b81650928dd1aea8fdacd70f831c8529f	414375571	1	高颜值胸大腰细的网红美女还在自拍穿着制服开档丝袜跳艳舞视频时就被在旁边观看的炮友忍不住狠狠爆操了!
fa62afd9de37e1abc1b8a3f7aa3c10507a8e0011	774906255	1	淫荡的电信客服黑丝诱惑，等在上班的男同事走后直接在屋里骚，大奶子骚屁股跳弹塞逼火腿肠自慰，水杯里撒尿
fa1ddf85d149309cb978df7486e87781c70bd91a	72844428	1	放暑假无聊第一次去足浴店玩没啥经验手头有点紧只能找了个年纪稍大点的会玩的阿姨
facb44e4c6416dd287058a6d346a27098658042b	22549641	1	高颜值美女主播韩老师 收费自慰大秀 颜值身材俱佳 自慰棒大力插穴自慰
fbd793ee24c60ca6651d2f5ebd814e3a616493ce	96714285	1	地铁上偷拍吊带连衣裙妹子的乳头 好大一颗牛奶草莓 旁边的小姑娘一直看我
